questao,gabarito,enunciado,alternativas
26,C,"Morte lenta ao luso infame que inventou a calçada portuguesa. Maldito D. Manuel I e sua corja de tenentesEusébios. Quadrados de pedregulho irregular socados àmão. À mão! É claro que ia soltar, ninguém reparou queia soltar? Branco, preto, branco, preto, as ondas do mar deCopacabana. De que me servem as ondas do mar deCopacabana? Me deem chão liso, sem protuberânciascalcárias. Mosaico estúpido. Mania de mosaico. Jogaconcreto em cima e aplaina. Buraco, cratera, pedra solta,bueiro-bomba. Depois dos setenta, a vida se transformanuma interminável corrida de obstáculos. A queda é amaior ameaça para o idoso. “Idoso”, palavra odienta. Pior,só “terceira idade”. A queda separa a velhice da senilidadeextrema. O tombo destrói a cadeia que liga a cabeça aospés. Adeus, corpo. Em casa, vou de corrimão em corri -mão, tateio móveis e paredes, e tomo banho sentado. Dapoltrona para a janela, da janela para a cama, da camapara a poltrona, da poltrona para a janela. Olha aí, outravez, a pedrinha traiçoeira atrás de me pegar. Um dia eucaio, hoje não. TORRES, F. Fim. São Paulo: Cia. das Letras, 2013. O recurso que caracteriza a organização estrutural desse texto é o( ","['justaposição de sequências verbais e nominais. ', 'mudança de eventos resultante do jogo temporal. ', 'uso de adjetivos qualificativos na descrição do cenário. ', 'encadeamento semântico pelo uso de substantivos sinônimos. ', 'inter-relação entre orações por elementos linguísticos lógicos. Resolução O texto de Fernanda Torres estrutura-se a partir desequências verbais, como “De que me servem as ondas do mar de Copacabana” ou “Joga concreto em cima e aplaina ”, justapostas ou seguidas de sequências nomi - nais como “Branco, preto, branco, preto, as ondas domar de Copaca bana” ou “Mosaico estúpido”. Resposta: AA EENNEEMM -- 11..OODDIIAA-- NNOOVVEEMMBBRR']"
27,B,"A escrava – Admira-me —, disse uma senhora de sentimentos sinceramente abolicionistas —; faz-me até pasmar comose possa sentir, e expressar sentimentos escravocratas, nopresente século, no século dezenove! A moral religiosa ea moral cívica aí se erguem, e falam bem alto esmagandoa hidra que envenena a família no mais sagrado santuárioseu, e desmoraliza, e avilta a nação inteira! Levantai osolhos ao Gólgota, ou percorrei-os em torno da sociedade,e dizei-me: — Para que se deu em sacrifício, o Homem Deus, que ali exalou seu derradeiro alento? Ah! Então não era verdadeque seu sangue era o resgate do homem! É então umamentira abominável ter esse sangue comprado a liber - dade!? E depois, olhai a sociedade... Não vedes o abutreque a corrói constantemente!... Não sentis a desmoraliza - ção que a enerva, o cancro que a destrói? Por qualquer modo que encaremos a escravidão, ela é, e sempre será um grande mal. Dela a decadência docomércio; porque o comércio e a lavoura caminham demãos dadas, e o escravo não pode fazer florescer alavoura; porque o seu trabalho é forçado. REIS, M. F. Úrsula outras obras. Brasília: Câmara dos Deputados, 2018. Inscrito na estética romântica da literatura brasileira, o conto descortina aspectos da realidade nacional no séculoXIX ao ","['revelar a imposição de crenças religiosas a pessoas escravizadas. ', 'apontar a hipocrisia do discurso conservador na defesa da escravidão. ', 'sugerir práticas de violência física e moral em nome do progresso material. ', 'relacionar o declínio da produção agrícola e comercial a questões raciais. ', 'ironizar o comportamento dos proprietários de terra na exploração do trabalho. Resolução O texto descortina aspectos da realidade nacional doséculo XIX, revelando que o discurso conservadorescra vista é hipócrita, pois não se coaduna com umasocie dade que se diz religiosa. Resposta: BB EENNEEMM -- 11..OODDIIAA-- NNOOVVEEMMBBRR']"
28,B,"TEXTO I Projeto Mural Eletrônico desenvolvido no INT, semelhante a um totem, promete tornar o acesso à informação disponível para todos A inclusão de pessoas com deficiência se constituiu um dos principais desafios e preocupações para a sociedadeao longo das últimas décadas. E o uso da tecnologia temse revelado um aliado fundamental em muitas iniciativasvoltadas para essa área. Exemplo disso é uma das recentescriações do Instituto Nacional de Tecnologia (INT) —unidade de pesquisa do Ministério da Ciência,Tecnologia, Inovações e Comunicações (MCTIC). Ali,com o objetivo de que as diferenças entre pessoas nãosejam sinônimo de obstáculos no acesso à informação ouna comunicação, enge nheiros e tecnólogos vêmtrabalhando no desen volvimento do projeto MuralEletrônico. O Mural Eletrônico nasceu da necessidade de promo - ver a inclusão nas escolas. Com interface multimídia einterativa, todos têm a possibilidade de acessar o MuralEletrônico. Por meio do equipamento, podem ser dispo -nibilizados vídeos com Libras, leitura sonora de textos,que também estarão acessíveis em uma plataforma debraille dinâmico, ao lado do teclado. KIFFER, D. Inclusão ampla e Irrestrita. Rio Pesquisa , n. 36, set. 2016 (adaptado). TEXTO II Projeto Surdonews , desenvolvido na UFRJ, garante acesso de surdos à informação e contribui para sua “inclusão científica” Para não permitir que a falta de informação seja um fator para o isolamento e a inacessibilidade da comunidade sur -da, a jornalista e pesquisadora Roberta Savedra Schiaffinocriou o projeto “ Surdonews : montando os quebra-cabeças das notícias para o surdo”. Trata-se de uma página noFacebook, com notícias constantemente atualizadas eapresentadas por surdos em Libras, e veiculadas por meiode vídeos. A ideia de criar o projeto surgiu quando Roberta, ela própria surda profunda, ainda cursava o mestrado. Paraisso, ela procurou traçar um diagnóstico do conhecimentoinformal entre as pessoas com surdez. Ela entrevistoucinquenta alunos surdos do ensino fundamental e viu queeles tinham muita dificuldade de ler, além de não captar anotícia falada. “Isso é muito grave, pois 90% do saber deum indivíduo vem do conhecimento informal, adqui rido EENNEEMM -- 11..OODDIIAA-- NNOOVVEEMMBBRROO//22002222em feiras científicas, conversas, cinema, teatro, incluindo a mídia, por todas as suas possibilidades disse minadoras”,explica a pesquisadora. “Prezamos pelo con teúdocientífico em nossas pautas. Contudo, independen tementedisso, nosso principal trabalho é, além de informar eatualizar, fazer com que os textos não sejam em pobrecidosno processo de ‘tradução’ e, sim, acessíveis”. KIFFER, D. Comunicação sem barreiras. Rio Pesquisa , n. 37, dez. 2016 (adaptado). Considerando-se o tema tecnologias e acessibilidade, os textos I e II aproximam-se porque apresentam projetosque ","['garantem a igualdade entre as pessoas. ', 'foram criados por uma pesquisadora surda. ', 'tiveram origem em um curso de pós-graduação. ', 'estão circunscritos ao espaço institucional da escola. ', 'têm como objetivo a disseminação do conhecimento. Resolução O texto I apresenta o projeto Mural Eletrônico, que tem como objetivo a inclusão das pessoas comdeficiên cia auditiva. O texto II trata do projetoSurdonews , que promove a acessibilidade a pessoas com surdez. Ambos os projetos, portanto, “têm comoobjetivo a disseminação do conhecimento”. Resposta: EE EENNEEMM -- 11..OODDIIAA-- NNOOVVEEMMBBRR']"
29,D,"Mas seu olhar verde, inconfundível, impressionante, iluminava com sua luz misteriosa as sombrias arcadas superciliares, que pareciam queimadas por ela, dizia logoa sua origem cruzada e decantada através das misérias edos orgulhos de homens de aventura, contadores dehistórias fantásticas, e de mulheres caladas e sofredoras,que acompanhavam os maridos e amantes através dasmatas intermináveis, expostas às febres, às feras, àscobras do sertão indecifrável, ameaçador e sem fim, queelas percorriam com a ambição única de um “pouso”onde pudessem viver, por alguns dias, a vida ilusória defamília e de lar, sempre no encalço dos homens,enfebrados pela procura do ouro e do diamante. PENNA, C. Fronteira. Rio de Janeiro: Tecnoprint, s/d. Ao descrever os olhos de Maria Santa, o narrador estabe -lece correlações que refletem a ","['caracterização da personagem como mestiça. ', 'construção do enredo de conquistas da família. ', 'relação conflituosa das mulheres e seus maridos. ', 'nostalgia do desejo de viver como os antepassados. ', 'marca de antigos sofrimentos no fluxo de consciência. Resolução A descrição de Maria Santa, no início do texto, correlaciona seu olhar “impressionante”, “com sua luzmisteriosa” aos “homens de aventura” e ás “mulherescaladas e sofredoras” que se embrenhavam peloterritório nacional à procura de ouro e diamante. Elarepresenta, assim, os “antigos sofrimentos” dessesgarimpeiros desbravadores. O narrador oniscienterelata esses fatos em um único período, simulando ofluxo de consciência da personagem. Resposta: EE EENNEEMM -- 11..OODDIIAA-- NNOOVVEEMMBBRR']"
30,C,"TEXTO I Disponível em: https://amigodobicho.wordpress.com. Acesso em: 10 dez. 2017. TEXTO II Nas ruas, na cidade e no parque Ninguém nunca prendeu o Delegado. O vaivém de rua em rua e sua longa vida são relembrados e recontados.Exemplo de sobrevivência, liderança, inteligência canina,desde pequenininho seu focinho negro e seus olhosdelineados desenharam um mapa mental olfativo-visualde Lavras. Corria de quem precisava correr e seaproximava de quem não lhe faria mal, distinguia estedaquele. Assim, tornou-se um cão comunitário. Nunca sesoube por que escolheu a rua, talvez lhe tenham feito maldentro de quatro paredes. Idoso, teve câncer e desapa -receu. O querido foi procurado pela cidade inteira porduas protetoras, mas nunca encontrado. COSTA, A. R. N. Viver o amor aos cães : Parque Francisco de Assis. Carmo do Cachoeira: Irdin, 2014 (adaptado). Os dois textos abordam a temática de animais de rua, porém, em relação ao Texto I, o Texto II ","['problematiza a necessidade de adoção de animais sem lar. ', 'valida a troca afetiva entre os pets adotados e seus donos. ', 'reforça a importância da campanha de adoção de animais. ', 'exalta a natureza amigável de cães e de gatos. ', 'promove a campanha de adoção de animais. Resolução O texto II nos traz a história de um cão chamado Delegado, que percorre a cidade procurando sobre -viver “corria de quem precisava e se aproximava de EENNEEMM -- 11..OODDIIAA-- NNOOVVEEMMBBRROO//22002222quem não lhe faria mal…”. Segundo o texto, o fato de viver na rua pode ser pro -veniente de maus-tratos em alguma casa que oacolheu. Há, portanto, a problematização da necessi -dade de adoção de animais abandonados. Resposta: AA EENNEEMM -- 11..OODDIIAA-- NNOOVVEEMMBBRR']"
31,A,"É ruivo? Tem olhos azuis? É homem ou mulher? Usa chapéu? Quem jogou Cara a Cara na infância sabe de cor o roteiro de perguntas para adivinhar quem é o perso - nagem misterioso do seu oponente. Agora, o jogo está prestes a ganhar uma nova versão. A designer polonesa Zuzia Kozerska-Girard estádesenvolvendo uma variação do Guess Who? (nome do Cara a Cara em inglês), em que as personalidades do tabuleiro são, na verdade, mulheres notáveis da história eda atualidade, como a artista Frida Kahlo, a ativistaMalala Yousafzai, a astronauta Valentina Tereshkova e aaviadora Amelia Earhart. O Who’ s She? (“Quem é ela?”, em português) traz, no total, 28 mulheres que representamdiversas profissões, nacionalidades e idades. A ideia é que, em vez de perguntar sobre a aparência das personagens, as questões sejam direcionadas aosfeitos delas: ganhou algum Nobel, fez algumadescoberta? Para cada personagem há um cartão comfatos divertidos e interessantes sobre sua vida. Umacampanha entrou no ar com o objetivo de arrecadardinheiro para desenvolver o Who’ s She?. A meta inicial era reunir 17 mil dólares. Oito dias antes de a campanhaacabar, o projeto já angariou quase 350 mil dólares. A chegada do jogo à casa do comprador varia de acordo com a quantia doada — quanto mais você doou,mais rápido vai poder jogar. Disponível em: www.super.abril.com.br. Acesso em: 4 dez. 2018 (adaptado). Ao divulgar a adaptação do jogo para questões relativasa ações e habilidades de mulheres notáveis, o texto busca ","['contribuir para a formação cidadã dos jogadores. ', 'refutar modelos estereotipados de beleza e elegância. ', 'estimular a competitividade entre potenciais compra - dores. ', 'exemplificar estratégias de arrecadação financeira pela internet. ', 'desenvolver conhecimentos lúdicos específicos dos tempos atuais. Resolução O texto apresenta um jogo que destaca os feitos e as realizações de personalidades femininas, “mulheresnotáveis da história e da atualidade”, objetivo opostoao jogo Cara a Cara, que se ocupava apenas de traçosda aparência para que o jogador identificasse o“perso nagem misterioso”. Resposta: AA EENNEEMM -- 11..OODDIIAA-- NNOOVVEEMMBBRR']"
32,A,"Disponível em: www.portaldapropaganda.com.br. Acesso em: 29 out. 2013 (adaptado). Para convencer o público-alvo sobre a necessidade de um trânsito mais seguro, essa peça publicitária apela para o( ","['sentimento de culpa provocado no condutor causador de acidentes. ', 'dano psicológico causado nas vítimas da violência nas estradas. ', 'importância do monitoramento do trânsito pelas autoridades competentes. ', 'necessidade de punição a motoristas alcoolizados envolvidos em acidentes. ', 'sofrimento decorrente da perda de entes queridos em acidentes automobilísticos. Resolução O primeiro quadro da peça publicitária evidencia,tanto pela imagem quanto pelo texto verbal, osentimento de culpa que acomete o responsável poracidente de trânsito. No segundo quadro, a continui -dade dessa estratégia de convencimento é feita com areiteração de que o arrependimento por dirigiralcoolizado dura por toda a vida. Resposta: AA EENNEEMM -- 11..OODDIIAA-- NNOOVVEEMMBBRR']"
33,A,"São vários os fatores, internos e externos, que influenciam os hábitos das pessoas no acesso à internet, assim comonas práticas culturais realizadas na rede. A utilização dastecnologias de informação e comunicação está direta - mente relacionada aos aspectos como: conhecimento deseu uso, acesso à linguagem letrada, nível de instrução,escolaridade, letramento digital etc. Os que detêm taisrecursos (os mais escolarizados) são os que mais acessama rede e também os que possuem maior índice deacumulatividade das práticas. A análise dos dados nospossibilita dizer que a falta de acesso à rede repete asmesmas adversidades e exclusões já verificadas na socie -dade brasileira no que se refere a analfabetos, menosescolarizados, negros, população indígena e desempre - gados. Isso significa dizer que a internet, se não produzdiretamente a exclusão, certamente a reproduz, tendo emvista que os que mais a acessam são justamente os maisjovens, escolarizados, remunerados, trabalha doresqualificados, homens e brancos. SILV A, F. A. B.; ZIVIANE, P.; GHEZZI, D. R. As tecnologias digitais e seus usos . Brasília; Rio de Janeiro: Ipea, 2019 (adaptado). Ao analisarem a correlação entre os hábitos e o perfil socioeconômico dos usuários da internet no Brasil, ospesquisadores ","['apontam o desenvolvimento econômico como solução para ampliar o uso da rede. ', 'questionam a crença de que o acesso à informação é igualitário e democrático. ', 'afirmam que o uso comercial da rede é a causa da exclusão de minorias. ', 'refutam o vínculo entre níveis de escolaridade dificuldade de acesso. ', 'condicionam a expansão da rede à elaboração de políticas inclusivas. Resolução Os dados apresentados questionam o conceito de queo acesso à internet é democrático. Ocorre o contrário:demonstra-se que a desigualdade social e étnica é fatorde exclusão de brasileiros do acesso às tecnologias deinformação. Resposta: BB EENNEEMM -- 11..OODDIIAA-- NNOOVVEEMMBBRR']"
34,D,"TEXTO I A língua não é uma nomenclatura, que se opõe a uma realidade pré-categorizada, ela é que classifica realidade.No léxico, percebe-se, de maneira mais imediata, o fatode que a língua condensa as experiências de um dadopovo. FIORIN, J. L. Língua, modernidade e tradição. Diversitas , n. 2, mar.-set. 2014. TEXTO II As expressões coloquiais ainda estão impregnadas de discriminação contra os negros. Basta recordar algumasdelas, como passar um “dia negro”, ter um “lado negro”,ser a “ovelha negra” da família ou praticar “magia negra”. Disponível em: https:/brasil.elpais.com. Acesso em: 22 maio 2018. O Texto II exemplifica o que se afirma no Texto I, namedida em que defende a idea de que as escolhas lexicaissão resultantes de um ","['expediente próprio do sistema linguístico que nos apresenta diferentes possibilidades para traduzirestados de coisas. ', 'ato inventivo de nomear novas realidades que surgem diante de uma comunidade de falantes de uma língua. ', 'mecanismo de apropriação de formas linguísticas que estão no acervo da formação do idioma nacional. ', 'processo de incorporação de preconceitos que são recorrentes na história de uma sociedade. ', 'recurso de expressão marcado pela objetividade que se requer na comunicação diária. Resolução O texto I defende a ideia de que “a língua condensa asexperiências de um dado povo”. O texto II ilustracomo as expressões coloquiais estão impregnadas depreconceito étnico. Isso se deve ao racismo estruturalexistente no Brasil, decorrente da experiência atroz dolongo período escravagista na história do Brasil. Resposta: DD EENNEEMM -- 11..OODDIIAA-- NNOOVVEEMMBBRR']"
35,C,"Disponível em: www.facebook.com/senadofederal. Acesso em: 9 dez. 2017. Considerando-se a função social dos posts , essa imagem evidencia a apropriação de outro gênero com o objetivode ","['promover o uso adequado de campanhas publicitárias do governo. ', 'divulgar o projeto sobre transparência da administração pública. ', 'responsabilizar o cidadão pelo controle dos gastos públicos. ', 'delegar a gestão de projetos de lei ao contribuinte. ', 'assegurar a fiscalização dos gastos públicos. Resolução Embora seja um post do Facebook, a imagem repro - duz o gênero outdoor , cuja função é divulgar alguma ideia ou marca, lembrando ao leitor que a propagandainstitucional deve conter o valor investido para quehaja transparência dos gastos públicos. Resposta: BB EENNEEMM -- 11..OODDIIAA-- NNOOVVEEMMBBRR']"
36,C,"Pisoteamento, arrastão, empurra-empurra, agressões, vandalismo e até furto a um torcedor que estava caído noasfalto após ter sido atropelado nas imediações do estádiodo Maracanã. As cenas de selvageria tiveram comoestopim a invasão de milhares de torcedores sem ingresso,que furaram o bloqueio policial e transformaram o estádioem terra de ninguém. Um reflexo não só do quadro deinsegurança que assola o Rio de Janeiro, mas também decomo a violência social se embrenha pelo esporte maispopular do país. Em 2017, foram registrados 104 episódiosde violência no futebol brasileiro, que resultaram em 11mortes de torcedores. Desde 1995, quando 101 torcedoresficaram feridos e um morreu durante uma batalha campalno estádio do Pacaembu, autoridades brasileiras têmfocado as ações de enfrentamento à violência no futebolem grupos uniformizados, alguns proibidos de frequentarestádios. Porém, a postura meramente repressiva contratorcidas organizadas é ineficaz em uma sociedade queregistra mais de 61000 homicídios por ano. “É impossíveldissociar a escalada de violência no futebol do panoramade desordem pública, social, econômica e política vividapelo país”, de acordo com um doutor em sociologia doesporte. Disponível em: https://brasil.elpais.com. Acesso em: 22 jun. 2019 (adaptado). Nesse texto, a violência no futebol está caracterizada como um(a) ","['problema social localizado numa região do país.', 'desafio para as torcidas organizadas dos clubes.', 'reflexo da precariedade da organização social no país.', 'inadequação de espaço nos estádios para receber o público. ', 'consequência da insatisfação dos clubes com a organização dos jogos. Resolução A precariedade da organização social fica evidente nasações violentas recorrentes envolvendo futebol e quedemonstram a desordem pública incapaz de conteressa escalada. Resposta: CC EENNEEMM -- 11..OODDIIAA-- NNOOVVEEMMBBRR']"
37,A,"Seis em cada dez pessoas com 15 anos ou mais não praticam esporte ou atividade física. São mais de 100milhões de sedentários. Esses são dados do estudoPráticas de esporte e atividade física , da Pnad 2015, realizado pelo IBGE. A falta de tempo e de interesse sãoos principais motivos apontados para o sedentarismo.Paralelamente, 73,3% das pessoas de 15 anos ou maisafirmaram que o poder público deveria investir emesporte ou atividades físicas. Observou-se uma relaçãodireta entre escolaridade e renda na realização de esportesou atividades físicas. Enquanto 17,3% das pessoas quenão tinham instrução realizavam diversas práticascorporais, esse percentual chegava a 56,7% das pessoascom superior completo. Entre as pessoas que têm práticasde esporte e atividade física regulares, o percentual depraticantes ia de 31,1%, na classe sem rendimento, a65,2%, na classe de cinco salários mínimos ou mais. Afalta de tempo foi mais declarada pela população adulta,com destaque entre as pessoas de 25 a 39 anos. Entre osadolescentes de 15 a 17 anos, o principal motivo foi nãogostarem ou não quererem. Já o principal motivo parapraticar esporte, declarado por 11,2 milhões pessoas, foirelaxar ou se divertir, seguido de melhorar a qualidade devida ou o bem-estar. A falta de instalação esportivaacessível ou nas proximidades foi um motivo poucocitado, demonstrando que a não prática estaria menosassociada à infraestrutura disponível. Disponível em: www.esporte.gov.br. Acesso em: 9 ago. 2017 (adaptado). Com base na pesquisa e em uma visão ampliada de saúde, para a prática regular de exercícios ter influênciasignificativa na saúde dos brasileiros, é necessário odesenvolvimento de estratégias que ","['promovam a melhoria da aptidão da população, dedicando-se mais tempo aos esportes. ', 'combatam o sedentarismo presente em parcela significativa da população no território nacional. ', 'facilitem a adoção da prática de exercícios, com ações relacionadas à educação e à distribuição de renda. ', 'auxiliem na construção de mais instalações esportivas e espaços adequados para a prática de atividades físicase esportes. ', 'estimulem o incentivo fiscal para a iniciativa privada destinar verbas aos programas nacionais de promoçãoda saúde pelo esporte. EENNEEMM -- 11..OODDIIAA-- NNOOVVEEMMBBRROO//22002222Resolução Uma pesquisa, baseada em renda, escolaridade e práticas esportivas, concluiu que os que possuemmaior escolaridade e renda praticam mais atividadesesportivas regulares. Portanto, faz-se necessário odesenvolvimento de estratégias que vinculem renda,escolaridade e prática de exercícios. Resposta: CC EENNEEMM -- 11..OODDIIAA-- NNOOVVEEMMBBRR']"
38,B,"Ciente de que, no campo da criação, as inovações tecnológicas abrem amplo leque de possibilidades – aopermitir, e mesmo estimular, que o artista explore a fundo,em seu processo criativo, questões como a aleatoriedade,o acaso, a não linearidade e a hipermídia –, Leo Cunhacomenta que, no que tange ao campo da divulgação, asalternativas são ainda mais evidentes: “Afinal, é imensaa capacidade de reprodução, multiplicação e compartilha -mento das obras artísticas/culturais. Ao mesmo tempo,ganham dimensão os dilemas envolvidos com a questãoda autoria, dos direitos autorais, da reprodução eintervenção não autorizadas, entre outras questões”. Jásegundo a professora Yacy-Ara Froner, o uso deferramentas tecnológicas não pode ser visto como um fimem si mesmo. Isso porque computadores, samplers , programas de imersão, internet e intranet, vídeo,televisão, rádio, GPD etc. são apenas suportes com osquais os artistas exercem sua imaginação. SILV A JR., M. G. Movidas pela dúvida. Minas faz Ciências , n. 52, dez-fev. 2013 (adaptado). Segundo os autores citados no texto, a expansão de possibilidades no campo das manifestações artísticaspromovida pela internet pode pôr em risco o(a) ","['sucesso dos artistas.', 'valorização dos suportes.', 'proteção da produção estética.', 'modo de distribuição de obras.', 'compartilhamento das obras artísticas. Resolução O trecho “ganham dimensão os dilemas envolvidos [na divulgação de arte pela internet] com a questão deautoria, dos direitos autorais, da reprodução eintervenção não autorizadas” permite entender que adinâmica da web, em que é muito difícil um controle rígido do que é difundido e compartilhado, põe emrisco a “proteção da produção estética”. Resposta: CC EENNEEMM -- 11..OODDIIAA-- NNOOVVEEMMBBRR']"
