questao,gabarito,enunciado,alternativas
1,B,"The average american tosses 300 pounds of food each year, making food the number one contributor to America’s landfills. Eat your leftovers and keep your perishables in the fridge – the Earth is counting on it. Disponível em: https://mir-s3-cdn-cf.behance.net. Acesso em: 29 out. 2021 (adaptado). Esse cartaz de campanha sugere que ","['os lixões precisam de ampliação. ', 'o desperdício degrada o ambiente. ', 'os mercados doam alimentos perecíveis. ', 'a desnutrição compromete o raciocínio. ', 'as residências carecem de refrigeradores.']"
2,B,"No man is an island, Entire of itself; Every man is a piece of the continent, part of the main. [...] Any man’s death diminishes me, Because I am involved in mankind. DONNE, J. The Works of John Donne . Londres: John W. Parker, 1839 (fragmento). Nesse poema, a expressão “ No man is an island ” ressalta o(a) ","['medo da morte. ', 'ideia de conexão. ', 'conceito de solidão. ', 'risco de devastação. ', 'necessidade de empatia.']"
3,D,"Things We Carry on the Sea We carry tears in our eyes: good-bye father, good-bye [mother We carry soil in small bags: may home never fade in our [hearts We carry carnage of mining, droughts, floods, genocides We carry dust of our families and neighbors incinerated [in mushroom clouds We carry our islands sinking under the sea We carry our hands, feet, bones, hearts and best minds [for a new life We carry diplomas: medicine, engineer, nurse, [education, math, poetry, even if they mean [nothing to the other shore We carry railroads, plantations, laundromats, [bodegas, taco trucks, farms, factories, nursing [homes, hospitals, schools, temples... built on [our ancestors’ backs We carry old homes along the spine, new dreams in our [chests We carry yesterday, today and tomorrow We’re orphans of the wars forced upon us We’re refugees of the sea rising from industrial wastes And we carry our mother tongues [...] As we drift... in our rubber boats... from shore... to shore... [to shore.. . PING, W. Disponível em: https://poets.org. Acesso em: 1 jun. 2023 (fragmento). Ao retratar a trajetória de refugiados, o poema recorre à imagem de viagem marítima para destacar o(a) ","['risco de choques culturais. ', 'impacto do ensino de história. ', 'importância da luta ambiental. ', 'existência de experiências plurais. ', 'necessidade de capacitação profissional.*010175AZ2*3 –LC • 1 º DIA • CADERNO 1 • AZUL –']"
4,A,"Spanglish pues estoy creando Spanglish bi-cultural systems scientific lexicographical inter-textual integrations two expressions existentially wired two dominant languages continentally abrazándose in colloquial combate imperio spanglish emerges sobre territorio bi-lingual las novelas mexicanas mixing with radiorocknroll immigrant/migrant nasal mispronouncements hip-hop, street salsa, spanish pop standard english classroom with computer technicalities spanglish is literally perfect LAVIERA, T. Benedición : The Complete Poetry of Tato Laviera. Houston: Arte Público Press, 2014 (fragmento). Nesse poema de Tato Laviera, o eu lírico destaca uma ","['convergência linguístico-cultural. ', 'característica histórico-cultural. ', 'tendência estilístico-literária. ', 'discriminação cultural. ', 'censura musical.']"
5,B,"“Oh, you’ll love working here. Nobody treats you any differently just because of your age, race, or gender.” Disponível em: www.cartoonstock.com. Acesso em: 25 out. 2021. Ao retratar o ambiente de trabalho em um escritório, esse cartum tem por objetivo ","['criticar um padrão de vestimenta. ', 'destacar a falta de diversidade. ', 'indicar um modo de interação. ', 'elogiar um modelo de organização. ', 'salientar o espírito de cooperação.*010175AZ3*4 –LC • 1 º DIA • CADERNO 1 • AZUL –Questões de 01 a 05 (opção espanhol)']"
1,A,"TEXTO I ?PorQUÉ ME CUESTA TANTO ESTUDIAR? pORQUÉ ME CUESTA TANTO CONCENTRARME? PoRQUÉ...... pORQUÉ......? ???...... PORQUé NO CONSIGO APRENDER COMO LOS DEMÁS? ?QUÉ ME PASA?: Disponível em: www.otrasvoceseneducacion.org. Acesso em: 8 nov. 2022. TEXTO II Ishaan Awashi es un niño de 8 años cuyo mundo está plagado de maravillas que nadie más parece apreciar: colores, peces, perros y cometas, que simplemente no son importantes en la vida de los adultos, que parecen más interesados en cosas como los deberes, las notas o la limpieza. E Ishaan parece no poder hacer nada bien en clase. Cuando los problemas que ocasiona superan a sus padres, es internado en un colegio para que le disciplinen. Las cosas no mejoran en el nuevo colegio, donde Ishaan tiene además que aceptar estar lejos de sus padres. Hasta que un día, el nuevo profesor de arte, Ram Shankar Nikumbh, entra en escena, se interesa por el pequeño Ishaan y todo cambia. Disponível em: https://elfinalde.com. Acesso em: 26 out. 2021 (adaptado). O filme Como estrellas en la tierra aborda o tema da dislexia. Relacionando o cartaz do filme com a sinopse, constata-se que o(a) ","['olhar diferenciado para com o outro gera mudanças. ', 'estudante com dislexia apresenta um tom questionador. ', 'abordagem para lidar com a dislexia é pautada na disciplina. ', 'contato com os pais prejudica o acompanhamento da dislexia. ', 'mudança de interesses ocorre na transição da infância para a vida adulta.']"
2,A,"Me niego rotundamente negar mi voz, Mi sangre y mi piel. Y me niego rotundamente dejar de ser yo, dejar de sentirme bien Cuando miro mi rostro en el espejo Con mi boca Rotundamente grande, Y mi nariz Rotundamente hermosa, Y mis dientes Rotundamente blancos, Y mi piel valientemente negra. Y me niego categóricamente dejar de hablar Mi lengua, mi acento y mi historia. Y me niego absolutamente ser parte de los que callan, De los que temen, De los que lloran. Porque me acepto Rotundamente libre, Rotundamente negra, Rotundamente hermosa . CAMPBELL BARR, S. Disponível em: https://negracubanateniaqueser.com. Acesso em: 25 out. 2021. Para enfatizar características e atitudes que reforçam a identidade da mulher negra, o poema da escritora costarriquenha apresenta ","['advérbios como “ rotundamente ” e “categóricamente ”. ', 'verbos reflexivos como “ me niego ” e “me acepto ”. ', 'adjetivos como “ grande ” e “hermosa ”. ', 'substantivos como “ sangre ” e “piel”. ', 'adjetivos possessivos como “ mi” e “mis”.*010175AZ4*5 –LC • 1 º DIA • CADERNO 1 • AZUL –']"
3,E,"“Caramelos” en sus suelos Las tierras de España, tu vista enamoran; sus gentes; te amistan; ¿“cocinas”?, ¡“te molan”! ¿El plato común?, ¡pues «tortilla/patatas»!; en bares, figones, o tascas, ¡las «tapas»!; “sabor nacional”, ¡el «gazpacho», sus «vinos», «sangría», y «jamón» de sabrosos cochinos! (Cual “sellos”, te grabas sus «Típicos Platos»; ¡sabrás por dó pasas, por sólo tu olfato!, ¡si en cada lugar, un sabor peculiar, “al paso” cautiva tu buen paladar!). ¡Son más que “recetas”!, ¡será “alegoría”!, ¡será “identidad”! (¡hay “reserva” en su «Guía»!); son platos allende un “timón conductor”, ¡son mar, ríos, sierras!, ¡son valles, son flor!, ¡y aportan “Conventos” a gastronomía, sus «dulces»! (sabor “celestial”, ¡de ambrosía!). QUIROZ Y LÓPEZ, M. Disponível em: https://pt.calameo.com. Acesso em: 25 out. 2021. Nesse poema, o eu poético enaltece a ","['característica amistosa do povo espanhol. ', 'beleza das paisagens naturais da Espanha. ', 'variedade de pratos na gastronomia espanhola. ', 'relação entre os sentidos do paladar e do olfato na gastronomia. ', 'gastronomia como representação da identidade cultural de um povo.']"
4,B,"Técnicas de manipulación y el resultado Manipular es sembrar en la conciencia y en la mente de la gente ideas, actitudes, conceptos y aspiraciones — incluso falsas e inmorales — que sirvan a los objetivos de sus manipuladores. Manipular es una de las primeras cosas que aprendemos en la vida. A muy temprana edad, los bebés descubren el poder del llanto, el berrinche, los pataleos, la risa o alguna “gracia” como recursos para demandar atención, exigir comida, pedir ayuda o simplemente mantener ocupada a la gente. Nuestras actitudes de adultos reflejan lo mucho o poco que algunos maduraron, procesaron y rebasaron ese periodo. Para que exista un manipulador, debe haber una base de ciudadanos indefensos, dóciles, desinformados. El manipulador es celoso, a veces casi paranoico; no admite cuestionamientos ni quiere que nadie ocupe su espacio, sabe que su vigencia depende de presencia controladora. Todos los días, hay que marcar la línea de discurso, incidir en el debate. El ridículo vale la pena si con ello se logra una cortina de humo. Disponível em: www.forbes.com.mx. Acesso em: 7 out. 2021 (adaptado).Nesse texto, a expressão “ cortina de humo ” revela que o manipulador ","['amadurece tardiamente. ', 'busca mascarar a verdade. ', 'rejeita questionamentos alheios. ', 'aproxima-se de pessoas indefesas. ', 'faz-se presente de forma controladora.']"
5,A,"Que quede claro Cómo es posible que se cierren tantas bocas, tantos ojos, tantas puertas, muchas mentes ante un acto xenofóbico sin precedentes. Presidentes, ministros, cancilleres, autoridades, responsables. ¿Quién pagará el daño causado a familiares? Por un loco del estrada sin modales. [...] Se alejó de aquel lugar donde su color era mucho más que su color, era su raza. Persiguiendo un sueño que desapareció, que se fusionó y terminó en una pesadilla. [...] Déjame que te cuente esta historia que sucedió en el metro de Barcelona, cuando aquella mañana la injusticia y xenofobia se juntaron de la mano, protagonizando una de las más feas escenas de racismo. En aquel vagón viajaba un ángel de color diferente, en su camino se interpuso aquel inconsciente, que aún sabiendo lo que hacía, seguía hablando con su gente. Le dio al ángel dos patadas en su cara, se rió de ella sin cambiar la mirada. Y aún anda suelto, aún anda suelto.. . ORISHAS. In: Cosita buena . Delaware: Suerte Publishing LLC, 2008 (fragmento). letra da canção Que quede claro , da banda cubana Orishas, revela o(a) ","['indignação diante do desrespeito à diversidade. ', 'violência característica das grandes metrópoles. ', 'preconceito da sociedade com relação ao misticismo. ', 'descuido da população com os sonhos dos imigrantes. ', 'falta de segurança existente no transporte público urbano.*010175AZ5*6 –LC • 1 º DIA • CADERNO 1 • AZUL –LINGUAGENS, CÓDIGOS E SUAS TECNOLOGIAS Questões de 06 a 45']"
6,D,"sessão do Comitê Olímpico Internacional (COI) aprovou uma mudança histórica e inédita no lema olímpico, criado em 1894 pelo Barão Pierre de Coubertin para expressar os valores e a excelência do esporte. Mais de 120 anos depois, o lema tem sua primeira alteração para ressaltar a solidariedade e incluir a palavra “juntos”: mais rápido, mais alto, mais forte — juntos. A mudança foi aprovada por unanimidade pelos membros do COI e celebrada pelo presidente da entidade. Disponível em: https://ge.globo.com. Acesso em: 10 nov. 2021 (adaptado). De acordo com o texto, a alteração do lema olímpico teve como objetivo a ","['unificação do lema anterior ao atual. ', 'aproximação entre o lema olímpico e o COI. ', 'junção do lema olímpico com os princípios esportivos. ', 'associação entre o lema olímpico e a cooperatividade. ', 'vinculação entre o lema olímpico e os eventos atléticos.']"
7,A,"Mais iluminada que outras Tenho dois seios, estas duas coxas, duas mãos que me são muito úteis, olhos escuros, estas duas sobrancelhas que preencho com maquiagem comprada por dezenove e noventa e orelhas que não aceitam bijuterias. Este corpo é um corpo faminto, dentado, cruel, capaz e violento. Movo os braços e multidões correm desesperadas. Caminho no escuro com o rosto para baixo, pois cada parte isolada de mim tem sua própria vida e não quero domá-las. Animal da caatinga. Forte demais. Engolidora de espadas e espinhos. Dizem e eu ouvi, mas depois também li, que o estado do Ceará aboliu a escravidão quatro anos antes do restante do país. Todos aqueles corpos que eram trazidos com seus dedos contados, seus calcanhares prontos e seus umbigos em fogo, todos eles foram interrompidos no porto. Um homem — dizem e eu ouvi e depois também li — liderou o levante. E todos esses corpos foram buscar outros incômodos. Foram ser incomodados. ARRAES, J. Redemoinho em dia quente . São Paulo: Alfaguara, 2019. Nesse texto, os recursos expressivos usados pela narradora ","['revelam as marcas da violência de raça e de gênero na construção da identidade. ', 'questionam o pioneirismo do estado do Ceará no enfrentamento à escravidão. ', 'reproduzem padrões estéticos em busca da valorização da autoestima feminina. ', 'sugerem uma atmosfera onírica alinhada ao desejo de resgate da espiritualidade. ', 'mimetizam, na paisagem, os corpos transformados pela violência da escravidão.']"
8,C,"De quem é esta língua? Uma pequena editora brasileira, a Urutau, acaba de lançar em Lisboa uma “antologia antirracista de poetas estrangeiros em Portugal”, com o título Volta para a tua terra . O livro denuncia as diversas formas de racismo a que os imigrantes estão sujeitos. Alguns dos poetas brasileiros antologiados queixam-se do desdém com que um grande número de portugueses acolhe o português brasileiro. É uma queixa frequente. “Aqui em Portugal eles dizem / — eles dizem — / que nosso português é errado, que nós não falamos português”, escreve a poetisa paulista Maria Giulia Pinheiro, para concluir: “Se a sua linguagem, a lusitana, / ainda conserva a palavra da opressão / ela não é a mais bonita do mundo./ Ela é uma das mais violentas”. AGUALUSA, J. E. Disponível em: https://oglobo.globo.com. Acesso em: 22 nov. 2021 (adaptado). O texto de Agualusa tematiza o preconceito em relação ao português brasileiro. Com base no trecho citado pelo autor, infere-se que esse preconceito se deve ","['à dificuldade de consolidação da literatura brasileira em outros países. ', 'aos diferentes graus de instrução formal entre os falantes de língua portuguesa. ', 'à existência de uma língua ideal que alguns falantes lusitanos creem ser a falada em Portugal. ', 'ao intercâmbio cultural que ocorre entre os povos dos diferentes países de língua portuguesa. ', 'à distância territorial entre os falantes do português que vivem em Portugal e no Brasil.*010175AZ6*7 –LC • 1 º DIA • CADERNO 1 • AZUL –']"
9,E,"Na Idade Média, as notícias se propagavam com surpreendente eficácia. Segundo uma emérita professora de Sorbonne, um cavalo era capaz de percorrer 30 quilômetros por dia, mas o tempo podia se acelerar dependendo do interesse da notícia. As ordens mendicantes tinham um papel importante na disseminação de informações, assim como os jograis, os peregrinos e os vagabundos, porque todos eles percorriam grandes distâncias. As cidades também tinham correios organizados e selos para lacrar mensagens e tentar certificar a veracidade das correspondências. Graças a tudo isso, a circulação de boatos era intensa e politicamente relevante. Um exemplo clássico de fake news da era medieval é a história do rei que desaparece na batalha e reaparece muito depois, idoso e transformado. Disponível em: www.elpais.com.br. Acesso em: 18 jun. 2018 (adaptado). propagação sistemática de informações é um fenômeno recorrente na história e no desenvolvimento das sociedades. No texto, a eficácia dessa propagação está diretamente relacionada ao(à) ","['velocidade de circulação das notícias. ', 'nível de letramento da população marginalizada. ', 'poder de censura por parte dos serviços públicos. ', 'legitimidade da voz dos representantes da nobreza. ', 'diversidade dos meios disponíveis em uma época histórica.']"
10,E,"Se a interferência de contas falsas em discussões políticas nas redes sociais já representava um perigo para os sistemas democráticos, sua sofisticação e maior semelhança com pessoas reais têm agravado o problema pelo mundo. O perigo cresceu porque a tecnologia e os métodos evoluíram dos robôs, os “ bots” — softwares com tarefas on-line automatizadas —, para os “ciborgues” ou “trolls ”, contas controladas diretamente por humanos com ajuda de um pouco de automação. Mas pesquisadores começam agora a observar outros padrões de comportamento: quando mensagens não são programadas, sua publicação se concentra só em horários de trabalho, já que é controlada por pessoas cuja profissão é exatamente essa, administrar um perfil falso durante o dia. Outra pista: a pobreza vocabular das mensagens publicadas por esses perfis. Um funcionário de uma empresa que supostamente produzia e vendia perfis falsos explica que às vezes “faltava criatividade” para criar mensagens distintas controlando tantos perfis falsos ao mesmo tempo. GRAGNANI, J. Disponível em: www.bbc.com. Acesso em: 16 dez. 2017.De acordo com o texto, a análise de características da linguagem empregada por perfis automatizados contribui para o(a) ","['controle da atuação dos profissionais de TI. ', 'desenvolvimento de tecnologias como os “ trolls ”. ', 'flexibilização dos turnos de trabalho dos controladores. ', 'necessidade de regulamentação do funcionamento dos “ bots”. ', 'identificação de padrões de disseminação de informações inverídicas.']"
11,D,"Maio foi colorido de amarelo, e o foi porque mundialmente amarelo é a cor convencionada para as advertências. No trânsito, essas advertências têm sido fatais. A estimativa, caso nada seja feito, é a de que se atinjam assustadoras 2,4 milhões de mortes no trânsito em 2030 em todo o mundo. pressa constante, o sentimento de invencibilidade, a certeza de invulnerabilidade, a necessidade de poder, a falta de civilidade, a certeza de impunidade, a ausência de solidariedade, a inexistência de compaixão e o desrespeito por si próprio são circunstâncias reais que, não raro, concorrem para o comportamento violento no trânsito. O Maio Amarelo, que preconiza a atenção pela vida, é uma das iniciativas nesse sentido. E é precisamente a atenção pela vida que está esquecida. Essa atenção, por certo, requer menos pressa, mais civilidade, limites assegurados, consciência de vulnerabilidade, solidariedade, compaixão e respeito por si e pelo outro. Reafirmar e praticar esses princípios e valores talvez seja um caminho mais seguro e menos violento, que garanta a vida e não celebre a morte. Disponível em: http://portaldotransito.com.br. Acesso em: 11 dez. 2018 (adaptado). Considerando os procedimentos argumentativos utilizados, infere-se que o objetivo desse texto é ","['enumerar as causas determinantes da violência no trânsito. ', 'contextualizar a campanha de advertência no cenário mundial. ', 'divulgar dados numéricos alarmantes sobre acidentes de trânsito. ', 'sensibilizar o público para a importância de uma direção responsável. ', 'restringir os problemas da violência no trânsito a aspectos emocionais.*010175AZ7*8 –LC • 1 º DIA • CADERNO 1 • AZUL –']"
12,C,"Ainda daquela vez pude constatar a bizarrice dos costumes que constituíam as leis mais ou menos constantes do seu mundo: ao me aproximar, verifiquei que o Sr. Timóteo, gordo e suado, trajava um vestido de franjas e lantejoulas que pertencera a sua mãe. O corpete descia-lhe excessivamente justo na cintura, e aqui e ali rebentava através da costura um pouco da carne aprisionada, esgarçando a fazenda e tornando o prazer de vestir-se daquele modo uma autêntica espécie de suplício. Movia-se ele com lentidão, meneando todas as suas franjas e abanando-se vigorosamente com um desses leques de madeira de sândalo, o que o envolvia numa enjoativa onda de perfume. Não sei direito o que colocara sobre a cabeça, assemelhava-se mais a um turbante ou a um chapéu sem abas de onde saíam vigorosas mechas de cabelos alourados. Como era costume seu também, trazia o rosto pintado — e para isto, bem como para suas vestimentas, apoderara-se de todo o guarda-roupa deixado por sua mãe, também em sua época famosa pela extravagância com que se vestia — o que sem dúvida fazia sobressair-lhe o nariz enorme, tão característico da família Meneses. CARDOSO, L. Crônica da casa assassinada . São Paulo: Círculo do Livro, s.d. Pela voz de uma empregada da casa, a descrição de um dos membros da família exemplifica a renovação da ficção urbana nos anos 1950, aqui observada na ","['opção por termos e expressões de sentido ambíguo. ', 'crítica social inspirada pelo convívio com os patrões. ', 'descrição impressionista do fetiche do personagem. ', 'presença de um foco narrativo de caráter impreciso. ', 'ambiência de mistério das relações entre familiares.']"
13,C,"Girassol da madrugada Teu dedo curioso me segue lento no rosto Os sulcos, as sombras machucadas por onde a [vida passou. Que silêncio, prenda minha... Que desvio triunfal [da verdade, Que círculos vagarosos na lagoa em que uma asa [gratuita roçou... Tive quatro amores eternos... O primeiro era moça donzela, O segundo... eclipse, boi que fala, cataclisma, O terceiro era a rica senhora, O quarto és tu... E eu afinal me repousei dos [meus cuidados ANDRADE, M. Poesias completas . Rio de Janeiro: Nova Fronteira, 2013 (fragmento). Perante o outro, o eu lírico revela, na força das memórias evocadas, a ","['vergonha das marcas provocadas pela passagem do tempo. ', 'indecisão em face das possibilidades afetivas do presente. ', 'serenidade sedimentada pela entrega pacífica ao desejo. ', 'frustração causada pela vontade de retorno ao passado. ', 'disponibilidade para a exploração do prazer efêmero.*010175AZ8*9 –LC • 1 º DIA • CADERNO 1 • AZUL –']"
14,D,"Dão Lalalão Do povoado do Ão, ou dos sítios perto, alguém precisava urgente de querer vir por escutar a novela do rádio. Ouvia-a, aprendia-a, guardava na ideia, e, retornado ao Ão, no dia seguinte, a repetia a outros. Assim estavam jantando, vinham os do povoado receber a nova parte da novela do rádio. Ouvir já tinham ouvido tudo, de uma vez, fugia da regra: falhara ali no Ão, na véspera, o caminhão de um comprador de galinhas e ovos, seo Abrãozinho Buristém, que carregava um rádio pequeno, de pilhas, armara um fio no arame da cerca... Mas queriam escutar outra vez, por confirmação. — “A estória é estável de boa, mal que acompridada: taca e não rende...” — explicava o Zuz ao Dalberto. Soropita começou a recontar o capítulo da novela. Sem trabalho, se recordava das palavras, até com clareza — disso se admirava. Contava com prazer de demorar, encher a sala com o poder de outros altos personagens. Tomar a atenção de todos, pudesse contar aquilo noite adiante. Era preciso trazer luz, nem uns enxergavam mais os outros; quando alguém ria, ria de muito longe. O capítulo da novela estava terminando. ROSA, J. G. Noites do sertão (Corpo de baile) . São Paulo: Global, 2021. Nesse trecho do conto, o gosto dos moradores do povoado por ouvir a novela de rádio recontada por Soropita deve-se ao(à) ","['qualidade do som do rádio. ', 'estabilidade do enredo contado. ', 'ineditismo do capítulo da novela. ', 'jeito singular de falar aos ouvintes. ', 'dificuldade de compreensão da história.']"
15,B,"As cinzas do Museu Nacional, no Rio de Janeiro, consumido pelas chamas no mês de setembro de 2018, são mais do que restos de fósseis, cerâmicas e espécimes raros. O museu abrigava, entre mais de 20 milhões de peças, os esqueletos com as respostas para perguntas que ainda não haviam sido respondidas — ou sequer feitas — por pesquisadores brasileiros. E o incêndio pode ter calado para sempre palavras e cantos indígenas ancestrais, de línguas que não existem mais no mundo. O acervo do local continha gravações de conversas, cantos e rituais de dezenas de sociedades indígenas, muitas feitas durante a década de 1960 com antigos gravadores de rolo e que ainda não haviam sido digitalizadas. Alguns dos registros abordavam línguas já extintas, sem falantes originais ainda vivos. “A esperança é que outras instituições tenham registros dessas línguas”, diz a linguista Marilia Facó Soares. A pesquisadora, que trabalha com os índios Tikuna, o maior grupo da Amazônia brasileira, crê ter perdido parte de seu material. “Terei que fazer novas viagens de campo para recompor meus arquivos. Mas obviamente não dá para recuperar a fala de nativos já falecidos, geralmente os mais idosos”, lamenta. Disponível em: https://brasil.elpais.com. Acesso em: 10 dez. 2018 (adaptado). perda dos registros linguísticos no incêndio do Museu Nacional tem impacto potencializado, uma vez que ","['exige a retomada das pesquisas por especialistas de diferentes áreas. ', 'representa danos irreparáveis à memória e à identidade nacionais. ', 'impossibilita o surgimento de novas pesquisas na área. ', 'resulta na extinção da cultura de povos originários. ', 'inviabiliza o estudo da língua do povo Tikuna.*010175AZ9*10 –LC • 1 º DIA • CADERNO 1 • AZUL –']"
