questao,gabarito,enunciado,alternativas,enem_ano
35,D,"Reaprender a ler notícias Não dá mais para ler um jornal, revista ou assistir a um telejornal da mesma forma que fazíamos até o surgimentoda rede mundial de computadores. O Observatório da Imprensa antecipou isso lá nos idos de 1996 quando cunhou o slogan “V ocê nunca mais vai ler jornal do mesmo jeito”. De fato, hoje já não basta mais ler o que está escrito ou falado para estar bem informado. É preciso conhecer as entrelinhas e saber que não há objetividade e nem isenção absolutas, porque cada serhumano vê o mundo de uma forma diferente. Ter um péatrás passou a ser a regra básica número um de quempassa os olhos por uma primeira página, capa de revistaou chamadas de um noticiário na TV . Há uma diferença importante entre desconfiar de tudo e procurar ver o maior número possível de lados de ummesmo fato, dado ou evento. Apenas desconfiar nãoresolve porque se trata de uma atitude passiva. É claro,tudo começa com a dúvida, mas a partir dela é necessárioser proativo, ou seja, investigar, estudar, procurar oselementos ocultos que sempre existem numa notícia. Nocomeço é um esforço solitário que pode se tornar coletivoà medida que mais pessoas descobrem sua vulnera -bilidade informativa. Disponível em: www.observatoriodaimprensa.com.br. Acesso em 30 set. 2015 (adaptado). No texto, os argumentos apresentados permitem inferir que o objetivo do autor é convencer os leitores a ","['buscarem fontes de informação comprometidas com a verdade. ', 'privilegiarem notícias veiculadas em jornais de grande circulação. ', 'adotarem uma postura crítica em relação às informações recebidas. ', 'questionarem a prática jornalística anterior ao surgimento da internet. ', 'valorizarem reportagens redigidas com imparcialidade diante dos fatos. EENNEEMM -- 11..OODDIIAA-- NNOOVVEEMMBBRROO//22002211']",2021
36,B,"Não que Pelino fosse químico, longe disso; mas era sábio, era gramático. Ninguém escrevia em Tubiacangaque não levasse bordoada do Capitão Pelino, e mesmoquando se falava em algum homem notável lá no Rio, elenão deixava de dizer: “Não há dúvida! O homem temtalento, mas escreve: ‘um outro’, ‘de resto’...” E contraíaos lábios como se tivesse engolido alguma cousa amarga. Toda a vila de Tubiacanga acostumou-se a respeitar o solene Pelino, que corrigia e emendava as maiores glóriasnacionais. Um sábio... Ao entardecer, depois de ler um pouco o Sotero, o Candido de Figueiredo ou o Castro Lopes, e de terpassado mais uma vez a tintura nos cabelos, o velhomestre-escola saía vagarosamente de casa, muito abotoa -do no seu paletó de brim mineiro, e encaminhava-se paraa botica do Bastos a dar dous dedos de prosa. Conversaré um modo de dizer, porque era Pelino avaro de palavras,limitando-se tão-somente a ouvir. Quando, porém, doslábios de alguém escapava a menor incorreção delinguagem, intervinha e emendava. “Eu asseguro, dizia oagente do Correio, que…” Por aí, o mestre-escolaintervinha com mansuetude evangélica: “Não diga‘asseguro’, Senhor Bernardes; em português é garanto”. E a conversa continuava depois da emenda, para ser de novo interrompida por uma outra. Por essas e outras,houve muitos palestradores que se afastaram, mas Pelino,indiferente, seguro dos seus deveres, continuava o seuapostolado de vernaculismo. BARRETO, L. A Nova Califórnia. Disponível em: www.dominiopublico.gov.br. Acesso em: 24 jul. 2019. Do ponto de vista linguístico, a defesa da norma-padrão pelo personagem caracteriza-se por ","['contestar o ensino de regras em detrimento do conteúdo das informações. ', 'resgatar valores patrióticos relacionados às tradições da língua portuguesa. ', 'adotar uma perspectiva complacente em relação aos desvios gramaticais. ', 'invalidar os usos da língua pautados pelos preceitos da gramática normativa. ', 'desconsiderar diferentes níveis de formalidade nas situações de comunicação. EENNEEMM -- 11..OODDIIAA-- NNOOVVEEMMBBRROO//22002211']",2021
37,A,"A história do futebol brasileiro contém, ao longo de um século, registros de episódios racistas. Eis o paradoxo:se, de um lado, a atividade futebolística era depreciadaaos olhos da “boa sociedade” como profissão destinadaaos pobres, negros e marginais, de outro, achava-seinvestida do poder de representar e projetar a nação emescala mundial. A Copa do Mundo no Brasil, em 1950,viria a se constituir, nesse sentido, em uma raraoportunidade. Contudo, na decisão contra o Uruguaisobreveio o inesperado revés. As crônicas esportivaselegiam o goleiro Barbosa e o defensor Bigode comobodes expiatórios, “descarregando nas costas” dosjogadores os “prejuízos’ da derrota. Uma chibata moral,eis a sentença proferida no tribunal dos brancos. Nos anos1970, por não atender às expectativas normativassuscitadas pelo estereótipo do “bom negro”, Paulo CésarLima foi classificado como “jogador-problema”. Eleesboçava a revolta da chibata no futebol brasileiro.Enquanto Barbosa e Bigode, sem alternativa, suportaramo linchamento moral na derrota de 1950, Paulo Césarcontra-atacava os que pretendiam condená-lo peloinsucesso de 1974. O jogador assumia as cores e as causasdefendidas pela esquadra dos pretos em todas as esferasda vida social. “Sinto na pele esse racismo subjacente”,revelou à imprensa francesa: Isto é, ninguém ousapronunciar a palavra ‘racismo’. Mas posso garantir queele existe, mesmo na Seleção Brasileira”. Sua ousadiaconsistiu em pronunciar a palavra interdita no espaçosimbólico do discurso oficial para reafirmar o mito dademocracia racial. Disponível em: https://observatorioracialfutebol.com.br. Acesso em: 22 jun. 2019 (adaptado). O texto atribui o enfraquecimento do mito da democracia racial no futebol à ","['responsabilização de jogadores negros pela derrota na final da Copa de 1950. ', 'projeção mundial da nação por um esporte antes destinado aos pobres. ', 'depreciação de um esporte associado à marginalidade.', 'interdição da palavra “racismo” no contexto esportivo.', 'atitude contestadora de um “jogador-problema”. EENNEEMM -- 11..OODDIIAA-- NNOOVVEEMMBBRROO//22002211']",2021
38,C,"MEIRELLES, V . Moema. Óleo sobre tela, 129 cm x 190 cm. Masp, São Paulo, 1866. Disponível em: www.masp.art.br. Acesso em: 13 ago. 2012 (adaptado). Nessa obra, que retrata uma cena de Caramuru , célebre poema épico brasileiro, a filiação à estética românticamanifesta-se na ","['exaltação do retrato fiel da beleza feminina.', 'tematização da fragilidade humana diante da morte.', 'ressignificação de obras do cânone literário nacional.', 'representação dramática e idealizada do corpo da índia.', 'oposição entre a condição humana e a natureza primi - tiva. ']",2021
39,A,"Coincidindo com o Dia Internacional dos Direitos da Infância, foram apresentados diversos trabalhos quemostram as mudanças que afetam a vida das crianças. Umdesses estudos compara o que sonham e brincam ascrianças hoje em relação às dos anos 1990. E o que sedescobriu é que as crianças têm agora menos lazer e estãomais sobrecarregadas por deveres e atividades extracurri -culares do que as de 25 anos atrás. As crianças de hojenão só dedicam menos tempo para brincar, como também,quando brincam, a maioria não o faz com outras criançasno parque, na rua ou na praça, mas em casa e muitas vezessozinhas. E já não brincam tanto com brinquedos, mascom aparelhos eletrônicos, entre os quais predomina ojogo individual com a máquina. OLIV A, M. P. O direto das crianças ao lazer... e a crescer sem carências. El Pais , 20 nov. 2015 (adaptado). O texto indica que as transformações nas experiências lúdicas na infância ","['fomentaram as relações sociais entre as crianças.', 'tomaram o lazer uma prática difundida entre as crianças. ', 'incentivaram a criação de novos espaços para se divertir. ', 'promoveram uma vivência corporal menos ativa.', 'contribuíram para o aumento do tempo dedicado para brincar. ']",2021
40,C,"TEXTO I Correu à sala dos retratos, abriu o piano, sentou-se e espalmou as mãos no teclado. Começou a tocar algumacoisa própria, uma inspiração real e pronta, uma polca,uma polca buliçosa, como dizem os anúncios. Nenhumarepulsa da parte do compositor; os dedos iam arrancandoas notas, ligando-as, meneando-as; dir-se-ia que a musacompunha e bailava a um tempo. [...] Compunha só,teclando ou escrevendo, sem os vãos esforços da véspera,sem exasperação, sem nada pedir ao céu, sem interrogaros olhos de Mozart. Nenhum tédio. Vida, graça, novidade,escorriam-lhe da alma como de uma fonte perene. ASSIS, M. Um homem célebre. Disponível em: www.biblio.com.br. Acesso em: 2 jun. 2019. Texto II Um homem célebre expõe o suplício do músico popular que busca atingir a sublimidade da obra-primaclássica, e com ela a galeria dos imortais, mas que é traídopor uma disposição interior incontrolável que o empurraimplaca velmente na direção oposta. Pestana, célebre nossaraus, salões, bailes e ruas do Rio de Janeiro por suascomposições irresistivelmente dançantes, esconde-se dosrumores à sua volta num quarto povoado de ícones dagrande música europeia, mergulha nas sonatas doclassicismo vienense, prepara-se para o supremo saltocriativo e, quando dá por si, é o autor de mais umainelutável e saltitante polca. WISNIK. J. M. Machado maxixe: o caso Pestana. Teresa: revista de literatura brasileira, 2004 (adaptado). O conto de Machado de Assis faz uma referência velada ao maxixe, gênero musical inicialmente associado àescravidão e à mestiçagem. No Texto II, o conflito dopersonagem em compor obras do gênero é representativoda ","['pouca complexidade musical das composições ajustadas ao gosto do grande público. ', 'prevalência de referências musicais africanas no imaginário da população brasileira. ', 'incipiente atribuição de prestígio social a músicas instrumentais feitas para a dança. ', 'tensa relação entre o erudito e o popular na constituição da música brasileira. ', 'importância atribuída à música clássica na sociedade brasileira do século XIX. EENNEEMM -- 11..OODDIIAA-- NNOOVVEEMMBBRROO//22002211']",2021
41,D,"Devagar, devagarinho Desacelerar é preciso. Acelerar não é preciso. Afobados e voltados para o próprio umbigo, operamos,automatizados, falas robóticas e silêncios glaciais. Ilustrabem esse estado de espírito a música Sinal fechado (1969), de Paulinho da Viola. Trata-se da história de doissujeitos que se encontram inesperadamente em um sinalde trânsito. A conversa entre ambos, porém, se deu rápidae rasteira. Logo, os personagens se despedem, com apromessa de se verem em outra oportunidade. Percebe-se um registro de comunicação vazia e superficial, cujatônica foi o contato ligeiro e superficial construído pelosinterlocutores: “Olá, como vai? / Eu vou indo, e você,tudo bem? / Tudo bem, eu vou indo correndo, / pegarmeu lugar no futuro. E você? / Tudo bem, eu vou indo embusca de um sono / tranquilo, quem sabe? / Quantotempo... / Pois é, quanto tempo... / Me perdoe a pressa /é a alma dos nossos negócios... / Oh! Não tem de quê. /Eu também só ando a cem”. O culto à velocidade, no contexto apresentado, se coloca como fruto de um imediatismo processual quecelebra o alcance dos fins sem dimensionar a qualidadedos meios necessários para atingir determinadopropósito. Tal conjuntura favorece a lei do menor esforço— a comodidade — e prejudica a lei do maior esforço —a dignidade. Como modelo alternativo à cultura fast, temos o movimento slow life , cujo propósito, resumidamente, é conscientizar as pessoas de que a pressa é inimiga daperfeição e do prazer, buscando assim reeducar seussentidos para desfrutar melhor os sabores da vida. SILV A, M. F. L. Boletim UFMG , n. 1 749, set. 2011 (adaptado). Nesse artigo de opinião, a apresentação da letra da canção Sinal fechado é uma estratégia argumentativa que visa sensibilizar o leitor porque ","['adverte sobre os riscos que o ritmo acelerado da vida oferece. ', 'exemplifica o fato criticado no texto com uma situação concreta. ', 'contrapõe situações de aceleração e de serenidade na vida das pessoas. ', 'questiona o clichê sobre a rapidez e a aceleração da vida modema. ', 'apresenta soluções para a cultura da correria que as pessoas vivenciam hoje. EENNEEMM -- 11..OODDIIAA-- NNOOVVEEMMBBRROO//22002211']",2021
42,C,"O documentário O menino que fez um museu , direção de Sérgio Utsch, produção independente de brasileiros ebritânicos, gravado no Nordeste em 2016, maisprecisamente no distrito Dom Quintino, zona rural doCrato, foi premiado em Londres, pela Foreign Press Association (FPA), a associação de correspondentes estrangeiros mais antiga do mundo, fundada em 1888. De acordo com o diretor, O menino que fez um museu foi o único trabalho produzido por equipes fora do eixoEstados Unidos-Europa entre os finalistas. O documen -tário conta a história de um Brasil profundo,desconhecido até mesmo por muitos brasileiros. Éapresentado com o carisma de Pedro Lucas Feitosa, 11anos. Quando tinha 10 anos, Pedro Lucas criou o Museu de Luiz Gonzaga, que fica no distrito de Dom Quintino. Aideia surgiu após uma visita que o garoto fez, em 2013,quando tinha 8 anos, ao Museu do Gonzagão, em Exu,Pernambuco. Pedro decidiu criar o próprio lugar deexposição para homenagear o rei e o local escolhido foia casa da sua bisavó já falecida, que fica ao lado da casadele, na rua Alto de Antena. Disponível em: www.opovo.com.br. Acesso em: 18 abr. 2018. No segundo parágrafo, uma citação afirma que o documentário “foi o único trabalho produzido por equipesfora do eixo Estados Unidos-Europa entre os finalistas”.No texto, esse recurso expressa uma estratégia argu -mentativa que reforça a ","['originalidade da iniciativa de homenagem à vida e à obra de Luiz Gonzaga. ', 'falta de concorrentes ao prêmio de uma das associações mais antigas do mundo. ', 'proeza da premiação de uma história ambientada no interior do Nordeste brasileiro. ', 'escassez de investimentos para a produção cinematográfica independente no país. ', 'importância da parceria entre brasileiros e britânicos para a realização das filmagens. EENNEEMM -- 11..OODDIIAA-- NNOOVVEEMMBBRROO//22002211']",2021
43,D,"A volta do marido pródigo — Bom dia, seu Marrinha! Como passou de ontem?— Bem. Já sabe, não é? Só ganha meio dia. [...]Lá além, Generoso cotuca Tercino:— [...] Vai em festa, dorme que-horas, e, quando chega, ainda é todo enfeitado e salamistrão!... — Que é que hei de fazer, seu Marrinha... Amanheci com uma nevralgia... Fiquei com cisma de apanharfriagem... — Hum...— Mas o senhor vai ver como eu toco o meu serviço e ainda faço este povo trabalhar... [...]Pintão suou para desprender um pedrouço, e teve de pular para trás, para que a laje lhe não esmagasse um pé.Pragueja: — Quem não tem brio engorda!— É... Esse sujeito só é isso, e mais isso... — opina Sidu. —Também, tudo p’ra ele sai bom, e no fim dá certo... — diz Correia, suspirando e retomando o enxadão. —“P’ra uns, as vacas morrem ... p’ra outros até boi pega aparir...”. Seu Marra já concordou:— Está bem, seu Laio, por hoje, como foi por doença, eu aponto o dia todo. Que é a última vez!... E agora, deixade conversa fiada e vai pegando a ferramenta! ROSA, J. G. Sagarana. Rio de Janeiro: José Olympio, 1967. Esse texto tem importância singular como patrimônio linguístico para a preservação da cultura nacional devido ","['à menção a enfermidades que indicam falta de cuidado pessoal. ', 'à referência a profissões já extintas que caracterizam a vida no campo. ', 'aos nomes de personagens que acentuam aspectos de sua personalidade. ', 'ao emprego de ditados populares que resgatam memórias e saberes coletivos. ', 'às descrições de costumes regionais que desmistificam crenças e superstições. EENNEEMM -- 11..OODDIIAA-- NNOOVVEEMMBBRROO//22002211']",2021
44,D,"Um asteroide de cerca de um mil metros de diâmetro, viajando a 288 mil quilômetros por hora, passou a umadistância insignificante — em termos cósmicos — daTerra, pouco mais do dobro da distância que nos separa daLua. Segundo os cálculos matemáticos, o asteroidecruzou a órbita da Terra e somente não colidiu porque elanão estava naquele ponto de interseção. Se ele tivesse sidocapturado pelo campo gravitacional do nosso planeta ecolidido, o impacto equivaleria a 40 bilhões de toneladasde TNT, ou o equivalente à explosão de 40 mil bombas dehidrogênio, conforme calcularam os computadoresoperados pelos astrônomos do programa de Exploraçãodo Sistema Solar da Nasa; se caísse no continente, abririauma cratera de cinco quilômetros, no mínimo, e destruiriatudo o que houvesse num raio de milhares de outros; sedesabasse no oceano, provocaria maremotos quedevastariam imensas regiões costeiras. Enfim, uma visãodo Apocalipse. Disponível em: http://bdjur.stj.jus.br. Acesso em: 23 abr. 2010. Qual estratégia caracteriza o texto como uma notíciaalarmante? ","['A descrição da velocidade do asteroide.', 'A recorrência de formulações hipotéticas.', 'A referência à opinião dos astrônomos.', 'A utilização da locução adverbial “no mínimo”.', 'A comparação com a distância da Lua à Terra. ']",2021
46,B,"(Disponível em: www.cdcc.usp.br. Acesso em: 27 jul. 2010. Adaptado). Considerando as informações apresentadas, o prédio do Congresso Nacional, em Brasília, no dia 21 de junho, às12 horas, projetará sua sombra para a direção ","['norte.', 'sul.', 'leste.', 'oeste.', 'nordeste. ']",2021
47,A,"TEXTO I EIGENHEER, E. M. Lixo : a limpeza urbana através dos tempos. Porto Alegre: Gráfica Palioti, 2009. TEXTO II A repugnante tarefa de carregar lixo e os dejetos da casa para as praças e praias era geralmente destinada ao únicoescravo da família ou ao de menor status ou valor. Todasas noites, depois das dez horas, os escravos conhecidospopularmente como “tigres” levavam tubos ou barris deexcremento e lixo sobre a cabeça pelas ruas do Rio. KARASCH. M. C. A vida dos escravos no Rio de Janeiro , 1808-1950 . Rio de Janeiro: Cia. das Letras, 2000. A ação representada na imagem e descrita no texto evidencia uma prática do cotidiano nas cidades no Brasilnos séculos XVIII e XIX caracterizada pela ","['valorizaçao do trabalho braçal.', 'reiteração das hierarquias sociais.', 'sacralização das atividades laborais.', 'superação das exclusões econômicas.', 'ressignificação das heranças religiosas. ']",2021
48,D,"O torém dependia de organização familiar, sendo brincado por pessoas com vínculos de parentesco eafinidade que viviam no local. Era visto como umabrincadeira, um entretenimento feito para os própriosparticipantes e seus conhecidos. O tempo do caju era opretexto para sua realização, sendo chamadas váriaspessoas da região a fim de tomar mocororó, bebidafermentada do caju. V ALLE. C. G. O. Torém/Toré: tradições e invenção no quadro de multiplicidade étnica do Ceará contemporâneo. In: GRÜNEWALD. R. A. (Org.). Toré : regime encantado dos índios do Nordeste. Recife: Fundaj-Massangana. 2005. O ritual mencionado no texto atribui à manifestação cultural de grupos indígenas do Nordeste brasileiro afunção de ","['celebrar a história oficial.', 'estimular a coesão social.', 'superar a atividade artesanal.', 'manipular a memória individual.', 'modernizar o comércio tradicional. ']",2021
49,C,"Escravo fugido. Jornal Correio Paulistano , 13 da abril de 1879. Disponível em: http/bndigital.bn.gov.br. Acesso em: 2 ago. 2019 (adaptado). No anúncio publicado na segunda metade do século XIX, qual a estratégia de resistência escrava apresentada? ","['Criação de relações de trabalho.', 'Fundação de territórios quilombolas.', 'Suavização da aplicação de normas.', 'Regularização das funções remuneradas.', 'Constituição de economia de subsistência. ']",2021
50,B,"A filosofia é como uma árvore, cujas raízes são a metafísica; o tronco, a física, e os ramos que saem dotronco são todas as outras ciências, que se reduzem a trêsprincipais: a medicina, a mecânica e a moral, entendendopor moral a mais elevada e a mais perfeita porquepressupõe um saber integral das outras ciências, e é oúltimo grau da sabedoria. DESCARTES, R. Princípios da filosofia . Lisboa: Edições 70, 1997 (adaptado). Essa construção alegórica de Descartes, acerca da condição epistemológica da filosofia, tem como objetivo ","['sustentar a unidade essencial do conhecimento.', 'refutar o elemento fundamental das crenças.', 'impulsionar o pensamento especulativo.', 'recepcionar o método experimental.', 'incentivar a suspensão dos juízos. ']",2021
51,A,"Minha fórmula para o que há de grande no indivíduo é amor fati : nada desejar além daquilo que é, nem diante de si, nem atrás de si, nem nos séculos dos séculos. Nãose contentar em suportar o inelutável, e ainda menosdissimulá-lo, mas amá-lo. NIETZSCHE apud FERRY L. Aprender a viver : filosofia para os novos tempos. Rio da Janeiro Objetiva. 2010 (adaptado). Essa fórmula indicada por Nietzsche consiste em uma crítica à tradição cristã que ","['combate as práticas sociais de cunho afetivo.', 'impede o avanço científico no contexto moderno.', 'associa os cultos pagãos à sacralização da natureza.', 'condena os modelos filosóficos da Antiguidade Clássica. ', 'consagra a realização humana ao campo transcen - dental. ']",2021
52,D,"É preciso usar de violência e rebater varonilmente os apetites dos sentidos sem atender ao que a carne quer ounão quer, mas trabalhando por sujeitá-la ao espírito, aindaque se revolte. Cumpre castigá-la e curvá-la à sujeição, atal ponto que esteja disposta para tudo, sabendo contentar-se com pouco e deleitar-se com a simplicidade, semresmungar por qualquer incômodo. KEMPIS, T. Imitação de Cristo . Petrópolis; V ozes. 2015. Qual característica do ascetismo medieval é destacada no texto? ","['Exaltação do ritualismo litúrgico.', 'Afirmação do pensamento racional.', 'Desqualificação da atividade laboral.', 'Condenação da alimentação impura.', 'Desvalorização da materialidade corpórea. ']",2021
53,B,"Numa sociedade em transição, a marcha da mudança, em diferentes graus, está impressa em todos os aspectos daordem social, especialmente no jogo político, que nessassociedades sempre apresenta padrões característicos deambivalência, cujas raízes sociais se encontram nacoexistência de dois padrões de estrutura social: o padrãotradicional, em declínio, e o novo, emergente, emexpansão. Em tais situações, é possível encontrar,simultaneamente, apoio para uma orientação política oupara outra que seja exatamente o seu oposto. O padrãoambivalente do processo político, nas sociedades emdesenvolvimento, é o que explica um dos seus traços maissalientes, e que consiste na tendência ao adiamento dasgrandes decisões. Resulta daí que a inércia política ou aconvulsão política podem se suceder uma à outra emperíodos surpreendentemente curtos. PINTO, L A. C. Sociologia e desenvolvimento . Rio de Janeiro: Civilização Brasileira, 1975 (adaptado). De acordo com a perspectiva apresentada, central no pensamento social brasileiro dos anos 1950 e 1960, odesenvolvimento do país foi marcado por ","['radicalidade nas agendas de reforma das elites dirigentes. ', 'anomalias na execução dos planos econômicos ortodoxos. ', 'descompassos na construção de quadros institucionais modernos. ', 'ilegitimidade na atuação dos movimentos de representação classista. ', 'vagarosidade na dinâmica de aperfeiçoamento dos programas partidários. ']",2021
54,C,"Manifesto dos Pioneiros da Educação Nova — 1932 A Educação Nova, alargando a sua finalidade para além dos limites das classes, assume, com uma feição maishumana, a sua verdadeira função social, preparando-separa formar “a hierarquia democrática” pela “hierarquiadas capacidades”, recrutadas em todos os grupos sociais,a que se abrem as mesmas oportunidades de educação.Ela tem, por objeto, organizar e desenvolver os meios deação durável com o fim de “dirigir os desenvolvimentosnatural e integral do ser humano em cada uma das etapasde seu crescimento”, de acordo com uma certa concepçãodo mundo. Disponível em: www.histedbr.fe.unicamp.br. Acesso em: 7 out. 2015. Os autores do manifesto citado procuravam contrapor-se ao caráter oligárquico da sociedade brasileira. Nessesentido, o trecho propõe uma relação necessária entre ","['ensino técnico e mercado de trabalho.', 'acesso à escola e valorização do mérito.', 'ampliação de vagas e formação de gestores.', 'disponibilidade de financiamento e pesquisa avançada.', 'remuneração de professores e extinção do analfabe - tismo. ']",2021
55,E,"Sócrates: “Quem não sabe o que uma coisa é, como poderia saber de que tipo de coisa ela é? Ou te parece serpossível alguém que não conhece absolutamente quem éMênon, esse alguém saber se ele é belo, se é rico e aindase é nobre? Parece-te ser isso possível? Assim, Mênon,que coisa afirmas ser a virtude?”. PLATÃO. Mênon . Rio de Janeiro: PUC-Rio; São Paulo: Loyola, 2001 (adaptado). A atitude apresentada na interlocução do filósofo com Mênon é um exemplo da utilização do(a) ","['escrita epistolar.', 'método dialético.', 'linguagem trágica.', 'explicação fisicalista.', 'suspensão judicativa. ']",2021
