questao,gabarito,enunciado,alternativas
94,A,"Os solos amazônicos, ricos em silicato, não são apropriados para o cultivo por serem incapazes de reter nutrientes. Contudo, descobertas arqueológicas têm demonstrado que os antigos habitantes da Amazônia dominavam a técnica de preparo de um insumo agrícola natural, denominado terra preta. Esse insumo era constituído principalmente de uma espécie de biocarvão (biochar ) obtido da queima de matéria orgânica, como troncos de árvores, pedaços de ossos e esterco, capaz de manter um solo fértil por anos. Admite-se que o efeito do biocarvão na fertilização do solo estava, em parte, relacionado à presença de grupos orgânicos do tipo carboxilato em sua superfície, carregados negativamente (—COO−). Esses grupos atraem íons positivos necessários como nutrientes, tais quais os provenientes do potássio (K), do cálcio (Ca) e do magnésio (Mg), além de micronutrientes, como zinco (Zn) e ferro (Fe). Essa ligação no solo fertilizado é predominantemente iônica, conforme ilustra a figura, em que Mn+ representa os cátions metálicos. De acordo com a escala de Pauling, a eletronegatividade do elemento oxigênio é igual a 3,44. Mn+O O–O O– Mn+ Solo com biocarvão Solo fertilizado O quadro apresenta os valores de eletronegatividade desses cinco elementos metálicos. Elemento metálico Eletronegatividade K 0,82 Ca 1,00 Mg 1,31 Zn 1,65 Fe 1,83 MICHALOVIC, M. Ancient Soil Chemists of the Amazon. ChemMatters , fev. 2009 (adaptado). O cátion que resultará em uma interação de maior caráter iônico com o ânion carboxilato será aquele proveniente do elemento ","['potássio. ', 'cálcio. ', 'magnésio. ', 'zinco. ', 'ferro.']"
95,D,"Em uma indústria alimentícia, para produção de doce de leite, utiliza-se um tacho de parede oca com uma entrada para vapor de água a 120 °C e uma saída para água líquida em equilíbrio com o vapor a 100 °C. Ao passar pela parte oca do tacho, o vapor de água transforma-se em líquido, liberando energia. A parede transfere essa energia para o interior do tacho, resultando na evaporação de água e consequente concentração do produto. No processo de concentração do produto, é utilizada energia proveniente ","['somente do calor latente de vaporização. ', 'somente do calor latente de condensação. ', 'do calor sensível e do calor latente de vaporização. ', 'do calor sensível e do calor latente de condensação. ', 'do calor latente de condensação e do calor latente de vaporização.*020125AM3*4 CN • 2 º DIA • CADERNO 5 • AMARELO']"
96,C,"gasolina é uma mistura de hidrocarbonetos de cadeias saturadas contendo de 8 a 12 átomos de carbono. Além disso, a gasolina de alto desempenho deve conter elevados teores de hidrocarbonetos de cadeias ramificadas, de forma a resistir à compressão e entrar em ignição apenas quando a vela aciona uma centelha elétrica no motor. No quadro, estão apresentados compostos que podem ser utilizados como combustíveis. Composto Nomenclatura I n-decano II n-heptano III 2,2,4-trimetilpentano IV 3-etil-4-metilex-1-eno V 3-etil-2-metilpentan-1-ol Entre esses compostos, aquele que conferirá maior desempenho como combustível é o ","['I. ', 'II. ', 'III. ', 'IV. ', 'V.']"
97,C,"De acordo com a Constituição Federal, é competência dos municípios o gerenciamento dos serviços de limpeza e coleta dos resíduos urbanos (lixo). No entanto, há relatos de que parte desse lixo acaba sendo incinerado, liberando substâncias tóxicas para o ambiente e causando acidentes por explosões, principalmente quando ocorre a incineração de frascos de aerossóis (por exemplo: desodorantes, inseticidas e repelentes). A temperatura elevada provoca a vaporização de todo o conteúdo dentro desse tipo de frasco, aumentando a pressão em seu interior até culminar na explosão da embalagem. ZVEIBIL, V. Z. et al. Cartilha de limpeza urbana . Disponível em: www.ibam.org.br. Acesso em: 6 jul. 2015 (adaptado). Suponha um frasco metálico de um aerossol de capacidade igual a 100 mL, contendo 0,1 mol de produtos gasosos à temperatura de 650 °C, no momento da explosão. Considere: R = 0,082 Latm molK⋅ ⋅ pressão, em atm, dentro do frasco, no momento da explosão, é mais próxima de ","['756. ', '533. ', '76. ', '53. ', '13.']"
98,C,"O circuito com três lâmpadas incandescentes idênticas, representado na figura, consiste em uma associação mista de resistores. Cada lâmpada ( L 1, L2 e L3) é associada, em paralelo, a um resistor de resistência R , formando um conjunto. Esses conjuntos são associados em série, tendo todas as lâmpadas o mesmo brilho quando ligadas à fonte de energia. Após vários dias em uso, apenas a lâmpada L2 queima, enquanto as demais permanecem acesas. Fonte de energia RL³R R L²L¹ Em relação à situação em que todas as lâmpadas funcionam, após a queima de L2, os brilhos das lâmpadas serão ","['os mesmos. ', 'mais intensos. ', 'menos intensos. ', 'menos intenso para L 1 e o mesmo para L3. ', 'mais intenso para L 1 e menos intenso para L3. *020125AM4*5 CN • 2 º DIA • CADERNO 5 • AMARELO']"
99,C,"tecnologia de vacinas de RNA mensageiro (RNAm) é investigada há anos. Avanços científicos em genética molecular permitiram desenvolver uma vacina para controle da pandemia da covid-19 causada pelo vírus de RNA SARS-CoV-2. A vacina de RNAm tem sequências de genes do vírus. Entretanto, por ser muito instável, o RNAm deve ser recoberto por uma capa de lipídios que evita sua degradação e favorece sua ação. Dessa forma, o RNAm desempenhará sua função específica atuando no mesmo compartimento celular de sempre. Disponível em: https://sbim.org.br. Acesso em: 29 nov. 2021 (adaptado). imunização produzida por esse tipo de vacina é alcançada por meio da ","['estimulação de leucócitos induzida pela capa lipídica contendo RNAm. ', 'atuação do RNAm como sequestrador do vírus para o meio extracelular. ', 'tradução do RNAm em proteína viral, desencadeando a resposta antigênica. ', 'competição entre o RNAm vacinal e o RNA viral pelos sítios dos ribossomos. ', 'incorporação do RNAm viral ao genoma do hospedeiro, gerando novo fenótipo.']"
100,D,"Na fertilização in vitro, espermatozoides são adicionados aos gametas femininos retirados de uma mulher. Após o período de incubação, a fecundação é favorecida pela ação de enzimas. Em um procedimento realizado, observou-se que nenhum dos gametas femininos foi fertilizado e, posteriormente, verificou-se que havia sido adicionado, equivocadamente, um coquetel de inibidores das enzimas do acrossomo, no lugar de um dos nutrientes constituintes do meio de cultura. O coquetel de inibidores impediu o(a) ","['formação do pronúcleo masculino. ', 'início da divisão mitótica do zigoto. ', 'término da segunda divisão meiótica do ovócito. ', 'passagem do espermatozoide pela corona radiata e zona pelúcida. ', 'fusão das membranas plasmáticas do ovócito e do espermatozoide.']"
101,D,"O fogão por indução funciona a partir do surgimento de uma corrente elétrica induzida no fundo da panela, com consequente transformação de energia elétrica em calor por efeito Joule. A principal vantagem desses fogões é a eficiência energética, que é substancialmente maior que a dos fogões convencionais. corrente elétrica mencionada é induzida por ","['radiação. ', 'condução. ', 'campo elétrico variável. ', 'campo magnético variável. ', 'ressonância eletromagnética.']"
102,D,"Uma academia decide trocar gradualmente seus aparelhos de musculação. Agora, os frequentadores que utilizam os aparelhos do tipo 1 podem também utilizar os aparelhos do tipo 2, representados na figura, para elevar cargas correspondentes às massas M1 e M2, com velocidade constante. A fim de que o exercício seja realizado com a mesma força F, os usuários devem ser orientados a respeito da relação entre as cargas nos dois tipos de aparelhos, já que as polias fixas apenas mudam a direção das forças, enquanto a polia móvel divide as forças. Em ambos os aparelhos, considere as cordas inextensíveis, as massas das polias e das cordas desprezíveis e que não há dissipação de energia. F F M1M2Aparelho do tipo 2 Aparelho do tipo 1 Para essa academia, qual deve ser a razão M M2 1 informada aos usuários? ","['1 4 ', '1 2 ', '1 ', '2 ', '4*020125AM5*6 CN • 2 º DIA • CADERNO 5 • AMARELO']"
103,A,"Um garoto comprou vários abacates na feira, mas descobriu que eles não estavam maduros o suficiente para serem consumidos. Sua mãe recomendou que ele colocasse os abacates em um recipiente fechado, pois isso aceleraria seu amadurecimento. Com certa dúvida, o garoto realizou esta experiência: colocou alguns abacates no recipiente e deixou os demais em uma fruteira aberta. Surpreendendo-se, ele percebeu que os frutos que estavam no recipiente fechado amadureceram mais rapidamente. aceleração desse processo é causada por ","['acúmulo de gás etileno. ', 'redução da umidade do ar. ', 'aumento da concentração de CO2. ', 'diminuição da intensidade luminosa. ', 'isolamento do contato com O2 atmosférico.']"
104,B,"Há muito tempo são conhecidas espécies de lesmas-do-mar com uma capacidade ímpar: guardar parte da maquinaria das células das algas que consomem — os cloroplastos — e mantê-los funcionais dentro das suas próprias células, obtendo assim parte do seu alimento. Investigadores portugueses descobriram que essas lesmas-do-mar podem ser mais eficientes nesse processo do que as próprias algas que consomem. Disponível em: www.cienciahoje.pt. Acesso em: 10 fev. 2015 (adaptado). Essa adaptação confere a esse organismo a capacidade de obter primariamente ","['ácidos nucleicos. ', 'carboidratos. ', 'proteínas. ', 'vitaminas. ', 'lipídios.']"
105,D,"leishmaniose visceral é uma zoonose causada por um protozoário do gênero Leishmania que é encontrado em diversos tecidos. Ela é transmitida ao homem de forma indireta, por vetores do ambiente doméstico. O cão é considerado um importante hospedeiro desse protozoário, podendo ou não apresentar os sintomas da doença, como perda de peso, anemia, ferimentos na pele, diarreia, conjuntivite e insuficiência renal. Em uma região que sofre com alta incidência dessa doença, uma campanha do centro de zoonoses buscou verificar a presença desse protozoário nos cães para tentar controlar a doença. Em qual material biológico dos cães a presença desse protozoário representa risco de transmissão dessa zoonose? ","['Urina. ', 'Saliva. ', 'Fezes. ', 'Sangue. ', 'Secreção ocular.']"
106,C,"Um professor lança uma esfera verticalmente para cima, a qual retorna, depois de alguns segundos, ao ponto de lançamento. Em seguida, lista em um quadro todas as possibilidades para as grandezas cinemáticas. Grandeza cinemática Módulo Sentido Velocidadev ≠ 0Para cima Para baixo v = 0 Indefi nido* Aceleraçãoa ≠ 0Para cima Para baixo a = 0 Indefi nido* *Grandezas com módulo nulo não têm sentido definido. Ele solicita aos alunos que analisem as grandezas cinemáticas no instante em que a esfera atinge a altura máxima, escolhendo uma combinação para os módulos e sentidos da velocidade e da aceleração. escolha que corresponde à combinação correta é ","['v = 0 e a ≠ 0 para cima. ', 'v ≠ 0 para cima e a = 0. ', 'v = 0 e a ≠ 0 para baixo. ', 'v ≠ 0 para cima e a ≠ 0 para cima. ', 'v ≠ 0 para baixo e a ≠ 0 para baixo.*020125AM6*7 CN • 2 º DIA • CADERNO 5 • AMARELO']"
107,A,"Muitas mulheres sofrem com desconfortos nos dias que antecedem a menstruação, a chamada tensão pré-menstrual. Entre outros sintomas, podem ocorrer alterações de humor. Atualmente, acredita-se que os sintomas são resultado da queda na concentração do neurotransmissor serotonina, que, por sua vez, está relacionado com a diminuição na produção dos hormônios ovarianos estrógeno e progesterona, observada nessa fase do ciclo feminino. DIMMOCK, P. W. et al. Efficacy of Selective Serotonin-Reuptake Inhibitors in Premenstrual Syndrome: a Systematic Review. The Lancet , n. 9 236, 2000 (adaptado). redução da produção desses hormônios nessa fase está relacionada com o(a) ","['regressão do corpo lúteo ovariano. ', 'diminuição na produção de ocitocina. ', 'liberação do gameta feminino na ovulação. ', 'aumento nos níveis dos hormônios LH e FSH. ', 'elevação nos níveis sorológicos de adrenalina.']"
108,C,"As cetonas fazem parte de famílias olfativas encontradas em muitos alimentos. A molécula de hexan-3-ona é um exemplo desses compostos voláteis responsáveis pelo aroma, podendo ser obtida por processos energéticos realizados em meio ácido, na presença de oxidantes como o permanganato de potássio. Para se produzir esse composto volátil em laboratório, deve-se oxidar a molécula de ","['hexanal. ', 'hexan-1-ol. ', 'hexan-3-ol. ', 'hex-1-en-1-ol. ', 'ácido hexanoico.']"
109,D,"Durante a evolução das plantas, ocorreu uma transição do ambiente aquático para o ambiente terrestre graças ao surgimento de algumas estruturas que as tornaram independentes da água. Esse fato permitiu maior dispersão desse grupo de seres vivos, sendo possível observá-los em diferentes ambientes na atualidade. Qual estrutura possibilitou a independência da água para a fecundação dos seres vivos citados acima? ","['Fruto. ', 'Esporo. ', 'Semente. ', 'Tubo polínico. ', 'Vaso condutor.']"
110,B,"O vidro contendo alumínio em sua composição é um excelente material para acondicionar medicamentos e suplementos, porque pode ser esterilizado por aquecimento. No entanto, quando o medicamento ou suplemento contém substâncias que se ligam fortemente ao íon desse metal, a dissolução do alumínio é promovida em função do deslocamento do equilíbrio químico estabelecido entre a espécie imobilizada no vidro e a espécie em solução. Por essa razão, recomenda-se que suplementos de nutrição de recém-nascidos contendo gluconato de cálcio sejam acondicionados em embalagens plásticas, e não nesse tipo de vidro. Atualização da recomendação da Sociedade Portuguesa de Neonatologia . Disponível em: www.spneonatologia.pt. Acesso em: 22 out. 2021 (adaptado). Caso esse suplemento seja acondicionado em embalagem desse tipo de vidro, o risco de contaminação por alumínio será maior se o(a) ","['vidro do frasco for translúcido. ', 'concentração de gluconato de cálcio for alta. ', 'frasco de vidro apresentar uma maior espessura. ', 'vidro for previamente esterilizado em altas temperaturas. ', 'reação do alumínio com gluconato de cálcio for endotérmica.']"
111,E,"Barbatimão é o nome popular de uma árvore cuja casca é utilizada para fins medicinais. Essa casca é constituída principalmente de dois tecidos vegetais: periderme e floema. A extração da casca tem levado à morte muitos indivíduos dessa espécie, quando o corte retira um anel completo ao longo da circunferência do tronco. Aqueles que têm parte da casca retirada sem completar essa circunferência podem sobreviver. morte desses indivíduos, decorrente da retirada do anel completo da casca, é provocada pela interrupção da ","['fotossíntese. ', 'transpiração. ', 'troca de gases. ', 'formação de brotos. ', 'nutrição das raízes. *020125AM7*8 CN • 2 º DIA • CADERNO 5 • AMARELO']"
112,E,"O descarte de detergentes comuns nos esgotos domésticos ocasiona a formação de uma camada de espuma que impede a entrada de oxigênio na água. Os microrganismos que vivem nessas águas não são capazes de quebrar moléculas ramificadas, ocorrendo assim um desequilíbrio ambiental nos rios. fórmula a seguir representa a estrutura química de um tensoativo presente na composição de um detergente não biodegradável. S O O O– Na+ Tensoativo não biodegradável Qual modificação química na estrutura desse tensoativo o tornaria um detergente biodegradável? ","['Retirar a parte polar da molécula. ', 'Eliminar as insaturações do anel aromático. ', 'Trocar o grupo aniônico por um grupo neutro. ', 'Alterar o grupo aniônico por um grupo catiônico. ', 'Modificar a cadeia carbônica para cadeia normal.']"
113,E,"Avaliação de substâncias genotóxicas O ensaio de micronúcleos é um teste de avaliação de genotoxicidade que associa a presença de micronúcleos (pequenos núcleos que aparecem próximo aos núcleos das células) com lesões genéticas. Os micronúcleos são fragmentos de DNA encapsulados, provenientes do fuso mitótico durante a divisão celular. DIAS, V. M. Micronúcleos em células tumorais : biologia e implicações para a tumorigênese. Dissertação de Mestrado. USP, 2006 (adaptado). Os micronúcleos se originam dos(as) ","['nucléolos. ', 'lisossomos. ', 'ribossomos. ', 'mitocôndrias. ', 'cromossomos.']"
114,D,"O petróleo é uma matéria-prima muito valiosa e métodos geofísicos são úteis na sua prospecção. É possível identificar a composição de materiais estratificados medindo-se a velocidade de propagação do som (onda mecânica) através deles. Considere que uma camada de 450 m de um líquido se encontra presa no subsolo entre duas camadas rochosas, conforme o esquema. Um pulso acústico (que gera uma vibração mecânica) é emitido a partir da superfície do solo, onde são posteriormente recebidas duas vibrações refletidas (ecos). A primeira corresponde à reflexão do pulso na interface superior do líquido com a camada rochosa. segunda vibração deve-se à reflexão do pulso na interface inferior. O tempo entre a emissão do pulso e a chegada do primeiro eco é de 0,5 s. O segundo eco chega 1,1 s após a emissão do pulso. Emissor e detector de pulsos Rocha Rocha450 m Líquido velocidade do som na camada líquida, em metro por segundo, é ","['270. ', '540. ', '818. ', '1 500. ', '1 800. *020125AM8*9 CN • 2 º DIA • CADERNO 5 • AMARELO']"
115,C,"É comum em viagens de avião sermos solicitados a desligar aparelhos cujo funcionamento envolva a emissão ou a recepção de ondas eletromagnéticas, como celulares. justificativa dada para esse procedimento é, entre outras coisas, a necessidade de eliminar fontes de sinais eletromagnéticos que possam interferir nas comunicações, via rádio, dos pilotos com a torre de controle. Essa interferência poderá ocorrer somente se as ondas emitidas pelo celular e as recebidas pelo rádio do avião ","['forem ambas audíveis. ', 'tiverem a mesma potência. ', 'tiverem a mesma frequência. ', 'tiverem a mesma intensidade. ', 'propagarem-se com velocidades diferentes.']"
116,E,"O Aldrin é um inseticida agrícola organoclorado sintético de baixa polaridade, cuja estrutura molecular simétrica, de fórmula C12H8Cl6, está representada na figura. Introduzido na agricultura a partir da década de 1950, esse composto apresenta alta persistência no meio ambiente e acumulação nos organismos, sendo danoso para a saúde. AldrinCl ClCl ClCl ClCH HC VIEGAS JÚNIOR, C. Terpenos com atividade inseticida: uma alternativa para o controle químico de insetos. Química Nova , v. 26, n. 3, 2003 (adaptado). Um pesquisador coletou fluidos biológicos de indivíduos de uma população contaminada por esse inseticida agrícola. Ele analisou amostras de saliva, sangue, lágrima, urina e leite quanto à presença dessa substância. Em qual dos fluidos o pesquisador provavelmente encontrou a maior concentração dessa substância? ","['Saliva, por consequência da atividade de enzimas. ', 'Sangue, em função das hemácias e leucócitos. ', 'Lágrima, em razão da concentração de sais. ', 'Urina, pela presença de moléculas de ureia. ', 'Leite, por causa do alto teor de gorduras.']"
117,D,"Uma cafeteria adotou copos fabricados a partir de uma composição de 50% de plástico reciclado não biodegradável e 50% de casca de café. O copo é reutilizável e retornável, pois o material, semelhante a uma cerâmica, suporta a lavagem. Embora ele seja comercializado por um preço considerado alto quando comparado ao de um copo de plástico descartável, essa cafeteria possibilita aos clientes retornarem o copo sujo e levarem o café quente servido em outro copo já limpo e higienizado. O material desse copo oferece também o conforto de não esquentar na parte externa. Cafeteria adota copo reutilizável feito com casca de café. Disponível em: www.gazetadopovo.com.br. Acesso em: 5 dez. 2019 (adaptado). Quais duas vantagens esse copo apresenta em comparação ao copo descartável? ","['Ter a durabilidade de uma cerâmica e ser totalmente biodegradável. ', 'Ser tão durável quanto uma cerâmica e ter alta condutividade térmica. ', 'Ser um mau condutor térmico e aumentar o resíduo biodegradável na natureza. ', 'Ter baixa condutividade térmica e reduzir o resíduo não biodegradável na natureza. ', 'Ter alta condutividade térmica e possibilitar a degradação do material no meio ambiente.']"
118,A,"O consumo exagerado de refrigerantes é preocupante, pois contribui para o aumento de casos de obesidade e diabetes. Considere dois refrigerantes enlatados, um comum e um diet, e que ambos possuam a mesma quantidade de aditivos, exceto pela presença de açúcar. O refrigerante comum contém basicamente água carbonatada e grande quantidade de açúcar; já o refrigerante diet tem água carbonatada e adoçantes, cujas massas são muito pequenas. CAVAGIS, A. D. M.; PEREIRA, E. A.; OLIVEIRA, L. C. Um método simples para avaliar o teor de sacarose e CO2 em refrigerantes. Química Nova na Escola , n. 3, ago. 2014 (adaptado). Entre as duas versões apresentadas, o refrigerante comum possui ","['maior densidade. ', 'menor viscosidade. ', 'maior volume de gás dissolvido. ', 'menor massa de solutos dissolvidos. ', 'maior temperatura de congelamento. *020125AM9*10 CN • 2 º DIA • CADERNO 5 • AMARELO']"
119,E,"O manual de um automóvel alerta sobre os cuidados em relação à pressão do ar no interior dos pneus. Recomenda-se que a pressão seja verificada com os pneus frios (à temperatura ambiente). Um motorista, desatento a essa informação, realizou uma viagem longa sobre o asfalto quente e, em seguida, verificou que a pressão P0 no interior dos pneus não era a recomendada pelo fabricante. Na ocasião, a temperatura dos pneus era T0. Após um longo período em repouso, os pneus do carro atingiram a temperatura ambiente T . Durante o resfriamento, não há alteração no volume dos pneus e na quantidade de ar no seu interior. Considere o ar dos pneus um gás perfeito (também denominado gás ideal). Durante o processo de resfriamento, os valores de pressão em relação à temperatura (P × T) são representados pelo gráfico: AAP (Pa) P0 T0T (K) T BBP0 T0TP (Pa) T (K) CC P0 T0T T (K)P (Pa)DD T0T T (K)P (Pa) P0 EEP0 T0T T (K)P (Pa)*020125AM10*11 CN • 2 º DIA • CADERNO 5 • AMARELO",[]
120,E,"Pais com síndrome de Down síndrome de Down é uma alteração genética associada à trissomia do cromossomo 21, ou seja, o indivíduo possui três cromossomos 21 e não um par, como é normal. Isso ocorre pela união de um gameta contendo um cromossomo 21 com um gameta possuidor de dois cromossomos 21. Embora, normalmente, as mulheres com a síndrome sejam estéreis, em 2008, no interior de São Paulo, uma delas deu à luz uma menina sem a síndrome de Down. MORENO, T. Três anos após dar à luz, mãe portadora de síndrome de Down revela detalhes de seu dia a dia . Disponível em: www.band.uol.com.br. Acesso em: 31 out. 2013 (adaptado). Sabendo disso, um jovem casal, ambos com essa síndrome, procura um médico especialista para aconselhamento genético porque querem ter um bebê. O médico informa ao casal que, com relação ao cromossomo 21, os zigotos formados serão ","['todos normais. ', 'todos tetrassômicos. ', 'apenas normais ou tetrassômicos. ', 'apenas trissômicos ou tetrassômicos. ', 'normais, trissômicos ou tetrassômicos.']"
121,C,"Para que uma molécula dê origem a um medicamento de administração oral, além de apresentar atividade farmacológica, deve ser capaz de atingir o local de ação. Para tanto, essa molécula não deve se degradar no estômago (onde o meio é fortemente ácido e há várias enzimas que reagem mediante catálise ácida), deve ser capaz de atravessar as membranas celulares e ser solúvel no plasma sanguíneo (sistema aquoso). Para os fármacos cujas estruturas são formadas por cadeias carbônicas longas contendo pelo menos um grupamento amino, um recurso tecnológico empregado é sua conversão no cloridrato correspondente. Essa conversão é representada, de forma genérica, pela equação química: R3N + HCl (R3NH)+Cl– O aumento da eficiência de circulação do fármaco no sangue, promovido por essa conversão, deve-se ao incremento de seu(sua) ","['basicidade. ', 'lipofilicidade. ', 'caráter iônico. ', 'cadeia carbônica. ', 'estado de oxidação.']"
