questao,gabarito,enunciado,alternativas
127,D,"Os riscos apresentados pelos produtos dependem de suas propriedades e da reatividade quando em contatocom outras substâncias. Para prevenir os riscos devido ànatureza química dos produtos, devemos conhecer a listade substâncias incompatíveis e de uso cotidiano emfábricas, hospitais e laboratórios, a fim de observarcuidados na estocagem, manipulação e descarte. O quadro elenca algumas dessas incompatibilidades, que podem levar à ocorrência de acidentes. Considere que houve o descarte indevido de dois conjuntos de substâncias: (1) ácido clorídrico concentrado com cianeto de potássio;(2) ácido nítrico concentrado com sacarose. Disponível em: www.fiocruz.br. Acesso em: 6 dez. 2017 (adaptado). O descarte dos conjuntos (1) e (2) resultará, respectivamente, em liberação de gás tóxico e reação oxidativa forte.","['reação oxidativa forte e liberação de gás tóxico.', 'formação de sais tóxicos e reação oxidativa forte.', 'liberação de gás tóxico e liberação de gás oxidante.', 'formação de sais tóxicos e liberação de gás oxidante. Resolução No conjunto (1) o ácido clorídrico concentrado (HCl(conc)) reage com cianeto de potássio (KCN) liberando HCN, gás tóxico: HCl(con', '+ KCN(s) →HCN(g) + KC l No conjunto (2) o ácido nítrico concentrado (HNO3 (conc)), um oxidante forte, reage com sacarose. Como a reação é violenta, libera grande quantidade deenergia e é um processo de oxidorredução, portanto, éuma reação oxidativa forte. Resposta: AASubstância IncompatibilidadeRiscos associados Ácidos minerais fortes concentradosBases fortes Cianetos Hipoclorito de sódioReação enérgica, explosão, produção de oxidante forte e produto tóxico Ácido nítrico concentradoMatéria orgânicaReação enérgica, explosão e produto tóxico EENNEEMM -- 22..OODDIIAA-- NNOOVVEEMMBBRR']"
128,C,"Um pai faz um balanço utilizando dois segmentos paralelos e iguais da mesma corda para fixar uma tábua auma barra horizontal. Por segurança, opta por um tipo decorda cuja tensão de ruptura seja 25% superior à tensãomáxima calculada nas seguintes condições: • O ângulo máximo atingido pelo balanço em relação à vertical é igual a 90°; • Os filhos utilizarão o balanço até que tenham uma massa de 24 kg. Além disso, ele aproxima o movimento do balanço para o movimento circular uniforme, considera que a acelera -ção da gravidade é igual a 10m/s 2e despreza forças dissipativas. Qual é a tensão de ruptura da corda escolhida? ","['120 N ', '300 N ', '360 N ', '450 N ', '900 N Resolução 1) Conservação da energia mecânica entre A e B: EB= EA(referência em B) = MgR ⇒ 2) Na posição B a resultante é centrípeta: 2Tmáx–PB= FcpB 2Tmáx– Mg = 2Mg 2Tmáx= 3Mg ⇒ Tmáx= . 24 . 10 (N) ⇒ 3) De acordo com o texto: Truptura = 1,25 Tmáx= 1,25 . 360NRA T T BV= 0A O PB = 2Mg = FcpBM VB2 –––––– RM VB2 –––––– 2 Tmáx= Mg3–––2 Tmáx= 360N3––2 EENNEEMM -- 22..OODDIIAA-- NNOOVVEEMMBBRROO//22002211Resposta: DDTruptura = 450N EENNEEMM -- 22..OODDIIAA-- NNOOVVEEMMBBRR']"
129,B,"A nanotecnologia é responsável pelo aprimoramento de diversos materiais, incluindo os que são impactados coma presença de poluentes e da umidade na atmosfera,causadores de corrosão. O processo de corrosão éespontâneo e provoca a deterioração de metais como oferro, que, em presença de oxigênio e água, sofreoxidação, conforme ilustra a equação química: 4 Fe(s) + 2 H 2O(l) + 3 O2(g) →2 Fe2O3. H2O (s) Uma forma de garantir a durabilidade da estrutura metálica e a sua resistência à umidade consiste nadeposição de filmes finos nanocerâmicos à base dezircônia (ZrO 2) e alumina (A l2O3) sobre a superfície do objeto que se deseja proteger. CLEMENTE. G. A. B. F. et al. O uso de materiais híbridos ou nanocompósitos como revestimentos anticorrosivos do aço. Química Nova , n. 9, 2021 (adaptado). Essa nanotecnologia aplicada na proteção contra a corrosão se baseia no(a) ","['proteção catódica, que utiliza um metal fortemente redutor. ', 'uso de metais de sacrifício, que se oxidam no lugar do ferro. ', 'passivação do ferro, que fica revestido pelo seu próprio óxido. ', 'efeito de barreira, que impede o contato com o agente oxidante. ', 'galvanização, que usa outros metais de menor potencial de redução. Resolução A nanotecnologia aplicada na proteção contra acorrosão do ferro se baseia na deposição de zircônia(ZrO 2) e alumina (A l2O3) sobre a superfície do ferro, portanto, ocorre o efeito de barreira que impede ocontato com o agente oxidante (O 2). Resposta: DD EENNEEMM -- 22..OODDIIAA-- NNOOVVEEMMBBRR']"
130,D,"As células da epiderme da folha da Tradescantia pallida purpurea , uma herbácea popularmente conhecida como trapoeraba-roxa, contém um vacúolo onde seencontra um pigmento que dá a coloração arroxeada aesse tecido. Em um experimento, um corte da epidermede uma folha da trapoeraba-roxa foi imerso em ambientehipotônico e, logo em seguida, foi colocado em umalâmina e observado em microscópio óptico. Durante a observação desse corte, foi possível identificar o(a) ","['acúmulo do solvente com fragmentação da organela.', 'rompimento da membrana celular com liberação do citosol. ', 'aumento do vacúolo com diluição do pigmento no seu interior. ', 'quebra da parede celular com extravasamento do pigmento. ', 'murchamento da célula com expulsão do pigmento do vacúolo. Resolução No experimento observa-se o fenômeno da osmoseonde o tecido vegetal (hipertônico) recebe água domeio externo (hipotônico), o que promove o aumentodo volume vacuolar e diluição do pigmento contidonesta organela. Resposta: CC EENNEEMM -- 22..OODDIIAA-- NNOOVVEEMMBBRR']"
131,D,"A variação da incidência de radiação solar sobre a super - fície da Terra resulta em uma variação de temperatura aolongo de um dia denominada amplitude térmica. Edifi -cações e pavimentações realizadas nas áreas urbanascontribuem para alterar as amplitudes térmicas dessasregiões, em comparação com regiões que mantém suascaracterísticas naturais, com presença de vegetação eágua, já que o calor específico do concreto é inferior ao daágua. Assim, parte da avaliação do impacto ambiental quea presença de concreto proporciona às áreas urbanasconsiste em considerar a substituição da área concretadapor um mesmo volume de água e comparar as variaçõesde temperatura devido à absorção da radiação solar nasduas situações (concretada e alagada). Desprezando osefeitos da evaporação e considerando que toda a radiaçãoé absorvida, essa avaliação pode ser realizada com osseguintes dados: ROMERO, M. A. B. et al. Mudanças climáticas e ilhas de calor urbanas. Brasília: UnB; ETB, 2019 (adaptado). A razão entre as variações de temperatura nas áreas concretada e alagada é mais próxima de ","['1,0 ', '2,1 ', '2,5 ', '5,3 ', '13,1 Resolução Volumes iguais de concreto e de água deverão receber a mesma quantidade de energia térmica por incidên -cia de radiação solar. Q concreto= Qágua (mc/H9004/H9258)concreto= (mc /H9004/H9258)água /H9262CV cC/H9004/H9258C= /H9262AV cA/H9004/H9258A 2500 . 0,8 /H9004/H9258C= 1000 . 4,2 /H9004/H9258A 2000 /H9004/H9258C= 4200 /H9004/H9258A = ⇒ Resposta: BBDensidade (kg/m3)Calor específico (J/g°C) Água 1000 4,2 Concreto 2500 0,8 = 2,1/H9004/H9258C––––– /H9004/H9258A4200 ––––– 2000/H9004/H9258C––––– /H9004/H9258A EENNEEMM -- 22..OODDIIAA-- NNOOVVEEMMBBRR']"
132,A,"O elemento iodo (I) tem função biológica e é acumulado na tireoide. Nos acidentes nucleares de Chernobyjl eFukushima ocorreu a liberação para a atmosfera doradioisótopo 131I, responsável por enfermidades nas pessoas que foram expostas a ele. O decaimento de umamassa de 12 microgramas do isótopo 131I foi monitorado por 14 dias, conforme o quadro. Após o período de 40 dias, a massa residual desse isótopo é mais próxima de 2,4μg. ","['1,5μg. ', '0,8μg.', '0,4μg. ', '0,2μg. Resolução Pela observação da tabela, a massa de 12 microgramas do isótopo 131I possui meia-vida de 8 dias. Meia-vida é o tempo necessário para que a massa de 12μg sejareduzida a 6,0μg.Após o período de 40 dias, ocorrem os decaimentos: 8 dias 8 dias 8 dias 8 dias 12μg ⎯⎯→ 6,0μg ⎯⎯→ 3,0μg ⎯⎯→ 1,5μg ⎯⎯→ 8 dias → 0,75μg ⎯⎯→ 0,375μg A massa residual de 0,375μg é mais próxima de 0,4μg. Resposta: DDTempo (di', 'Massa residual de 131I (μg) 0 12,02 10,14 8,55 7,86 7,28 6,0 14 3,6 EENNEEMM -- 22..OODDIIAA-- NNOOVVEEMMBBRR']"
133,A,"Desde a proposição da teoria de seleção natural por Darwin, os seres vivos nunca mais foram olhados damesma forma. No que diz respeito à reprodução deanfíbios anuros, os cientistas já descreveram diferentespadrões reprodutivos, como os exemplificados a seguir: Espécie 1 – As fêmeas produzem cerca de 5 000 gametas, que são fecundados na água, em lagoas temporárias deestação chuvosa. Todo o desenvolvimento embrionário,do ovo à metamorfose, ocorre, nesse ambiente,independente dos pais. Espécie 2 – As fêmeas produzem aproximadamente 200 gametas, que são depositados em poças próximas acorpos-d’água. Os embriões são vigiados pelos machosdurante boa parte do seu desenvolvimento. Espécie 3 – As fêmeas produzem por volta de 20 gametas, que são fecundados sobre a superfície das folhas deplantas cujos galhos estão dispostos acima da superfíciede corpos-d’água e aí se desenvolvem até a eclosão. Espécie 4 – As fêmeas produzem poucos gametas que, quando fecundados, são “abocanhados” pelos machos. Osembriões se desenvolvem no interior do saco vocal domacho até a metamorfose, quando saem através da bocado pai. Os padrões descritos evidenciam que ","['as fêmeas influenciam o comportamento dos machos. ', 'o cuidado parental é necessário para o desen- volvimento. ', 'o grau de evolução determina o comportamento reprodutivo. ', 'o sucesso reprodutivo pode ser garantido por estratégias diferentes. ', 'o ambiente induz modificação na produção do número de gametas femininos. Resolução Os processos descritos no texto evidenciam quediferentes padrões reprodutivos são capazes deassegurar o sucesso reprodutivo das diferentesespécies de anfíbios anuros. Resposta: DD EENNEEMM -- 22..OODDIIAA-- NNOOVVEEMMBBRR']"
134,E,"O eixo de rotação da Terra apresenta uma inclinação em relação ao plano de sua órbita em torno do Sol, interferin -do na duração do dia e da noite ao longo do ano. Uma pessoa instala em sua residência uma placa foto - voltaica, que transforma energia solar em elétrica. Elamonitora a energia total produzida por essa placa em 4dias do ano, ensolarados e sem nuvens, e lança os resulta -dos no gráfico. Disponível em: www.fisica.ufpr.br. Acesso em: 27 maio 2022 (adaptado). Próximo a que região se situa a residência onde as placas foram instaladas? ","['Trópico de Capricórnio. ', 'Trópico de Câncer. ', 'Polo Norte. ', 'Polo Sul.', 'Equador. Resolução Na data de 10/01, a absorção de energia solar é máxi - ma e isto significa que estamos no verão no hemisfériosul, o que corresponde à região do Trópico de Capri -córnio, conforme mostrado na figura e no gráficoapresentados. Resposta: AA EENNEEMM -- 22..OODDIIAA-- NNOOVVEEMMBBRR']"
135,B,"Uma lanterna funciona com três pilhas de resistência interna igual a 0,5 /H9024cada, ligadas em série. Quando posi - cio nadas corretamente, devem acender a lâmpada incan -des cente de especificações 4,5 W e 4,5V . Cada pilha naposição correta gera uma f.e.m. (força eletromotriz) de1,5 V . Uma pessoa, ao trocar as pilhas da lanterna, cometeo equívoco de inverter a posição de uma das pilhas.Considere que as pilhas mantêm contato independen -temente da posição. Com esse equívoco, qual é a intensidade de corrente que passa pela lâmpada ao se ligar a lanterna? ","['0,25 A ', '0,33 A ', '0,75 A', '1,00 A ', '1,33 A Resolução Com os dados fornecidos, podemos determinar a resistência elétrica da lâmpada, assim: P = 4,5 = R = 4,5 Ω O circuito com a inversão de uma pilha pode ser desenhado esquematicamente da seguinte maneira: Aplicando-se a Lei de Pouillet para o circuito simples formado, temos: i = = (A) i = (A) ⇒ Resposta: AAU2 ––– R (4,5)2 ––––– R iii iE = 1,5 V 0,5/c87E = 1,5 V 0,5/c87 0,5/c87E’ = 1,5 V 4,5/c87 2(1,5) – 1,5 ––––––––––––––––– 0,5 + 0,5 + 0,5 + 4,52E – E’ –––––– ΣR i = 0,25A1,5 ––– 6,0 EENNEEMM -- 22..OODDIIAA-- NNOOVVEEMMBBRR']"
136,D,"Em uma aula prática de bioquímica, para medir a atividade catalítica da enzima catalase, foram realizadosseis ensaios independentes, nas mesmas condições,variando-se apenas a temperatura.A catalase decompõe operóxido de hidrogênio (H 2O2), produzindo água e oxigênio. Os resultados dos ensaios estão apresentadosno quadro. Os diferentes resultados dos ensaios justificam-se pelo(a) ","['variação do pH do meio.', 'aumento da energia de ativação.', 'consumo da enzima durante o ensaio.', 'diminuição da concentração do substrato.', 'modificação da estrutura tridimensional da enzima. Resolução A estrutura tridimensional de uma enzima depende da temperatura, interferindo assim na sua atividade.Os resultados dos ensaios mostram que a velocidadede decomposição de H 2O2foi maior na temperatura de 15°C, sendo essa a ideal para melhor desempenhoda catalase. Resposta: EEEnsaioTemperatura (°C)Resultado Decomposição de 10–12molH2O2/H20898––––––––– /H20899min 1 10 8,0 2 15 10,53 20 9,54 25 5,05 30 3,66 35 3,1 EENNEEMM -- 22..OODDIIAA-- NNOOVVEEMMBBRR']"
137,B,"Antimicrobianos são substâncias naturais ou sintéticas que têm capacidade de matar ou inibir o crescimento demicrorganismos. A tabela apresenta uma lista deantimicrobianos hipotéticos, bem como suas ações eefeitos sobre o metabolismo microbiano. Qual dos antimicrobianos deve ser utilizado para curar uma infecção causada por um fungo sem afetar asbactérias da microbiota normal do organismo? ","['1 ', '2 ', '3 ', '4 ', '5 Resolução De acordo com a tabela, o antimicrobiano capaz de curar uma infecção causada por fungo é o de número2. Este antimicrobiano afeta os microtúbulos,estruturas presentes em células eucariontes,importantes na divisão celular, mas ausentes emcélulas procariontes. Portanto, tal substância nãoafetaria a microbiota bacteriana. Resposta: BBAntimicrobiano Ação Efeito 1Une-se aos ribossomosImpede a síntese proteica 2Une-se aos microtúbulosImpede a segregação das cromátides 3Une-se aos fosfolipídeos da membrana plasmáticaReduz a permeabilidade da membrana plasmática 4Interfere na síntese de timinaInibe a síntese de DNA 5Interfere na síntese de uracilaImpede a síntese de RNA EENNEEMM -- 22..OODDIIAA-- NNOOVVEEMMBBRROO//22002211MMAATTEEMMÁÁTTIICCAAEESSUUAASS TTEECCNNOOLLOOGGIIAASS']"
138,A,"Em uma universidade, atuam professores que estão enquadrados funcionalmente pela sua maior titulação:mestre ou doutor. Nela há, atualmente, 60 mestres e 40doutores. Os salários mensais dos professores mestres edos doutores são, respectivamente, R$ 8 000,00 e R$ 12 000,00. A diretoria da instituição pretende proporcionar um aumento salarial diferenciado para o ano seguinte, de talforma que o salário médio mensal dos professores dessainstituição não ultrapasse R$ 12 240,00. A universidade jáestabeleceu que o aumento salarial será de 25% para osmestres e precisa ainda definir o percentual de reajustepara os doutores. Mantido o número atual de professores com suas atuais titulações, o aumento salarial, em porcentagem, a serconcedido aos doutores deverá ser de, no máximo, ","['14,4.', '20,7.', '22,0.', '30,0.', '37,5. Resolução Aumentando o salário dos professores mestres em 25% e aumentado, percentualmente, o salário dosprofessores doutores em p, temos: ≤ 12240 ⇔ ⇔600000 + 480000 (1 +p) ≤ 1224000 ⇔ ⇔480000 (1 + p) ≤ 624000 ⇔ ⇔1 + p ≤ 1,3 ⇔p ≤ 0,3 ⇔p ≤ 30% Logo, os professores doutores poderão ter um aumento salarial de no máximo 30%. Resposta: DD60 . 8000 . 1,25 + 40 . 12000 . (1 + p)––––––––––––––––––––––––––––––– 100 EENNEEMM -- 22..OODDIIAA-- NNOOVVEEMMBBRR']"
139,A,"Um borrifador de atuação automática libera, a cada acionamento, uma mesma quantidade de inseticida. Orecipiente desse produto, quando cheio, contém 360 mLde inseticida, que duram 60 dias se o borrifador per -manecer ligado ininterruptamente e for acionado a cada48 minutos. A quantidade de inseticida que é liberada a cada acionamento do borrifador, em mililitro, é ","['0,125.', '0,200.', '4,800.', '6,000.', '12,000. Resolução Como 60 dias tem 60 . 24 . 60 = 86400 minutos, e o borrifador é acionado a cada 48 minutos, temos que aquantidade de borrifadas é dado por 86400 ÷ 48 = 1800.Assim, sendo que o recipiente contém 360 mL, temosque a cada borrifada a quantidade de inseticida liberada é igual a = 0,2mL. Resposta: BB360–––––– 1800 EENNEEMM -- 22..OODDIIAA-- NNOOVVEEMMBBRR']"
140,A,"Definem-se o dia e o ano de um planeta de um sistema solar como sendo, respectivamente, o tempo que o planetaleva para dar 1 volta completa em torno de seu próprioeixo de rotação e o tempo para dar 1 volta completa emtomo de seu Sol. Suponha que exista um planeta Z, em algum sistema solar, onde um dia corresponda a 73 dias terrestres e que2 de seus anos correspondam a 1 ano terrestre. Considereque 1 ano terrestre tem 365 de seus dias. No planeta Z, seu ano corresponderia a quantos de seus dias? ","['2,5', '10,0', '730,0', '13 322,5', '53 290,0 Resolução I) Como 2 anos do planeta Z corresponde a 1 ano terrestre que tem 365 dias, temos então que 1 anodo planeta Z corresponde a 182,5 dias terrestres. II) Como 1 dia do planeta Z corresponde a 73 dias terrestres, temos: dias do planeta Z dias terrestres 17 3x 182,5 (1 ano no planeta Z) Assim, temos x = 2,5 dias. Resposta: AA EENNEEMM -- 22..OODDIIAA-- NNOOVVEEMMBBRR']"
141,C,"Em uma competição de velocidade, diz-se que há uma ultrapassagem quando um veículo que está atrás de outropassa à sua frente, com ambos se deslocando no mesmosentido. Considere uma competição automobilística entrecinco carros em uma pista com 100 m de comprimento,onde todos largam no mesmo instante e da mesma linha.O gráfico mostra a variação da distância percorrida porcada veículo, em função do tempo, durante toda acompetição. Qual o número de ultrapassagens, após o início da com - petição, efetuadas pelo veículo que chegou em últimolugar? ","['0', '1', '2', '3', '4 Resolução Pelo gráfico, o veículo que chegou em último colocado não ultrapassou nenhum outro veículo, porém foiultrapassado duas vezes. Resposta: AA EENNEEMM -- 22..OODDIIAA-- NNOOVVEEMMBBRR']"
142,E,"Em uma loja, o preço promocional de uma geladeira é de R$ 1 000,00 para pagamento somente em dinheiro.Seu preço normal, fora da promoção, é 10% maior. Parapagamento feito com o cartão de crédito da loja, é dadoum desconto de 2% sobre o preço normal. Uma cliente decidiu comprar essa geladeira, optando pelo pagamento com o cartão de crédito da loja. Elacalculou que o valor a ser pago seria o preço promocionalacrescido de 8%. Ao ser informada pela loja do valor apagar, segundo sua opção, percebeu uma diferença entreseu cálculo e o valor que lhe foi apresentado. O valor apresentado pela loja, comparado ao valor calculado pela cliente, foi ","['R$ 2,00 menor.', 'R$ 100,00 menor.', 'R$ 200,00 menor.', 'R$ 42,00 maior.', 'R$ 80,00 maior. Resolução O preço normal da geladeira é 1000 . 1,1 = 1100 reais.Pagando com cartão de crédito, o valor passa a ser1100 . 1,02 = 1078 reais.Segundo o cálculo da cliente, pagando com o cartãode crédito, ela pagará 1000 . 1,08 = 1080 reais. Dessa forma, o valor apresentado pela lojacorresponde a 1080 – 1078 = 2 reais a menos que ovalor calculado pela cliente. Resposta: AA EENNEEMM -- 22..OODDIIAA-- NNOOVVEEMMBBRR']"
143,B,"Uma pessoa precisa se deslocar de automóvel do ponto P para o ponto Q, indicados na figura, na qual as linhasverticais e horizontais simbolizam ruas. Por causa do sentido de tráfego nessas ruas, o caminho poligonal destacado é a possibilidade mais curta deefetuar esse deslocamento. Para descrevê-lo, deve-seespe ci ficar qual o sentido a ser tomado em cada cruza -mento de ruas, em relação à direção de deslocamento doautomóvel, que se movimentará continuamente. Para isso,empregam-se as letras E, F e D para indicar “vire àesquerda”, “siga em frente” e “vire à direita”,respectivamente. A sequência de letras que descreve o caminho poligonal destacado é ","['DDEFDDEEFFD. ', 'DFEFDDDEFFD.', 'DFEFDDEEFFD. ', 'EFDFEEDDFFE.', 'EFDFEEEDFFE. Resolução Empregando as letras E para indicar “vire à esquerda”, F para indicar “siga em frente” e D paraindicar “vire à direita”, a sequência de letras quedescreve o caminho poligonal éDFEFDDEEFFD. Resposta: CC EENNEEMM -- 22..OODDIIAA-- NNOOVVEEMMBBRR']"
144,E,"Uma loja comercializa cinco modelos de caixas-d’água (I, II, III, IV e V), todos em formato de cilindro reto debase circular. Os modelos II, III, IV e V têm asespecificações de suas dimensões dadas em relação àsdimensões do modelo I, cuja profundidade é P e área dabase é A b, como segue: • modelo II: o dobro da profundidade e a metade da área da base do modelo I; • modelo III: o dobro da profundidade e a metade do raio da base do modelo I; • modelo IV: a metade da profundidade e o dobro da área da base do modelo I; • modelo V: a metade da profundidade e o dobro do raio da base do modelo I. Uma pessoa pretende comprar nessa loja o modelo de caixa-d’água que ofereça a maior capacidadevolumétrica. O modelo escolhido deve ser oI. II. III. IV . V . Resolução Seja rbo raio da base do cilindro I que tem área da base Abe profundidade (alturP. Os volumes VI, VII, VIII, VIVe VV, dos cilindros I; II; III; IV e V , respectivamente, são dados por:","['V I= Ab. P ', 'VII= . 2P ⇒VII= Ab. P ', 'VIII= π . /H20898/H208992 . 2P = . 2P ⇒VIII= ', 'VIV= 2 . Ab. ⇒VIV= Ab. P ', 'VV= π . (2 rb)2. ⇒4 . Ab. ⇒VV= 2Ab. P Resposta: EEAb––– 2 Ab.P ––––– 2πrb2 ––––– 4rb––– 2 P ––– 2 P ––– 2P ––– 2 EENNEEMM -- 22..OODDIIAA-- NNOOVVEEMMBBRR']"
145,D,"No período de 2005 a 2013, o valor de venda dos imóveis em uma cidade apresentou alta, o, que resultouno aumento dos aluguéis. Os gráficos apresentam aevolução desses valores, para um mesmo imóvel, nomercado imobiliário dessa cidade. A rentabilidade do aluguel de um imóvel é calculada pela razão entre o valor mensal de aluguel e o valor demercado desse imóvel. Com base nos ‘dados fornecidos, em que ano a rentabilidade do aluguel foi maior? ","['2005', '2007', '2009', '2011', '2013 Resolução A rentabilidade do aluguel de um imóvel é calculada pela razão: ano 2005 ⎯→ razão = = 7 ano 2007 ⎯→ razão = = 8 ano 2009 ⎯→ razão = = 5valor mensal de aluguel–––––––––––––––––––––– valor de mercado 630–––– 90 960–––– 120 1350–––– 270 EENNEEMM -- 22..OODDIIAA-- NNOOVVEEMMBBRROO//22002211ano 2011 ⎯→ razão = = 4 ano 2013 ⎯→ razão = = 6 A rentabilidade do aluguel foi maior no ano de 2007. Resposta: BB1800–––– 450 3240–––– 540 EENNEEMM -- 22..OODDIIAA-- NNOOVVEEMMBBRR']"
146,A,"Ao escutar a notícia de que um filme recém-lançado arrecadou, no primeiro mês de lançamento, R$ 1,35bilhão bilheteria, um estudante escreveu corretamente onúmero que representa essa quantia, com todos os seusalgarismos. O número escrito pelo estudante foi","['135 000,00.', '1 350 000,00.', '13 500 000,00.', '135 000 000,00.', '1 350 000 000,00. Resolução O número 1,35 bilhão escrito com todos os seusalgarismos é 1 350 000 000,00. Resposta: EE EENNEEMM -- 22..OODDIIAA-- NNOOVVEEMMBBRR']"
