questao,gabarito,enunciado,alternativas
1,D,"A Teen’s View of Social Media Instagram is made up of all photos and videos. There is the home page that showcases the posts from peopleyou follow, an explore tab which offers posts fromaccounts all over the world, and your own page, with anotification tab to show who likes and comments on yourposts. It has some downsides though. It is known to make many people feel insecure or down about themselvesbecause the platform showcases the highlights ofeveryone’s lives, while rarely showing the negatives. Thiscan make one feel like their life is not going as well asothers, contributing to the growing rates of anxiety ordepression in many teens today. There is an underlyingdesire for acceptance through the number of likes orfollowers one has. Disponível em: http://cyberbulling.org. Acesso em: 29 out. 2021. O termo “downsides” introduz a ideia de que o Instagram é responsável por ","['oferecer recursos de fotografia.', 'divulgar problemas dos usuários.', 'estimular aceitação dos seguidores.', 'provocar ansiedade nos adolescentes.', 'aproximar pessoas ao redor do mundo. Resolução Lê-se, no texto: “This can make one feel like their life is not going aswell as others, contributing to the growing rates ofanxiety or depression in many teens today.” *downsides = desvantagens Resposta: DD EENNEEMM -- 11..OODDIIAA-- NNOOVVEEMMBBRR']"
2,C,"I tend the mobile now like an injured bird We text, text, text our significant words. I re-read your first, your second, your third, look for your small xx, feeling absurd. The codes we send arrive with a broken chord. I try to picture your hands, their image is blurred. Nothing my thumbs press will ever be heard. DUFFY , C. Disponível em: www.independent.co.uk. Acesso em: 27 out. 2021. Nesse poema, o eu lírico evidencia um sentimento de ","['contentamento com a interação virtual.', 'zelo com o envio de mensagens.', 'preocupação com a composiçao de textos.', 'mágoa com o comportamento de alguém.', 'insatisfação com uma forma de comunicação. Resolução Lê-se, no texto: “The codes we sendarrive with a broken chord.” “Nothing my thumbs press will ever be heard.” Resposta: EE EENNEEMM -- 11..OODDIIAA-- NNOOVVEEMMBBRR']"
3,B,"Two hundred years ago, Jane Austen lived in a world where single men boasted vast estates; single ladies wereexpected to speak several languages, sing and play thepiano. In both cases, it was, of course, advantageous if youlooked good too. So, how much has – or hasn’t – changed?Dating apps opaquely outline the demands of today’srelationship market; users ruminate long and hard overtheir choice of pictures and what they write in theirbiographies to hook in potential lovers, and that’s just yourown profile. What do you look for in a future partner’sprofile – potential signifiers of a popular personality, agood job, a nice car? These apps are a poignant reminderof the often classist atitudes we still adopt, as well as thefinancial and aesthetic expectations we demand frompotential partners. GALER, S. Disponível em: bbc.com. Acesso em: 8 dez. 2017 (adaptado). O texto aborda relações interpessoais com o objetivo de ","['problematizar o papel de gênero em casamentos modernos. ', 'apontar a relevância da educação formal na escolha de parceiros. ', 'comparar a expectativa de parceiros amorosos em épocas distintas. ', 'discutir o uso de aplicativos para proporcionar encontros românticos. ', 'valorizar a importância da aparência física na seleção de pretendentes. Resolução Lê-se, no texto: “Two hundred years ago, Jane Austen lived in a worldwhere single men boasted vast estates; single ladieswere expected to speak several languages, sing andplay the piano. In both cases, it was, of course,advantageous if you looked good too. So, how muchhas – or hasn’t – changed?”“These apps are a poignant reminder of the oftenclassist atitudes we still adopt, as well as the financialand aesthetic expectations we demand from potentialpartners.” Resposta: CC EENNEEMM -- 11..OODDIIAA-- NNOOVVEEMMBBRR']"
4,D,"As my official bio reads, I was made in Cuba, assembled is Spain, and imported to the United States –meaning my mother, seven months pregnant, and the restof my family arrived as exiles from Cuba to Madrid,where I was born. Less than two months later, weemigrated once more and settled in New York City, theneventually in Miami, where I was raised and educated.Although technically we lived in the United States, theCuban community was culturally insular in Miami duringthe 1970s, bonded together by the trauma of exile. What’smore, it seemed that practically everyone was Cuban: myteachers, my classmates, the mechanic, the bus driver. Ididn’t grow up feeling different or treated as a minority.The few kids who got picked on in my grade school werethe ones with freckles and funny last names like Dawsonand O’Neil. BLANCO, R. Disponível em: http://edition.cnn.com. Acesso em: 9 dez. 2017 (adaptado). Ao relatar suas vivências, o autor destaca o(a) ","['qualidadade da educação formal em Miami.', 'prestígio da cultura cubana nos Estados Unidos.', 'oportunidade de qualificação profissional em Miami.', 'cenário da integração de cubanos nos Estados Unidos.', 'fortalecimento do elo familiar em comunidades estadunidenses. Resolução Lê-se, no texto: “What’s more, it seemed that practically everyone wasCuban: my teachers, my classmates, the mechanic, thebus driver. I didn’t grow up feeling different or treatedas a minority. The few kids who got picked on in mygrade school were the ones with freckles and funnylast names like Dawson and O’Neil.” Resposta: DD EENNEEMM -- 11..OODDIIAA-- NNOOVVEEMMBBRR']"
5,E,"GAULD, T. Disponível em: www.tomgauld.com. Acesso em: 25 out. 2021. Na tirinha, o comportamento da mulher expressa ","['revolta com a falta de sorte.', 'gosto pela prática da leitura.', 'receio pelo futuro do casamento.', 'entusiasmo com os livros de terror.', 'rejeição ao novo tipo de residência. Resolução As falas da personagem da tirinha enfatizam o encantamento da mesma ao se deparar com umabiblioteca à disposição e, com isso, ela não se atenta àsfalas do marido. Resposta: BB EENNEEMM -- 11..OODDIIAA-- NNOOVVEEMMBBRROO//22002222Questões de 1 a 5 (opção espanhol)']"
1,E,"Pequeño hermano Es, no cabe duda, el instrumento más presente y más poderoso de todos los que entraron en nuestras vidas. Nila televisión ni el ordenador, no hablemos ya del obsoletofax o de las agendas o los libros electrónicos, ha tenido talinfluencia, tal predicamento sobre nosotros. El móvilsomos nosotros mismos. Todo desactivado e inerte,inocuo, ya les digo. Y de repente, tras un viaje y tres ocuatro imprudentes fotos, salta un aviso en la pantalla.Con sonido, además, pese a que tengo también todas lasalertas desactivadas. Y mi monstruo doméstico me dice:tienes um recuendo nuevo. Lo repetiré: tienes un recuerdonuevo. ¿Y tú qué sabes? ¿Y a ti, máquina demoníaca, quéte importa? ¿Cómo te atreves a decirme qué son o no sonmis recuerdos? ¿Qué es esta intromisión, este descaro?El pequeño hermano lo sabe casi todo. Sólo hay unaesperanza: que la obsolescencia programada mate antes alpequeño hermano y que nosotros sigamos vivos, con losrecuerdos que nos dé la gana. FERNÁNDES, D. Disponível em: www.lavanguardia.com. Acesso em: 5 dez. 2018 (adaptado.) No texto, o autor faz uma crítica ao(à) ","['conhecimento das pessoas sobre as tecnologias.', 'uso do celular alheio por pessoas desautorizadas.', 'funcionamento de recursos tecnológicos obsoletos.', 'ingerência do celular sobre as escolhas dos usuários.', 'falta de informação sobre a configuração dos alertas no celular. Resolução O texto afirma sobre a “intromissão” dos aparelhoscelulares ao enviar notificações de lembranças defotografias.A última frase do texto “… que la obsolescenciaprogramada mate antes al pequeño hermano y quenosotros sigamos vivos , con los recuerdos que nos déla gana.” confirma a ingerência dos celulares na vidados usuários. Resposta: DD EENNEEMM -- 11..OODDIIAA-- NNOOVVEEMMBBRR']"
2,D,"En los suburbios de La Habana, llaman al amigo mi tierra o mi sangre . En Caracas, el amigo es mi pana o mi llave: pana , por panadería, la fuente del buen pan para las hambres del alma; y llave por... – Llave , por llave –m e dice Mario Benedetti. Y me cuenta que cuando vivia enBuenos Aires, en los tiempos del terror, él llevaba cincollaves ajenas en su llavero: cinco llaves, de cinco casas, decinco amigos: las llaves que lo salvaron. GALEANO, E. El libro de los abrazos . Madri: Sigio Veintiuno, 205. Nesse texto, o autor demonstra como as diferentes expressões existentes em espanhol para se referir a“amigo” variam em função ","['das peculiaridades dos subúrbios hispano-americanos.', 'da força da conexão espiritual entre os amigos.', 'do papel da amizade em diferentes contextos.', 'do hábito de reunir amigos em torno da mesa.', 'dos graus de intimidade entre os amigos. Resolução O texto mostra várias formas de denominar um amigo em diferentes países, em um subúrbio de Havana,Cuba, se usa “mi tierra o mi sangre”; em Caracas,Venezuela, “pana o llave”, porque o uso dessa expressãoremete ao pão que alimenta a alma. Em Buenos Aires,Argentina, Mário Benedetti explica que o uso dapalavra chave (“llave”) foi porque ele tinha a chave de5 amigos para entrar em suas casas se fosse preciso, emtempos de terror (“las llaves que lo salvaron”). Resposta: CC EENNEEMM -- 11..OODDIIAA-- NNOOVVEEMMBBRR']"
3,C,Disponível em: www.inali.gob.mx. Acesso em: 2 dez. 2018. Esse cartaz tem a função social de ,"['difundir a arte iconográfica indígena mexicana.', 'resgatar a literatura popular produzida em língua zapoteca. ', 'questionar o conhecimento do povo mexicano sobre as línguas ameríndias. ', 'destacar o papel dos órgãos governamentais na conservação das línguas do México. ', 'defender a preservação das línguas originárias garantindo a diversidade linguística mexicana. Resolução O cartaz apresenta um provérbio em um línguaindígena mexicana (zapoteco), ressaltando que alíngua é parte da cultura e a importância de respeitá-la e preservá-la. Resposta: EE (Proverbio zapoteco) Las lenguas originarias de nuestra nación guardan gran parte de la riqueza cultural.Son parte viva de nuestro país.Si se hablan, son reconocidas y todos lasrespetamos, protegemos nuestropatrimonio nacional. EENNEEMM -- 11..OODDIIAA-- NNOOVVEEMMBBRR']"
4,A,"MURIG. Disponível em https://murigcolectivafeminista.wordpress.com. Acesso em: 26 out. 2021 (adaptado). No texto, as palavras “crianza” e “tribu” são usadas para ","['evidenciar a importância de uma rede de apoio para as mães na criação de seus filhos. ', 'denunciar a disparidade entre o trabalho das mães de diferentes classes sociais. EENNEEMM -- 11..OODDIIAA-- NNOOVVEEMMBBRROO//22002222', 'ressaltar o fechamento de escolas e creches durante o período pandêmico. ', 'ratificar a romantização da dedicação das mães na educação das crianças. ', 'enfatizar a proteção aos filhos em razão do isolamento social das famílias. Resolução O cartaz inicia mostrando as dificuldades das mãesem exercer a maternidade no período da pandemia,devido a falta de acesso às escolas e creches. Porém,ressalta que “maternar” nunca foi algo fácil e que acriação do filho depende das mães e que elas precisamde apoio. No final a frase “Para maternar se necesitauna tribu, la crianza no debería vivirse en soledad”comprova que as mães precisam de apoio para criarseus filhos, o que vai ao encontro do direito deigualdade das mulheres. Resposta: AA EENNEEMM -- 11..OODDIIAA-- NNOOVVEEMMBBRR']"
5,A,"Los niños de nuestro olvido Escribo sobre um destino que apenas puedo tocaren tanto um niño se inventacon pegamento un hogar Mientiras busco las palabras para hacer esta canciónum niño esquiva las balasque buscan su corazón Acurrucado en mi calle duerme um niño y la piedadarma lejos un pesebrey juega a la navidad Arma lejos un pesebre y juega a la navidady juega a la navidady juega, y juega, y juega... La niñez de nuestro olvido pide limosna en un bary lava tu parabrisaspor un peso, por un pan Si las flores del futuro crecen con tanto dolorseguramente mañanaserá un mañana sin sol. SOSA, M. In: Corazón libre . Argentina: E.D.G.E., 2004 (fragmento). No texto, a expressão “un mañana sin sol” é usada para concluir uma crítica ao(à) ","['descaso diante da problemática de crianças em situação de rua. ', 'violência característica do cotidiano das grandes metrópoles. ', 'estímulo à mendicância nos centros urbanos.', 'tendência de informalização do trabalho.', 'falta de serviços de saúde adequados. Resolução O poema mostra a situação das crianças que moram nas ruas e pedem esmolas para sobreviver. A palavra“olvido” significa esquecimento e demonstra claramente a falta de atenção por parte da sociedade. EENNEEMM -- 11..OODDIIAA-- NNOOVVEEMMBBRROO//22002222Essas crianças serão o futuro (“…las flores del futuro…”) que não terão um amanhã feliz (“ … unmañana sin sol”). Resposta: AA EENNEEMM -- 11..OODDIIAA-- NNOOVVEEMMBBRR']"
6,E,"10 de maio Fui na delegacia e falei com o tenente. Que homem amavel! Se eu soubesse que ele era tão amavel, eu teriaido na delegacia na primeira intimação. [...] O tenenteinteressou-se pela educação dos meus filhos. Disse-meque a favela é um ambiente propenso, que as pessoas temmais possibilidade de delinquir do que tornar-se util apatria e ao país. Pensei: se ele sabe disto, porque não fazum relatorio e envia para os politicos? O Senhor JanioQuadros, o Kubstchek, e o Dr. Adhemar de Barros? Agorafalar para mim, que sou uma pobre lixeira. Não possoresolver nem as minhas dificuldades. ... O Brasil precisa ser dirigido por uma pessoa que já passou fome. A fome tambem é professora. Quem passa fome aprende a pensar no próximo, e nas crianças. JESUS, C. M. Quarto de despejo : diário de uma favelada. São Paulo: Ática, 2014. A partir da intimação recebida pelo filho de 9 anos, a autora faz uma reflexão em que transparece a ","['lição de vida comunicada pelo tenente.', 'predisposição materna para se emocionar.', 'atividade política marcante da comunidade.', 'resposta irônica ante o discurso da autoridade.', 'necessidade de revelar seus anseios mais íntimos. Resolução A autora, ante as explanações do delegado – “a favela é um ambiente propenso [à violência]” –, indaga-sesobre a razão pela qual tais explanações não sãolevadas às autoridades competentes. Esse questio -namento é irônico, pois repõe o problema da violênciano âmbito político. Resposta: DD EENNEEMM -- 11..OODDIIAA-- NNOOVVEEMMBBRR']"
7,A,"Firmo, o vaqueiro No dia seguinte, à hora em que saía o gado, estava eu debruçado à varanda quando vi o cafuzo que preparava oanimal viajeiro: – Raimundinho, como vai ele?...De longe apontou a palhoça.– Sim.O braço caiu-lhe, olhou-me algum tempo comovido; depois, saltando para o animal, levou o polegar à bocafazendo estalar a unha nos dentes: “Às quatro da manhã...Atirei um verso e disse, para bulir com ele: Pega, velho!Não respondeu. Tio Firmo, mesmo velho e doente, nãoera homem para deixar um verso no chão... Fui ver,coitado!... estava morto. E deu de esporas para que eu nãolhe visse as lágrimas. NETTO, C. In: MARCHEZAN, L. G. (Org.). O conto regionalista . São Paulo: Martins Fontes, 2009. A passagem registra um momento em que a expres - sividade lírica é reforçada pela ","['plasticidade da imagem do rebanho reunido.', 'sugestão da firmeza do sertanejo ao arrear o cavalo.', 'situação de pobreza encontrada nos sertões brasileiros.', 'afetividade demonstrada ao noticiar a morte do cantador. ', 'preocupação do vaqueiro em demostrar sua virilidade. Resolução A expressividade lírica decorre da maneira pela qual a morte de tio Firmo é relatada: os versos lançados enão respondidos pelo velho; as lágrimas contidas deRaimundinho. Resposta: DD EENNEEMM -- 11..OODDIIAA-- NNOOVVEEMMBBRR']"
8,A,"O bebê de tarlatana rosa – [...] Na terça desliguei-me do grupo e caí no mar alto da depravação, só, com uma roupa leve por cima da pelee todos os maus instintos fustigados. De resto a cidadeinteira estava assim. É o momento em que por trás dasmáscaras as meninas confessam paixões aos rapazes, é oinstante em que as ligações mais secretas transparecem,em que a virgindade é dúbia e todos nós a achamos inútil,a honra uma caceteação, o bom senso uma fadiga. Nessemomento tudo é possível, os maiores absurdos, osmaiores crimes; nesse momento há um riso que galvanizaos sentidos e o beijo se desata naturalmente. Eu estava trepidante, com uma ânsia de acanalhar-me, quase mórbida. Nada de raparigas do galarim perfumadase por demais conhecidas, nada do contato familiar, mas odeboche anônimo, o deboche ritual de chegar, pegar,acabar, continuar. Era ignóbil. Felizmente muita gentesofre do mesmo mal no carnaval. RIO, J. Dentro da noite . São Paulo: Antíqua, 2002. No texto, o personagem vincula ao carnaval atitudes e reações coletivas diante das quais expressa ","['consagração da alegria do povo.', 'atração e asco perante atitudes libertinas.', 'espanto com a quantidade de foliões nas ruas.', 'intenção de confraternizar com desconhecidos.', 'reconhecimento da festa como manifestação cultural. Resolução A atitude da personagem é de atração – como fica evidente no trecho “Eu estava trepidante, com umaânsia de acanalhar-me” –, mas também de repulsa –como em “o deboche ritual de chegar, pegar, acabar,continuar. Era ignóbil”. Resposta: BB EENNEEMM -- 11..OODDIIAA-- NNOOVVEEMMBBRR']"
9,A,"A conquista da medalha de prata por Rayssa Leal, no skate street nos Jogos Olímpicos, é exemplo da representatividade feminina no esporte, avalia a âncorado jornal da rede de televisão da CNN. A apresentadora,que também anda de skate, celebrou a vitória dabrasileira, que entrou para a história como a atleta maisnova a subir num pódio defendendo o Brasil. “Essarepresentatividade do esporte nos Jogos faz pensarmosque não temos que ficar nos encaixando em nenhumlugar. Posso gostar de passar notícia e, mesmo assim,gostar de skate, subir montanha, mergulhar, andar de bike,fazer yoga”. Temos que parar de ficar enquadrando aspessoas dentro das regras. A gente vive num padrão noqual a menina ganha boneca, mas por que também nãofazer um esporte de aventura? Por que o homem pode semachucar, cair de joelhos, e a menina tem que estarsempre lindinha dentro de um padrão? Acabamoslimitando os talentos das pessoas”, afirmou a jornalista,sobre a prática do skate por mulheres. Disponível em: www.cnnbrasil.com.br. Acesso em: 31 out. 2021 (adaptado). O discurso da jornalista traz questionamentos sobre a relação da conquista da skatista com a ","['conciliação do jornalismo com a prática do skate.', 'inserção das mulheres na modalidade skate street . ', 'desconstrução da noção do skate como modalidade masculina. ', 'vanguarda de ser a atleta mais jovem a subir no pódio olímpico. ', 'conquista de medalha nos Jogos Olímpicos de Tóquio. Resolução Ao abordar a conquista da medalha de prata por Rayssa Leal, no skate street, e ao indagar certos padrões de genêro – “menina ganha boneca, mas porque também não fazer um esporte de aventura?” –, ajornalista promove “desconstrução da noção de skatecomo modalidade masculina”. Resposta: CC EENNEEMM -- 11..OODDIIAA-- NNOOVVEEMMBBRR']"
10,C,"“Vida perfeita” em redes sociais pode afetar a saúde mental Nas várias redes sociais que povoam a internet, os chamados digital influencers estão sempre felizes e pregam a felicidade como um estilo de vida. Essaspessoas espalham conteúdo para milhares de seguidores,ditando tendências e mostrando um estilo de vidasonhando por muitos, como o corpo esbelto, viagensincríveis, casas deslumbrantes, carros novos e alegria emtempo integral, algo bem improvável de ocorrer o tempotodo, aponta Carla Furtado, mestre em psicologia efundadora do Instituto Feliciência. A problemática pode surgir com a busca incessante por essa felicidade, que gera efeitos colaterais em quemconsome diariamente a “vida perfeita” de outros. Daí vemo conceito de positividade tóxica: a expressão tem sidousada para abordar uma espécie de pressão pela adoção deum discurso positivo, aliada a uma vida editada para asredes sociais. Para manter a saúde mental e evitar seratingido pela positividade tóxica, o uso racional das redessociais é o mais indicado, aconselha a médica psquiatraRenata Nayara Figueiredo, presidante da AssociaçãoPsquiatra de Brasília (APBr). Disponível em: https://agenciabrasil.ebc.com.br. Acesso em: 21 nov. 2021 (adaptado). Associada ao ideário de uma “vida perfeita”, a positivi - dade tóxica mencionada no texto é um fenômeno socialrecente, que se constitui com base em ","['representações estereotipadas e superficiais de felicidade. ', 'ressignificações contemporâneas do conceito de alegria. ', 'estilos de vida inacessíveis para a sociedade brasileira.', 'atitudes contraditórias de influenciadores digitais.', 'padrões idealizados e nocivos de beleza física. Resolução A felicidade proveniente das redes sociais dos digital influencers é estereotipada, superficial, e afeta negativamente o internauta sem senso crítico. Resposta: AA EENNEEMM -- 11..OODDIIAA-- NNOOVVEEMMBBRR']"
11,A,"TEXTO I EL GRECO. Laocoonte . Óleo sobre tela, 1,37cm x 1,72cm. National Gallery of Art, Washington, Estados Unidos, circa 1610- 1614. Disponível em: https://images.nga.gov. Acesso em: 28 jun 2019 (adaptado). TEXTO II Essa impressionante obra apresenta o sacerdote Laocoonte sendo punido pelos deuses por tentar alertaros troianos da ameaça do Cavalo de Troia, que escondiaum grupo de soldados gregos. Enviadas pelos deuses,serpentes marinhas são vistas matando Laocoonte e seusdois filhos como forma de punição. KAY , A. In: FARTHING, S. (Org.). Tudo sobre arte . Rio de Janeiro: Sextante, 2011 (adaptado). Produzida no início do século XVII, a obra maneirista distingue-se pela ","['representação da nudez masculina.', 'distorção ao representar a figura humana.', 'evocação de um fato da cultura clássica grega.', 'presença do tema da morte como punição da família.', 'utilização da perspectiva para integrar os diferentes planos. Resolução Trata-se de uma obra que apresenta deformação aorepresentar as figuras humanas. Embora El Grecotenha-se baseado num tema da Antiguidade Clássica,esse quadro maneirista se caracteriza por apresentarfiguras alongadas e deformadas. Resposta: BB EENNEEMM -- 11..OODDIIAA-- NNOOVVEEMMBBRR']"
12,B,"TEXTO I JUDD, D. Sem título . 1969. Disponível em: https://dasartes.com.br. Acesso em: 16 jun. 2022. TEXTO II Embora não fosse um grupo ou um movimento organi - zado, o Minimalismo foi um dos muitos rótulos(incluindo estruturas primárias, objetos unitários, arteABC e Cool Art ) aplicados pelos críticos para descrever estruturas aparentemente simples que alguns artistasestavam criando. Quando a arte minimalista começou asurgir, muitos críricos e um público opinativo julgaram-na fria, anônima e imperdoável. Os materiais industriaispré-fabricados frequentemente usados não pareciam“arte”. DEMPSEY , A. Estilos, escolhas e movimentos . São Paulo: Cosac & Naify, 2003 (adaptado). De acordo com os textos I e II, compreende-se que a obra minimalista é uma ","['representação da simplicidade pelo artista.', 'exploração da técnica da escultura cubista.', 'valorização do cotidiano por meio da geometria.', 'utilização da complexidade dos elementos formais.', 'combinação de formas sintéticas no espaço utilizado. Resolução As obras minimalistas contêm um mínimo de recursos e elementos. A escultura de Judd busca explorar aspossibilidades estéticas a partir de estruturastridimensionais. Trata-se de combinação de formassintéticas, evidenciando a coesão entre todos oselementos desse objeto artístico. Resposta: EE EENNEEMM -- 11..OODDIIAA-- NNOOVVEEMMBBRR']"
