questao,gabarito,enunciado,alternativas
33,A,"TEXTO I SEGALL, L. Eternos caminhantes . Óleo sobre tela, 138 x 184 cm. Museu Lasar Segall, IbramMinc, São Paulo, 1919. TEXTO II Em 1933, a obra Eternos caminhantes ingressou em uma das primeiras edições das exposições de Arte Degenerada , promovida por membros do partido nazista alemão. Nos anos seguintes, ela voltaria a ser exibida na mostra denominada Exposição da Vergonha , promovida por pequenos grupos abastados. Em 1937, essa obra foi confiscada pelo Ministério da Propaganda daquele país, na grande ação nacional-socialista contra a “Arte Degenerada ”. SCHWARTZ, J. Perseguição à Arte Moderna em tempos de guerra . São Paulo: Museu Lasar Segall, 2018 (adaptado).Quase cinquenta obras de Lasar Segall foram confiscadas pelo regime totalitário alemão na primeira metade do século XX, entre elas a obra Eternos caminhantes , considerada degenerada por ","['representar uma estética tida como inconveniente para o ideário político vigente. ', 'manifestar um posicionamento político-cultural concebido por grupos de oposição. ', 'expressar a cultura artística por meio da representação parcial do corpo humano. ', 'apresentar uma composição que antecipa o imaginário artístico germânico. ', 'estimular discussões sobre o papel da arte na construção coletiva de cultura.']"
34,C,"TEXTO I Logo no início de Gira , um grupo de sete bailarinas ocupa o centro da cena. Mãos cruzadas sobre a lateral esquerda do quadril, olhos fechados, troncos que pendulam sobre si mesmos em vaguíssimas órbitas, tudo nelas sugere o transe. Está estabelecido o caráter volátil do que se passará no palco dali para frente. Mas engana-se quem pensa que vai assistir a uma representação mimética dos cultos afro-brasileiros. TEXTO II Disponível em: www.grupocorpo.com.br. Acesso em: 2 jul. 2019. No diálogo que estabelece com religiões afro-brasileiras, sintetizado na descrição e na imagem do espetáculo, a dança exprime uma ","['crítica aos movimentos padronizados do balé clássico. ', 'representação contemporânea de rituais ancestrais extintos. ', 'reelaboração estética erudita de práticas religiosas populares. ', 'releitura irônica da atmosfera mística presente no culto a entidades. ', 'oposição entre o resgate de tradições e a efemeridade da vida humana.*010175AZ15*16 –LC • 1 º DIA • CADERNO 1 • AZUL –']"
35,A,"indústria do esporte eletrônico é um mercado que está crescendo em um ritmo mais rápido do que a economia mundial. Sua popularidade cresceu muito e no Brasil não é diferente. De acordo com os dados de uma pesquisa, mais de 64% dos brasileiros que jogam videogame já ouviram falar de esporte eletrônico. No entanto, o que chama a atenção é o crescimento superior a 10% do público praticante comparado ao ano anterior, que subiu de 44,7% para 55,4%. Trata-se de um percentual expressivo, já que o Brasil está no top 3 dentre os países que têm maior número de espectadores de esporte eletrônico do mundo. Comparado ao ano anterior, em 2020, o Brasil teve um marco de crescimento de 20% na audiência. Mundo afora, a árdua dedicação de grandes gamers contribuiu para o reconhecimento do Comitê Olímpico Internacional, aliado a outras cinco federações esportivas e suas desenvolvedoras de jogos, que direcionaram um olhar mais atento ao assunto, permitindo dar o primeiro passo para concretizar, pela primeira vez na história dos jogos eletrônicos, um evento olímpico oficial. Disponível em: https://chicoterra.com. Acesso em: 19 nov. 2021 (adaptado). O contexto em que o esporte eletrônico é apresentado no texto demonstra o(a) ","['condição favorável à expansão dessa modalidade. ', 'promoção dessa prática por jogadores profissionais. ', 'impulsionamento de um processo de marketing. ', 'favorecimento de fabricantes dos jogos. ', 'modificação da audiência televisiva.']"
36,A,"O Marabaixo é uma expressão artístico-cultural formada nas tradições e na identificação cultural entre as comunidades negras do Amapá. O nome remonta às mortes de escravizados em navios negreiros que eram jogados na água. Em sua homenagem, hinos de lamento eram cantados mar abaixo, mar acima. Posteriormente, o Marabaixo se integrou à vivência das comunidades negras em um ciclo de danças, cantorias com tambores e festas religiosas, recebendo, em 2018, o título de Patrimônio Cultural do Brasil. Disponível em: http://portal.iphan.gov.br. Acesso em: 15 nov. 2021 (adaptado). manifestação do Marabaixo se constituiu em expressão de arte e cultura, exercendo função de ","['ressignificar episódios dramáticos em novas práticas culturais. ', 'adaptar coreografias como imitação dos movimentos do mar. ', 'lembrar dos mortos no passado escravista como forma de lamento. ', 'perpetuar uma narrativa de apagamento dos fatos históricos traumáticos. ', 'ritualizar a passagem de atos fúnebres nas produções coletivas com espírito festivo.']"
37,C,"O uso das redes sociais como forma de ampliar universos foi uma descoberta recente para o artista Wolney Fernandes, que começou a criar quando o ambiente em Goiás era mais árido em relação às artes visuais. “Hoje, ser diferente é uma potência e quem sabe o que quer com a própria arte encontra espaço”, diz. As colagens artísticas do goiano aparecem em capas de obras literárias pelo Brasil e exterior. Disponível em: https://opopular.com.br. Acesso em: 15 nov. 2021 (adaptado). O artista goiano Wolney Fernandes busca expor seu trabalho por meio de plataformas virtuais com o objetivo de ","['dar suporte à técnica de colagem em Artes Visuais, contornando dificuldades práticas. ', 'aproximar-se da estética visual própria da editoração de obras artísticas, como capas de livros. ', 'oferecer uma vitrine internacional para sua produção artística, a fim de dar mais visibilidade a suas obras. ', 'enfatizar o caráter original e inovador de suas criações artísticas, diferenciando-se das artes tradicionais. ', 'trazer um sentido tecnológico às suas colagens, uma vez que as imagens artísticas são recorrentes nas redes sociais.']"
38,A,"O mais antigo grupo de rap indígena do país, Brô MCs, surgiu em 2009, na aldeia Jaguapiru, em Dourados, Mato Grosso do Sul. Os integrantes conheceram o rap pelo rádio, ouvindo um programa que apresentava cantores e grupos brasileiros desse gênero musical. O Brô MCs conseguiu influenciar outros a fazerem rap e a lutarem pelas causas indígenas. Um dos nomes do movimento, Kunumí MC, é um jovem de 16 anos, da aldeia Krukutu, em São Paulo. O adolescente enxerga o rap como uma cultura da defesa e começou a fazer rimas quando percebeu que a poesia, pela qual sempre se interessou, podia virar música. Nas letras que cria, inspiradas tanto pelo rap quanto pelos ritmos indígenas, tenta incluir sempre assuntos aos quais acha importante dar voz, principalmente, a questão da demarcação de terras. Disponível em: www.correiobraziliense.com.br. Acesso em: 13 nov. 2021 (adaptado). O movimento rap dos povos originários do Brasil revela o(a) ","['fusão de manifestações artísticas urbanas contemporâneas com a cultura indígena. ', 'contraposição das temáticas socioambientais indígenas às questões urbanas. ', 'rejeição da indústria radiofônica às músicas indígenas. ', 'distanciamento da realidade social indígena. ', 'estímulo ao estudo da poesia indígena.*010175AZ16*17 –LC • 1 º DIA • CADERNO 1 • AZUL –']"
39,C,"petição on-line criada por um cidadão paulista surtiu efeito: casado há três anos com seu companheiro, ele pedia a alteração da definição de “casamento” no tradicional dicionário Michaelis em português. Na definição anterior, casamento aparecia como “união legítima entre homem e mulher” e “união legal entre homem e mulher, para constituir família”. O novo verbete não traz em nenhum momento as palavras homem ou mulher — agora a definição de casamento se refere a “pessoas”. Para o diretor de comunicação do site onde a petição foi publicada, a iniciativa mostra a “eficiência da mobilização”. “Em dois dias, mudou-se uma definição que permanecia a mesma há décadas”, afirma. E conclui: “A plataforma serve para todos os tipos de causas, para as mudanças que importam para as pessoas.”. SENRA, R. Disponível em: www.bbc.com. Acesso em: 29 out. 2015. notícia trata da mudança ocorrida em um dicionário da língua portuguesa. Segundo o texto, essa mudança foi impulsionada pela ","['inclusão de informações no verbete. ', 'relevância social da instituição casamento. ', 'utilização pública da petição pelos cidadãos. ', 'rapidez na disseminação digital do verbete. ', 'divulgação de plataformas para a criação de petição.']"
40,B,"neozelandesa Laurel Hubbard fez história nos Jogos Olímpicos. Apesar de ter ficado de fora da disputa por medalhas, a levantadora de peso deixou sua marca na edição de Tóquio por ser a primeira mulher abertamente transgênero a participar de uma competição olímpica. No início da carreira, na década de 1990, a neozelandesa participava de disputas na categoria masculina. Em 2001, aos 23 anos, ela se afastou da atividade. “A pressão de tentar me encaixar em um mundo que talvez não tenha sido feito para pessoas como eu se tornou um fardo muito grande para suportar.” Em 2012, Laurel começou sua transição de gênero por meio de terapias hormonais e, em 2013, declarou abertamente ser uma mulher trans. Para o Comitê Olímpico Internacional, a participação de mulheres trans nos Jogos é permitida caso o nível de testosterona, hormônio que aumenta a massa muscular, esteja abaixo de 10 nanomols por litro por pelo menos 12 meses. Disponível em: https://revistagalileu.globo.com. Acesso em: 18 nov. 2021 (adaptado). No texto, os limites do potencial inclusivo do esporte são dados pela ","['dificuldade de conseguir bons resultados esportivos. ', 'dependência de características biológicas padronizadas. ', 'inexistência de uma categoria para pessoas transgênero. ', 'necessidade de afastamento temporário das competições. ', 'impossibilidade de uso controlado de substâncias exógenas.']"
41,B,"“Ganhei 25 medalhas em mundiais, sete em Jogos Olímpicos, e sou uma sobrevivente de abuso sexual.” Foi assim que Simone Biles se apresentou ao comitê do Senado norte-americano que investiga as supostas falhas do FBI no caso Larry Nassar. Biles e outras três atletas, vítimas dos abusos do ex-médico da equipe de ginástica feminina dos EUA, exigiram que os agentes da investigação sejam processados por falta de ação prévia contra Nassar, agora preso. Biles esclareceu que culpa Larry Nassar e “todo o sistema que o permitiu e o perpetrou”, acusando a Federação de Ginástica e o Comitê Olímpico dos Estados Unidos de saberem “muito antes” que ela havia sofrido abusos. A melhor ginasta do mundo é um ícone. Nos Jogos Olímpicos de Tóquio, uma lesão psicológica a impediu de competir como previa. No entanto, ela chegou ao topo como uma líder no trabalho de acabar com o preconceito com os problemas de saúde mental. “Não quero que nenhum outro atleta olímpico sofra o horror que eu e outras centenas suportamos e continuamos suportando até hoje”, afirmou. Disponível em: https://brasil.elpais.com. Acesso em: 31 out. 2021 (adaptado). O fato relatado na notícia chama a atenção acerca da necessidade de reflexão sobre a relação entre o esporte e ","['o desempenho atlético internacional. ', 'a dimensão emocional dos atletas. ', 'os comitês olímpicos nacionais. ', 'as instituições de inteligência. ', 'as federações esportivas.']"
42,E,"O acesso às Práticas Corporais/Atividades Físicas (PC/AF) é desigual no Brasil, à semelhança de outros indicadores sociais e de saúde. Em geral, PC/AF prazerosas, diversificadas, mais afeitas ao período de lazer estão concentradas nas populações mais abastadas. As atividades físicas de deslocamento, trajetos a pé ou de bicicleta para estudar ou trabalhar, por exemplo, são mais frequentes na classe social menos favorecida. Aqui, há uma relação inversa e perversa entre variáveis socioeconômicas de acesso às PC/AF. As maiores prevalências de inatividade física foram em mulheres, pessoas com 60 anos ou mais, negros, pessoas com autoavaliação de saúde ruim ou muito ruim, com renda familiar de até quatro salários mínimos por pessoa, pessoas que desconhecem programas públicos de PC/AF e residentes em áreas sem locais públicos para a prática. KNUTH, A. G.; ANTUNES, P. C. Saúde e Sociedade, n. 2, 2021 (adaptado). O fator central que impacta a realização de práticas corporais/atividades físicas no tempo de lazer no Brasil é a ","['diferença entre homens e mulheres. ', 'inexistência de políticas públicas. ', 'diversidade de faixa etária. ', 'variação de condição étnica. ', 'desigualdade entre classes sociais.*010175AZ17*18 –LC • 1 º DIA • CADERNO 1 • AZUL –']"
43,A,"Mestre e companheiro, disse eu que nos íamos despedir. Mas disse mal. A morte não extingue: transforma; não aniquila: renova; não divorcia: aproxima. Um dia supuseste “morta e separada” a consorte dos teus sonhos e das tuas agonias, que te soubera “pôr um mundo inteiro no recanto” do teu ninho; e, todavia, nunca ela te esteve mais presente, no íntimo de ti mesmo e na expressão do teu canto, no fundo do teu ser e na face de tuas ações. Esses catorze versos inimitáveis, em que o enlevo dos teus discípulos resume o valor de toda uma literatura, eram a aliança de ouro do teu segundo noivado, um anel de outras núpcias, para a vida nova do teu renascimento e da tua glorificação, com a sócia sem nódoa dos teus anos de mocidade e madureza, da florescência e frutificação de tua alma. Para os eleitos do mundo das ideias a miséria está na decadência, e não na morte. A nobreza de uma nos preserva das ruínas da outra. Quando eles atravessavam essa passagem do invisível, que os conduz à região da verdade sem mescla, então é que entramos a sentir o começo do seu reino, o reino dos mortos sobre os vivos. BARBOSA, R. O adeus da Academia a Machado de Assis . Rio de Janeiro: Agir, 1962. Esse é um trecho do discurso de Rui Barbosa na Academia Brasileira de Letras em homenagem a Machado de Assis por ocasião de sua morte. Uma das características desse discurso de homenagem é a presença de ","['metáforas relacionadas à trajetória pessoal e criadora do homenageado. ', 'recursos fonológicos empregados para a valorização do ritmo do texto. ', 'frases curtas e diretas no relato da vida e da morte do homenageado. ', 'contraposição de ideias presentes na obra do homenageado. ', 'seleção vocabular representativa do sentimento de nostalgia.']"
44,A,Disponível em: www.facebook.com/minsaude. Acesso em: 13 jun. 2018.Essa campanha publicitária do Ministério da Saúde visa ,"['divulgar um conjunto de benefícios proporcionados pela amamentação. ', 'apresentar tratamentos para infecções respiratórias em bebês. ', 'defender o direito das mulheres de amamentar em público. ', 'orientar sobre os exercícios para uma boa amamentação. ', 'informar sobre o aumento de anticorpos nas mães.']"
45,E,"Carta aberta à população brasileira Prezados Cidadãos e Cidadãs, O envelhecimento populacional é um fenômeno mundial. Infelizmente, nosso país ainda não está preparado para atender às demandas dessa população. Este é o retrato da saúde pública no Brasil, que, apesar dos indiscutíveis avanços, apresenta um cenário de deficiências e falta de integração em todos os níveis de atenção à saúde: primária (atendimento deficiente nas unidades de saúde da atenção básica), secundária (carência de centros de referência com atendimento por especialistas) e terciária (atendimento hospitalar com abordagem ao idoso centrada na doença), ou seja, não há, na prática, uma rede de atenção à saúde do idoso. Diante desse cenário, a Sociedade Brasileira de Geriatria e Gerontologia (SBGG) vem a público manifestar suas preocupações com o presente e o futuro dos idosos no Brasil. É preciso garantir a saúde como direito universal. Esperamos que tanto nossos atuais quanto os futuros governantes e legisladores reflitam sobre a necessidade de investir na saúde e na qualidade de vida associada ao envelhecimento. Dignidade à saúde do idoso! Rio de Janeiro, 15 de setembro de 2014. Disponível em: www.sbgg.org.br. Acesso em: 20 out. 2021 (adaptado). O objetivo desse texto é sensibilizar o idoso a respeito dos cuidados com a saúde. alertar os governantes sobre os cuidados requeridos pelo idoso. ","['divulgar o trabalho da Sociedade Brasileira de Geriatria e Gerontologia. ', 'informar o setor público sobre o retrocesso da legislação destinada à população idosa. ', 'chamar a atenção da população sobre a qualidade dos serviços de saúde pública para o idoso.*010175AZ18*19 –LC • 1 º DIA • CADERNO 1 • AZUL –*010175AZ19* INSTRUÇÕES PARA A REDAÇÃO 1. O rascunho da redação deve ser feito no espaço apropriado. 2. O texto definitivo deve ser escrito à tinta preta, na folha própria, em até 30 (trinta) linhas. 3. A redação que apresentar cópia dos textos da Proposta de Redação ou do Caderno de Questões terá o número de linhas copiadas desconsiderado para a contagem de linhas. 4. Receberá nota zero, em qualquer das situações expressas a seguir, a redação que: 4.1. tiver até 7 (sete) linhas escritas, sendo considerada “texto insuficiente”; 4.2. fugir ao tema ou não atender ao tipo dissertativo-argumentativo; 4.3. apresentar parte do texto deliberadamente desconectada do tema proposto; 4.4. apresentar nome, assinatura, rubrica ou outras formas de identificação no espaço destinado ao texto. TEXTO I O trabalho de cuidado não remunerado e mal pago e a crise global da desigualdade O trabalho de cuidado é essencial para nossas sociedades e para a economia. Ele inclui o trabalho de cuidar de crianças, idosos e pessoas com doenças e deficiências físicas e mentais, bem como o trabalho doméstico diário que inclui cozinhar, limpar, lavar, consertar coisas e buscar água e lenha. Se ninguém investisse tempo, esforços e recursos nessas tarefas diárias essenciais, comunidades, locais de trabalho e economias inteiras ficariam estagnados. Em todo o mundo, o trabalho de cuidado não remunerado e mal pago é desproporcionalmente assumido por mulheres e meninas em situação de pobreza, especialmente por aquelas que pertencem a grupos que, além da discriminação de gênero, sofrem preconceito em decorrência de sua raça, etnia, nacionalidade e sexualidade. As mulheres são responsáveis por mais de três quartos do cuidado não remunerado e compõem dois terços da força de trabalho envolvida em atividades de cuidado remuneradas. Documento informativo – Tempo de Cuidar. Disponível em: https://www.oxfam.org.br. Acesso em: 18 de jul. de 2023 (adaptado). TEXTO II Média de horas dedicadas pelas pessoas de 14 anos ou mais de idade aos afazeres domésticos e/ou às tarefas de cuidado de pessoas, por sexo Brasil - 2019 Sexo Horas Semanais Homens 11,0 Mulheres 21,4 Fonte: IBGE - Pnad contínua anual Disponível em: https://agenciadenoticias.ibge.gov.br. Acesso em: 18 de jul. 2023 (adaptado). PROPOSTA DE REDAÇÃO ', 'partir da leitura dos textos motivadores e com base nos conhecimentos construídos ao longo de sua formação, redija texto dissertativo-argumentativo em modalidade escrita formal da língua portuguesa sobre o tema “Desafios para o enfrentamento da invisibilidade do trabalho de cuidado realizado pela mulher no Brasil”, apresentando proposta de intervenção que respeite os direitos humanos. Selecione, organize e relacione, de forma coerente e coesa, argumentos e fatos para a defesa de seu ponto de vista.TEXTO III ', 'sociedade brasileira tem passado por inúmeras transformações sociais ao longo das últimas décadas. Entre elas, as percepções sociais a respeito dos valores e das convenções de gênero e a forma como mulheres têm se inserido na sociedade. Algumas permanências, porém, chamam a atenção, como a delegação quase que exclusiva às famílias – e, nestas, às mulheres – de atividades relacionadas à reprodução da vida e da sociedade, usualmente nominadas trabalho de cuidado. Disponível em: https://repositorio.ipea.gov.br. Acesso em: 24 maio 2023 (adaptado). TEXTO IV DESAFIOS DO CUIDADO Apenas 15% dos ﬁlmes nacionais foram dirigidos por mulheres entre 2001 e 2010Rede de estradas conectava aldeias e culturas pré-colombianas na AmazôniaPterossauros podem ter se originado de pequenos répteis terrestresCresce o número de brasileiros entre os pesquisadores mais citados em 2020Aumenta o número de pessoas que demandam serviços de assistência, obrigando os países a repensar seus sistemas de atenção; no Brasil, protagon ismo continua familiar Covid-19: a complexidade da distribuição das vacinas; as startups que criaram os primeiros imunizantes aprovados; o impacto das mutações do vírusDESAFIOS DO CUIDADO Apenas 15% dos ﬁlmes nacionais foram dirigidos por mulheres entre 2001 e 2010Rede de estradas conectava aldeias e culturas pré-colombianas na AmazôniaPterossauros podem ter se originado de pequenos répteis terrestresCresce o número de brasileiros entre os pesquisadores mais citados em 2020Aumenta o número de pessoas que demandam serviços de assistência, obrigando os países a repensar seus sistemas de atenção; no Brasil, protagon ismo continua familiar Covid-19: a complexidade da distribuição das vacinas; as startups que criaram os primeiros imunizantes aprovados; o impacto das mutações do vírusDESAFIOS DO CUIDADO Aumenta o número de pessoas que demandam serviços de assistência, obrigando o s países a repensar seus sistemas de atenção; no Brasil, protagon ismo continua familiar Capa da revista Pesquisa. Disponível em: https://revistapesquisa.fapesp.br. Acesso em: 23 maio 2023 (adaptado).20 –CH • 1 º DIA • CADERNO 1 • AZUL –CIÊNCIAS HUMANAS E SUAS TECNOLOGIAS Questões de 46 a 90']"
46,C,"Fotografia da avó bordada SCARELI, G. A máquina de costura e os fios da memória. Revista Brasileira de Pesquisa (Auto)Biográfica , n. 18, maio-ago. 2021. definição de Sertão descrita no bordado associa esse recorte espacial a ","['percursos e roteiros turísticos. ', 'trajetos e movimentos holísticos. ', 'vivências e itinerários socioafetivos. ', 'fronteiras e demarcações territoriais. ', 'profissões e interesses econômicos.']"
47,D,"Felizes tempos eram esses! As moças iam à missa de madrugada. De dia ninguém as via e se alguma, em dia de festa, queria passear com a avó ou a tia, havia de ir de cadeirinhas. Bem razão têm os nossos velhos de chorar por esses tempos, em que as filhas não sabiam escrever, e por isso não mandavam nem recebiam bilhetinhos. Novo Correio de Modas , 1853, apud DONEGÁ, A. L. Publicar ficção em meados do século XIX : um estudo das revistas femininas editadas pelos irmãos Laemmert. Campinas: Unicamp, 2013 (adaptado). Na perspectiva do autor, as tradições e os costumes sociofamiliares sofreram alterações, no século XIX, decorrentes de quais fatores? ","['Hábitos de leitura e mobilidade regional. ', 'Circulação de impressos e trânsito religioso. ', 'Valorização da língua e imigração estrangeira. ', 'Práticas de letramento e transformação cultural. ', 'Flexibilização do ensino e reformismo pedagógico.']"
48,A,"No Cerrado, o conhecimento local está sendo cada vez mais subordinado à lógica do agronegócio. De um lado, o capital impõe os conhecimentos biotecnológicos, como mecanismo de universalização de práticas agrícolas e de novas tecnologias, e de outro, o modelo capitalista subordina homens e mulheres à lógica do mercado. Assim, as águas, as sementes, os minerais, as terras (bens comuns) tornam-se propriedade privada. Além do mais, há outros fatores negativos, como a mecanização pesada, a “pragatização” dos seres humanos e não humanos, a violência simbólica, a superexploração, as chuvas de veneno e a violência contra a pessoa. CALAÇA, M.; SILVA, E. B.; JESUS, J. N. Territorialização do agronegócio e subordinação do campesinato no Cerrado. Élisée, Rev. Geo. UEG , n. 1, jan.-jun. 2021 (adaptado). Os elementos descritos no texto, a respeito da territorialização da produção, demonstram que há um ","['cerco aos camponeses, inviabilizando a manutenção das condições para a vida. ', 'descaso aos latifundiários, impactando a plantação de alimentos para a exportação. ', 'desprezo ao assalariado, afetando o engajamento dos sindicatos para o trabalhador. ', 'desrespeito aos governantes, comprometendo a criação de empregos para o lavrador. ', 'assédio ao empresariado, dificultando o investimento de maquinários para a produção.']"
