questao,gabarito,enunciado,alternativas
72,B,"TEXTO I Por hora, apenas os mais abastados poderão sonhar em viajar ao espaço, seja por um foguete ou por um avião híbrido, mas toda a população global poderá sentir os efeitos dessas viagens e avanços tecnológicos. Para uma aventura dessas, as empresas tiveram que criar novas tecnologias que podem, em algum momento, voltar para a sociedade. A câmera fotográfica, hoje comum no mundo, antes foi uma invenção para ser usada em telescópios, e o titânio, usado até na medicina, foi desenvolvido para a construção de foguetes. ORLANDO, G. Corrida espacial dos bilionários pode trazer vantagens para todos . Disponível em: https://noticias.r7.com. Acesso em: 5 nov. 2021 (adaptado). TEXTO II ACREDITE EM MIM. NÃO CONFIE NESSE PESSOAL!BILIONÁRIOS LANÇAM NOVA ERA DE VIAGENS AO ESPAÇO... VIEMOS EM PAZ! CAZO. Disponível em: www.humorpolitico.com.br. Acesso em: 5 nov. 2021. Os textos apresentam perspectivas da nova corrida espacial que revelam, respectivamente: ","['Dependência e progresso. ', 'Expectativa e desconfiança. ', 'Angústia e adaptação. ', 'Pioneirismo e retrocesso. ', 'Receio e civilidade. *010175AZ26*27 –CH • 1 º DIA • CADERNO 1 • AZUL –']"
73,A,"Os séculos XV e XVI, quando se vão desmoronando as estruturas socioeconômicas da Idade Média perante os novos imperativos da Época moderna, constituem um momento-chave na história florestal de toda a Europa Ocidental. Abre-se, genericamente, um longo período de “crise florestal”, que se manifesta com acuidade nos países onde mais se desenvolvem as atividades industriais e comerciais. As necessidades em produtos lenhosos aumentam drasticamente com o crescimento do consumo nos mercados urbanos e nas regiões onde progridem a metalurgia e a construção naval, além da sua utilização na vida quotidiana de toda a população. DEVY-VARETA, N. Para uma geografia histórica da floresta portuguesa. Revista da Faculdade de Letras — Geografia , n. 1, 1986 (adaptado). Qual acontecimento do período contribuiu diretamente para o agravamento da situação descrita? ","['O processo de expansão marítima. ', 'A eclosão do renascimento cultural. ', 'A concretização da centralização política. ', 'O movimento de reformas religiosas. ', 'A manutenção do sistema feudal.']"
74,D,"Tahuantinsuyu — nome do Império Inca em quéchua — era dividido em quatro partes ou suyus: Chinchaysuyu (noroeste do Peru e Equador), Antisuyu (parte amazônica do império), Collasuyu (atual Bolívia) e Condesuyu (costa do Oceano Pacífico) e tinha Cuzco, no atual Peru, como sua capital imperial. Oficialmente, todas as etnias dominadas pelos incas deveriam adotar a língua quéchua, adorar o Sapa Inca e o Sol e pagar taxas em forma de horas de trabalhos periódicos. No entanto, pode-se dizer que o Império Inca era como um mosaico cultural em que vários e diferentes grupos étnicos adoravam o Sapa Inca e o Sol mas, simultaneamente, continuavam a adorar seus deuses locais e também a falar em suas línguas nativas. MARTINS, C. Os incas e os tahuantinsuyu : apresentação. Disponível em: http://antigo.anphlac.org. Acesso em: 6 out. 2021 (adaptado). Ao comparar, no texto, a vertente da dominação territorial com os aspectos culturais, os incas tinham uma postura ","['aceitável no que alude aos direitos humanos. ', 'admissível no que remete às crenças coloniais. ', 'tolerável no que se refere aos regimes tributários. ', 'flexível no que diz respeito aos costumes religiosos. ', 'compreensível no que concerne às normas laborais.']"
75,C,"torcida do Fluminense inicia um movimento para mudar a letra de uma das músicas mais populares das arquibancadas tricolores. Grupos pedem a remoção do termo “mulambo imundo”, em uma provocação direta ao Flamengo. Mulambo é um termo que surgiu em Angola, na época da escravatura, e eles eram chamados de mulambos pelos senhores de engenho, os patrões das fazendas. Disponível em: https://oglobo.globo.com. Acesso em: 23 nov. 2021. Qual mudança no comportamento social a proposta reportada no texto reflete? ","['Rejeição de costumes elitistas. ', 'Repulsão de condutas misóginas. ', 'Condenação do preconceito racial. ', 'Criminalização de práticas homofóbicas. ', 'Contestação do comportamento machista.']"
76,D,"Fonte: IBGEFilhos por mulher DécadasTaxa de fecundidade no Brasil De 1960 a 2020, número de filhos baixa de 6,3 para 1,5 01234567 1960 1970 1980 1990 2000 2010 2020 2030 2040 20506,3 5,8 4,1 2,8 2,4 1,8 1,5 1,5 1,5 1,5 Disponível em: www.insper.edu.br. Acesso em: 27 set. 2021 (adaptado). Qual fator foi determinante para a mudança do indicador apresentado no gráfico? ","['Flexibilização legal da prática de aborto. ', 'Envelhecimento da população brasileira. ', 'Crescimento dos casos de gravidez precoce. ', 'Participação feminina no mercado de trabalho. ', 'Diminuição dos benefícios na licença-maternidade.*010175AZ27*28 –CH • 1 º DIA • CADERNO 1 • AZUL –']"
77,E,"Havia já muito tempo que a Europa desfrutava os benefícios da vacina e arrancava à morte milhares de inocentes, condenados a serem vítimas do terrível flagelo das bexigas, e o governo de Portugal nunca se lembrara de transmitir ao Brasil a mais útil das descobertas humanas, quando aliás nenhum país mais do que ele carecia deste salutar invento ou se atendesse às vantagens da população ou ao perdimento de imensas somas na mortandade contínua de escravos, que este flagelo devorava. O certo é que mais ocupado de seu ouro que de seus habitantes, Portugal, como em outros muitos casos, esperou que o Brasil por seu próprio impulso remediasse a este mal. PEREIRA, J. C. 12 jan. 1828 apud LOPES, M. B.; POLITO, R. Para uma história da vacina no Brasil: um manuscrito inédito de Norberto e Macedo. História, Ciências, Saúde — Manguinhos , n. 2, abr.-jun. 2007 (adaptado). Escrito em 1828, o texto expressa a seguinte ideia de origem iluminista: ","['As leis observáveis regem o mundo material. ', 'O monarca racional promove a sociedade justa. ', 'O direito natural justifica a liberdade dos homens. ', 'A produção da terra garante a riqueza das nações. ', 'A responsabilidade dos governantes assegura a saúde dos povos.']"
78,A,"Os movimentos da agricultura urbana no Rio de Janeiro vêm crescendo nos últimos vinte anos, tanto por meio de reproduções de modelos de vida antigos, vinculados ao resgate dos próprios costumes, como — e cada vez mais — são revelados hábitos inventivos nos quais moradores urbanos de diferentes classes sociais, sem nenhuma referência anterior com o campo, passam a se dedicar a essas atividades. Ao possibilitar o acesso ao plantio e, consequentemente, à alimentação, permite-se uma nova relação com o que se come, reduzindo o percurso da cadeia produtiva e aproximando produtores de consumidores, pois ambos se confundem nas experiências de agricultura urbana. PORTILHO, M.; RODRIGUES, C. G. O.; FERNANDEZ, A. C. F. Cultivando relações no arranjo local da Penha: a mobilização de mulheres a partir das práticas de agricultura urbana na favela. Cidades, Comunidades e Territórios , n. 42, jun. 2021. prática agrícola destacada no texto apresenta como vantagem no espaço urbano a ","['ocupação de lugares ociosos. ', 'densificação da área central. ', 'valorização do mercado externo. ', 'priorização de insumos químicos. ', 'mecanização de técnicas de cultivo.']"
79,B,"TEXTO I Gerineldo dorme porque já está conformado com o seu mundo. Porque já sabe tudo o que lhe pode acontecer após haver submetido todos os objetos que o rodeiam a um minucioso inventário de possibilidades. Seu apartamento, mais que um apartamento, é uma teoria de sorte e de azar. Melhor que ninguém, Gerineldo conhece o coeficiente da dilatação de suas janelas e mantém marcado no termômetro, com uma linha vermelha, o ponto em que se quebrarão os vidros, despedaçados em estilhaços de morte. Sabe que os arquitetos e os engenheiros já previram tudo, menos o que nunca já aconteceu. MÁRQUEZ, G. G. O pessimista. In: Textos do Caribe . Rio de Janeiro: Record, 1981. TEXTO II situação é o sujeito inteiro (ele não é nada a não ser a sua situação) e é também a coisa inteira (nunca há mais nada senão as coisas). É o sujeito a elucidar as coisas pela sua própria superação, se assim quisermos; ou são as coisas a reenviar ao sujeito a imagem dele. É a total facticidade, a contingência absoluta do mundo, do meu nascimento, do meu lugar, do meu passado, dos meus redores — e é a minha liberdade sem limites que faz com que haja para mim uma facticidade. SARTRE, J.-P. O ser e o nada : ensaio de ontologia fenomenológica. Petrópolis: Vozes, 1997 (adaptado). postura determinista adotada pelo personagem Gerineldo contrasta com a ideia existencialista contida no pensamento filosófico de Sartre porque ","['evidencia a manifestação do inconsciente. ', 'nega a possibilidade de transcendência. ', 'contraria o conhecimento difuso. ', 'sustenta a fugacidade da vida. ', 'refuta a evolução biológica.']"
80,A,"O Golpe Militar de 1964 foi implacável no combate ao que restava das Ligas Camponesas, generalizadas na década anterior. No entanto, em relação aos sindicatos, sua atitude foi ambígua. Por meio de acordos com os Estados Unidos, foram concebidos centros sindicais e cursos de liderança com base em princípios conservadores e ministrados por membros da Igreja Católica. DEL PRIORE, M.; VENÂNCIO, R. Uma história da vida rural no Brasil . Rio de Janeiro: Ediouro, 2006 (adaptado). Os sindicatos rurais foram tratados da forma descrita no texto porque o governo pretendia utilizá-los para ","['controlar as tensões políticas. ', 'limitar a legislação trabalhista. ', 'divulgar o programa populista. ', 'regularizar a propriedade da terra. ', 'estimular a oferta de mão de obra.*010175AZ28*29 –CH • 1 º DIA • CADERNO 1 • AZUL –']"
81,A,"economia das ilegalidades se reestruturou com o desenvolvimento da sociedade capitalista. A ilegalidade dos bens foi separada da ilegalidade dos direitos. Divisão que corresponde a uma oposição de classes, pois, de um lado, a ilegalidade mais acessível às classes populares será a dos bens — transferência violenta das propriedades; de outro, à burguesia, então, se reservará a ilegalidade dos direitos: a possibilidade de desviar seus próprios regulamentos e suas próprias leis; e essa grande redistribuição das ilegalidades se traduzirá até por uma especialização dos circuitos judiciários; para as ilegalidades de bens — para o roubo — os tribunais ordinários e os castigos; para as ilegalidades de direitos — fraudes, evasões fiscais, operações comerciais irregulares — jurisdições especiais com transações, acomodações, multas atenuadas etc. FOUCAULT, M. Vigiar e punir : nascimento da prisão. Petrópolis: Vozes, 1987. O texto apresenta uma relação de cálculo político-econômico que caracteriza o poder punitivo por meio da ","['gestão das ilicitudes pelo sistema judicial. ', 'aplicação das sanções pelo modelo equânime. ', 'supressão dos crimes pela penalização severa. ', 'regulamentação dos privilégios pela justiça social. ', 'repartição de vantagens pela hierarquização cultural.']"
82,B,"Os vapores cruzavam os mares transportando pessoas, mercadorias e ideias, e ainda carregavam a mala postal, repleta de mensagens. Múltiplas histórias escritas atravessavam o oceano buscando por notícias de filhos e pais, irmãos, maridos e esposas, noivos e noivas. As missivas traziam boas e más novas, comunicavam alegremente nascimentos e casamentos, também doenças e mortes; enviavam declarações de amor e fidelidade, fotos de família; encaminhavam conselhos de velhos, pedidos de ajuda e de dinheiro; expediam cartas bancárias e de chamada. Essa literatura epistolar possibilitava a transmissão e reconstrução das tradições. Os deslocamentos tornaram-se um dos mais potentes produtores de escritura ao longo da história. TRUZZI, O.; MATOS, I. Saudades: sensibilidades no epistolário de e/imigrantes portugueses (Portugal-Brasil 1890-1930). Rev. Bras. Hist ., n. 70, jul.-dez. 2015. Conforme o texto, as correspondências trocadas entre imigrantes no Brasil com os seus países de procedência constituíam um dispositivo tecnológico que possibilitava o(a) ","['disputa ideológica entre a comunidade de estrangeiros e a de nativos. ', 'circularidade cultural entre a sociedade de partida e a de acolhimento. ', 'controle doutrinário das narrativas do cotidiano de origem e de destino. ', 'fiscalização política dos fluxos de populações do Novo e do Velho Mundo. ', 'monitoramento social dos grupos de trabalhadores da cidade e do campo.']"
83,C,"Diversos são os fatores causadores da degradação do solo, atuando de forma direta ou indireta, mas quase sempre a grande maioria das terras degradadas inicia esse processo com o desmatamento, que pode ser seguido por diversas formas de ocupação desordenada, como: corte de taludes para a construção de casas, rodovias e ferrovias, agricultura, com uso da queimada, vários tipos de mineração, irrigação excessiva, crescimento desordenado das cidades, superpastoreio, uso do solo para diversos tipos de despejos industriais e domésticos, sem tratamento da área que recebe esses despejos; enfim, de uma forma ou de outra, os solos tornam-se degradados, sendo muitas vezes difícil, ou quase impossível, a sua recuperação. GUERRA, A. T. Degradação dos solos: conceitos e temas. In: GUERRA, A. T.; JORGE, M. C. O. (Org.). Degradação dos solos no Brasil . Rio de Janeiro: Difel, 2018. partir da ocupação desordenada exposta no texto, o que impede a recuperação do recurso natural destacado é a ","['elevação da biomassa. ', 'redução da salinização. ', 'diminuição da fertilidade. ', 'ampliação da microfauna. ', 'decomposição do substrato.']"
84,D,"partir da década de 1930, começam a ser discutidos no Brasil os princípios de racionalização do trabalho. As preocupações com a cozinha e o trabalho doméstico foram introduzidas com a medicina sanitária e a oferta de gás e eletricidade para uso doméstico no início do século XX. A organização da cozinha visava atingir uma simplificação das tarefas, com a economia de movimentos, e o barateamento dos equipamentos, a partir da produção em grande escala. A padronização e racionalização da habitação e seus componentes visava uma radical transformação da casa, em especial da cozinha, e apoiava-se tanto no desenvolvimento de novos equipamentos quanto nos estudos de racionalização do trabalho doméstico. A principal preocupação era o desenvolvimento de um novo tipo de habitação, que deveria induzir um novo comportamento social. SILVA, J. L. M. Transformações no espaço doméstico: o fogão a gás e a cozinha paulistana, 1870-1930. Anais do Museu Paulista , n. 2, jul.-dez. 2007 (adaptado). No contexto descrito, as mudanças mencionadas proporcionavam às mulheres o(a) ","['controle do orçamento familiar. ', 'libertação das tradições religiosas. ', 'exercício da representatividade política. ', 'ampliação dos momentos de socialização. ', 'afastamento das atividades especializadas. *010175AZ29*30 –CH • 1 º DIA • CADERNO 1 • AZUL –']"
85,D,"Produtores rurais europeus são antigos opositores de um grande acordo com o Mercosul. Na visão deles, existe um nítido risco de concorrência desleal, pois, na Europa, é preciso seguir regras mais rígidas de produção, o que encarece o processo. Assim, eles não conseguiriam competir com os preços, por exemplo, da carne brasileira e teriam seus negócios ameaçados. Por outro lado, o setor industrial europeu se mobiliza a favor do acordo, uma vez que as reduções de tarifas no comércio internacional dariam maior acesso ao mercado sul-americano. Um exemplo é o setor automotivo europeu, que prevê maior participação e concorrência nos países do Mercosul caso o acordo siga em frente. ROUBICEK, M. Como o risco ambiental afeta o acordo entre Mercosul e União Europeia . Disponível em: www.nexojornal.com.br. Acesso em: 25 out. 2021. No contexto do acordo citado, os dois grupos econômicos europeus defendem, respectivamente, a ","['restrição dos fluxos migratórios e a maior atuação de sindicatos. ', 'ampliação das leis trabalhistas e a plena importação de manufaturados. ', 'proteção das florestas nacionais e a ampla transferência de tecnologias. ', 'manutenção das barreiras fitossanitárias e a livre circulação de mercadorias. ', 'remoção dos entraves alfandegários e a melhor remuneração de empregados.']"
86,E,"Durante a Revolução Francesa, um certo padre Niollant escondeu-se no pequeno castelo de L’Escarbas. Pagou amplamente a hospitalidade do velho fidalgo ocupando-se da educação de sua filha, Anaïs. A presença da mãe em nada modificou essa educação masculina dada a uma jovem criatura já muito inclinada à independência em virtude da vida no campo. O padre transmitiu à aluna sua intrepidez de opiniões e sua facilidade de julgamento, sem pensar que essas qualidades, tão necessárias num homem, se tornam defeitos numa mulher destinada aos humildes afazeres de mãe de família. Embora o padre recomendasse continuamente à aluna ser tanto mais graciosa e modesta quanto seu saber era mais extenso, a senhorita de Nègrepelisse ficou com excelente opinião de si mesma. BALZAC, H. Ilusões perdidas . São Paulo: Penguin Classics; Cia. das Letras, 2011 (adaptado). O comportamento desenvolvido pela personagem evidencia uma postura de ","['abandono de laços afetivos. ', 'negação da ideia de subjetividade. ', 'aceitação da hierarquia de gênero. ', 'consolidação da estratificação social. ', 'ruptura de valores institucionalizados.']"
87,B,"TEXTO I Oriunda da Romênia, Genny Gleizer aportou no Brasil em 1932. Assim como milhares de judeus do Leste Europeu, sua vinda para o Brasil ocorreu em um momento de ascensão do antissemitismo na Europa que tornava precárias suas vidas. O Brasil se colocava como uma possibilidade na busca por condições de sobrevivência e desenvolvimento. ANTÃO, A. C. C. B. Gênero, imigração e política : o caso da judia comunista Genny Gleizer no Governo Vargas (1932-1935). Rio de Janeiro: Casa de Oswaldo Cruz, 2017 (adaptado). TEXTO II presença judaica no Brasil foi criando aos poucos certas desconfianças que se refletiram em órgãos da imprensa e em círculos intelectuais e políticos. Em parte, essa imagem negativa adviria da onda nacionalista surgida no final dos anos 1910, que concebia imigrantes como concorrentes dos trabalhadores brasileiros, ou como seres improdutivos, exploradores da mão de obra e da riqueza autóctone. Além disso, as elites políticas da época acreditavam que os estrangeiros eram portadores das doutrinas anarquista e comunista, estranhas à “índole do povo brasileiro”. Esses “indesejáveis” seriam um mal externo que corromperia a nação. MAIO, M. C.; CALAÇA, C. E. Um balanço da bibliografia sobre o antissemitismo no Brasil. In: GRINBERG, K. (Org.). Os judeus no Brasil . Rio de Janeiro: Civilização Brasileira, 2005 (adaptado). Conforme descrito nos textos, o tratamento dispensado aos grupos mencionados se fundamentava em ","['preceitos teológicos e religiosos. ', 'aspectos socioeconômicos e ideológicos. ', 'regulamentações territoriais e alfandegárias. ', 'orientações constitucionais e estatutárias. ', 'decretos legislativos e internacionais.']"
88,A,"Concorrer e competir não são a mesma coisa. concorrência pode até ser saudável sempre que a batalha entre agentes, para melhor empreender uma tarefa e obter melhores resultados finais, exige o respeito a certas regras de convivência preestabelecidas ou não. Já a competitividade se funda na invenção de novas armas de luta, num exercício em que a única regra é a conquista da melhor posição. competitividade é uma espécie de guerra em que tudo vale e, desse modo, sua prática provoca um afrouxamento dos valores morais e um convite ao exercício da violência. SANTOS, M. Por uma outra globalização : do pensamento único à consciência universal. Rio de Janeiro: Record, 2006. De acordo com a diferenciação feita pelo autor, que prática econômica é considerada moralmente condenável? ","['Adoção do dumping comercial. ', 'Fusão da função administrativa. ', 'Criação de holding empresarial. ', 'Limitação do mercado monopolista. ', 'Modernização da produção industrial.*010175AZ30*31 –CH • 1 º DIA • CADERNO 1 • AZUL –']"
89,D,"Simulação de mudança da temperatura média anual em relação ao período pré-industrial em três cenários de aquecimento global Simulação de mudança da pluviosidade média anual em relação ao período pré-industrial em três cenários de aquecimento global1,5 °C de aquecimento global 2 °C de aquecimento global 4 °C de aquecimento global 1,5 °C de aquecimento global 2 °C de aquecimento globalVariação (°C) Mais seco Mais úmidoMais quente Variação (%)4 °C de aquecimento global0 -40 -30 -20 -10 0 10 20 30 40 Fonte: IPCC0,5 11,5 22,5 33,5 44,5 55,5 66,5 7 PIVETTA, M. O clima no Antropoceno. Revista Pesquisa Fapesp , n. 307, set. 2021. Qual medida é capaz de minimizar as mudanças apresentadas nas simulações? ","['Expandir o transporte marítimo. ', 'Incentivar os fluxos migratórios. ', 'Monitorar as atividades vulcânicas. ', 'Controlar as emissões de carbono. ', 'Priorizar a utilização de termoelétricas.']"
90,B,"Não tinha outra filosofia. Nem eu. Não digo que a Universidade me não tivesse ensinado alguma; mas eu decorei-lhe só as fórmulas, o vocabulário, o esqueleto. Tratei-a como tratei o latim; embolsei três versos de Virgílio, dois de Horácio, uma dúzia de locuções morais e políticas, para as despesas da conversação. Tratei-os como tratei a história e a jurisprudência. Colhi de todas as cousas a fraseologia, a casca, a ornamentação. ASSIS, M. Memórias póstumas de Brás Cubas . Belo Horizonte: Autêntica, 1999. descrição crítica do personagem de Machado de Assis assemelha-se às características dos sofistas, contestados pelos filósofos gregos da Antiguidade, porque se mostra alinhada à ","['elaboração conceitual de entendimentos. ', 'utilização persuasiva do discurso. ', 'narração alegórica dos rapsodos. ', 'investigação empírica da physis. ', 'expressão pictográfica da pólis.*010175AZ31*RASCUNHO DA REDAÇÃOTranscreva a sua Redação para a Folha de Redação. 1 2 3 4 5 6 7 8 9 10 11 12 13 14 15 16 17 18 19 20 21 22 23 24 25 26 27 28 29 3032 –1º DIA • CADERNO 1 • AZUL –01 01*010175AZ32* Azul 1 Amarelo 2 Branco 3 Rosa 4 Ledor 9 Libras 101 Azul 2 Amarelo 3 Branco 4 Rosa 9 Ledor 10 Libras1 Dia 1°Capa1 Dia 4°Capa Libras 12 Ledor 11 Azul 7Rosa 8 Cinza 6 Amarelo 52 Dia 1°Capa 12 Libras 11 Ledor 7 Azul8 Rosa 6 Cinza 5 Amarelo2 Dia 4°Capa Bigurrilhos.indd 1Bigurrilhos.indd 1 14/06/2022 17:12:0614/06/2022 17:12:06']"
91,C,"Na tirinha de Mauricio de Sousa, os personagens Cebolinha e Cascão fazem uma brincadeira utilizando duas latas e um barbante. Ao perceberem que o som pode ser transmitido através do barbante, resolvem alterar o comprimento do barbante para ficar cada vez mais extenso. As demais condições permaneceram inalteradas durante a brincadeira. SOUSA, M. Disponível em: www.monica.com.br. Acesso em: 2 out. 2012 (adaptado). Na prática, à medida que se aumenta o comprimento do barbante, ocorre a redução de qual característica da onda sonora? ","['Altura. ', 'Período. ', 'Amplitude. ', 'Velocidade. ', 'Comprimento de onda.']"
92,A,"Informações digitais — dados — são gravadas em discos ópticos, como CD e DVD, na forma de cavidades microscópicas. A gravação e a leitura óptica dessas informações são realizadas por um laser (fonte de luz monocromática). Quanto menores as dimensões dessas cavidades, mais dados são armazenados na mesma área do disco. O fator limitante para a leitura de dados é o espalhamento da luz pelo efeito de difração, fenômeno que ocorre quando a luz atravessa um obstáculo com dimensões da ordem de seu comprimento de onda. Essa limitação motivou o desenvolvimento de lasers com emissão em menores comprimentos de onda, possibilitando armazenar e ler dados em cavidades cada vez menores. Em qual região espectral se situa o comprimento de onda do laser que otimiza o armazenamento e a leitura de dados em discos de uma mesma área? ","['Violeta. ', 'Azul. ', 'Verde. ', 'Vermelho. ', 'Infravermelho.']"
93,A,"O bluetooth é uma tecnologia de comunicação sem fio, de curto alcance, presente em diferentes dispositivos eletrônicos de consumo. Ela permite que aparelhos eletrônicos diferentes se conectem e troquem dados entre si. No padrão bluetooth , denominado de Classe 2, as antenas transmitem sinais de potência igual a 2,4 mW e possibilitam conectar dois dispositivos distanciados até 10 m. Considere que essas antenas se comportam como fontes puntiformes que emitem ondas eletromagnéticas esféricas e que a intensidade do sinal é calculada pela potência por unidade de área. Considere 3 como valor aproximado para π. Para que o sinal de bluetooth seja detectado pelas antenas, o valor mínimo de sua intensidade, em W m2, é mais próximo de ","['2,0 × 10–6. ', '2,0 × 10–5. ', '2,4 × 10–5. ', '2,4 × 10–3. ', '2,4 × 10–1.*020125AM2*3 CN • 2 º DIA • CADERNO 5 • AMARELO']"
