questao,gabarito,enunciado,alternativas
125,D,,"['(P\x03\x14 \x16\x1b\x03R\x03DUTXHyORJR\x03DOHPmR\x03:LOKHOP\x03.|QLJ\x0f\x03GLUHWRU\x03 GR\x03 0XVHX\x03 1DFLRQDO\x03 GR\x03 ,UDTXH\x0f\x03 HQFRQWURX\x03 XP\x03 REMHWR\x03HVWUDQKR\x03QD\x03FROHomR\x03GD\x03LQVWLWXLomR\x0f\x03TXH\x03SRGHULD\x03WHU\x03VLGR\x03usado como uma pilha, similar às utilizadas em nossos GLDV\x11\x03$\x03VXSRVWD\x03SLOKD\x0f\x03GDWDGD\x03GH\x03FHUFD\x03GH\x03\x15\x13\x13\x03D\x11&\x11\x0f\x03p\x03constituída de um pequeno vaso de barro (argila) no qual foram instalados um tubo de cobre, uma barra de ferro (aparentemente corroída por ácido) e uma tampa de betume (asfalto), conforme ilustrado. Considere os SRWHQFLDLV\x10SDGUmR\x03GH\x03UHGXomR \x03 E )H\x15+_)H \x03 \x03í\x13\x0f\x17\x17\x039 \x03 E(H+_+\x15) = 0,00 V; e E(Cu\x15+_&X \x03 \x03\x0e\x13\x0f\x16\x17\x039\x11 Tampa de betume Vestígio de ácidoTubo de cobre Vaso de barroBarra de ferro As pilhas de Bagdá e a acupuntura . Disponível em: http://jornalggn.com.br. $FHVVR\x03HP \x03\x14\x17\x03GH]\x11\x03\x15\x13\x14\x17\x03 DGDSWDGR \x11 Nessa suposta pilha, qual dos componentes atuaria como cátodo? AA tampa de betume. BO vestígio de ácido. CA barra de ferro. DO tubo de cobre. EO vaso de barro.']"
126,E,,"['$QDEROLVPR\x03H\x03FDWDEROLVPR\x03VmR\x03SURFHVVRV\x03FHOXODUHV\x03 DQWDJ{QLFRV\x0f\x03 TXH\x03 VmR\x03 FRQWURODGRV\x03 SULQFLSDOPHQWH\x03 SHOD\x03DomR\x03KRUPRQDO\x11\x033RU\x03H[HPSOR\x0f\x03QR\x03ItJDGR\x03D\x03LQVXOLQD\x03DWXD\x03FRPR\x03 XP\x03 KRUP{QLR\x03 FRP\x03 DomR\x03 DQDEyOLFD\x0f\x03 HQTXDQWR\x03 R\x03JOXFDJRQ\x03WHP\x03DomR\x03FDWDEyOLFD\x03H\x03DPERV\x03VmR\x03VHFUHWDGRV\x03em resposta ao nível de glicose sanguínea. Em caso de um indivíduo com hipoglicemia, o hormônio citado que atua no catabolismo induzirá o organismo a AUHDOL]DU\x03D\x03IHUPHQWDomR\x03OiWLFD\x11 Bmetabolizar aerobicamente a glicose. Cproduzir aminoácidos a partir de ácidos graxos. Dtransformar ácidos graxos em glicogênio. EHVWLPXODU\x03D\x03XWLOL]DomR\x03GR\x03JOLFRJrQLR\x11']"
127,D,,"['8VDQGR\x03XP\x03GHQVtPHWUR\x03FXMD\x03PHQRU\x03GLYLVmR\x03GD\x03HVFDOD\x0f\x03 isto é, a diferença entre duas marcações consecutivas, é de 5,0 × 10í\x15 g cmí3, um estudante realizou um teste de densidade: colocou este instrumento na água pura e REVHUYRX\x03TXH\x03HOH\x03DWLQJLX\x03R\x03UHSRXVR\x03QD\x03SRVLomR\x03PRVWUDGD\x11 DensímetroLegenda: Água Em dois outros recipientes A e B\x03FRQWHQGR\x03\x15\x03OLWURV\x03GH\x03 iJXD\x03SXUD\x0f\x03HP\x03FDGD\x03XP\x0f\x03HOH\x03DGLFLRQRX\x03\x14\x13\x13\x03J\x03H\x03\x15\x13\x13\x03J\x03GH\x03NaCl, respectivamente. Quando o cloreto de sódio é adicionado à água SXUD\x03RFRUUH\x03VXD\x03GLVVRFLDomR\x03IRUPDQGR\x03RV\x03tRQV\x031D + e Clí. Considere que esses íons ocupam os espaços LQWHUPROHFXODUHV\x03QD\x03VROXomR\x11 1HVWHV\x03UHFLSLHQWHV\x0f\x03D\x03SRVLomR\x03GH\x03HTXLOtEULR\x03GR\x03GHQVtPHWUR\x03 está representada em: AAB BAB CAB DAB EAB*DO0525AM12*&1\x03\x10\x03\x15\x9e\x03GLD\x03_\x03&DGHUQR\x03\x18\x03\x10\x03$0$5(/2\x03\x10\x033iJLQD\x03\x14\x16']"
128,A,,"['$\x03¿JXUD\x03UHSUHVHQWD\x03XP\x03SULVPD\x03ySWLFR\x0f\x03FRQVWLWXtGR\x03GH\x03XP\x03PDWHULDO \x03WUDQVSDUHQWH\x0f\x03FXMR\x03tQGLFH\x03GH\x03UHIUDomR\x03p\x03FUHVFHQWH\x03FRP\x03 a frequência da luz que sobre ele incide. Um feixe luminoso, composto por luzes vermelha, azul e verde, incide na face A, HPHUJH\x03QD\x03IDFH\x03%\x03H\x0f\x03DSyV\x03VHU\x03UHÀHWLGR\x03SRU\x03XP\x03HVSHOKR\x0f\x03LQFLGH\x03QX P\x03¿OPH\x03SDUD\x03IRWRJUD¿D\x03FRORULGD\x0f\x03UHYHODQGR\x03WUrV\x03SRQWRV\x11 Face A Face B Feixe incidente EspelhoPerfil do filme400 450 500 550 600 650 700 750 (nm)Violeta Azul Verde Amarelo Laranja Vermelho Prisma 2EVHUYDQGR\x03RV\x03SRQWRV\x03OXPLQRVRV\x03UHYHODGRV\x03QR\x03¿OPH\x0f\x03GH\x03EDL[R\x03SDUD \x03FLPD\x0f\x03FRQVWDWDP\x10VH\x03DV\x03VHJXLQWHV\x03FRUHV AVermelha, verde, azul. BVerde, vermelha, azul. CAzul, verde, vermelha. DVerde, azul, vermelha. EAzul, vermelha, verde.']"
129,B,,"[""7HQVRDWLYRV\x03VmR\x03FRPSRVWRV\x03RUJkQLFRV\x03TXH\x03SRVVXHP\x03FRPSRUWDPHQWR\x03D Q¿ItOLFR\x0f\x03LVWR\x03p\x0f\x03SRVVXHP\x03GXDV\x03UHJL}HV\x0f\x03 XPD\x03KLGURIyELFD\x03H\x03RXWUD\x03KLGURItOLFD\x11\x032\x03SULQFLSDO\x03WHQVRDWLYR\x03DQL {QLFR\x03VLQWpWLFR\x03VXUJLX\x03QD\x03GpFDGD\x03GH\x03\x14 \x17\x13\x03H\x03WHYH\x03JUDQGH\x03 DFHLWDomR\x03QR\x03PHUFDGR\x03GH\x03GHWHUJHQWHV\x03HP\x03UD]mR\x03GR\x03PHOKRU\x03GHVHPSHQ KR\x03FRPSDUDGR\x03DR\x03GR\x03VDEmR\x11\x031R\x03HQWDQWR\x0f\x03R\x03XVR\x03 GHVVH\x03SURGXWR\x03SURYRFRX\x03JUDQGHV\x03SUREOHPDV\x03DPELHQWDLV\x0f\x03GHQWUH\x03HOH V\x03D\x03UHVLVWrQFLD\x03j\x03GHJUDGDomR\x03ELROyJLFD\x0f\x03SRU\x03FDXVD\x03 GRV\x03GLYHUVRV\x03FDUERQRV\x03WHUFLiULRV\x03QD\x03FDGHLD\x03TXH\x03FRPS}H\x03D\x03SRUomR\x03 KLGURIyELFD\x03GHVVH\x03WHQVRDWLYR\x03DQL{QLFR\x11\x03$V\x03UDPL¿FDo}HV\x03 QD\x03FDGHLD\x03GL¿FXOWDP\x03VXD\x03GHJUDGDomR\x0f\x03OHYDQGR\x03j\x03SHUVLVWrQFLD\x03QR\x03P HLR\x03DPELHQWH\x03SRU\x03ORQJRV\x03SHUtRGRV\x11\x03,VVR\x03OHYRX\x03D\x03VXD\x03 VXEVWLWXLomR\x03QD\x03PDLRULD\x03GRV\x03SDtVHV\x03SRU\x03WHQVRDWLYRV\x03ELRGHJUDGiYH LV\x0f\x03RX\x03VHMD\x0f\x03FRP\x03FDGHLDV\x03DOTXtOLFDV\x03OLQHDUHV\x11 3(17($'2\x0f\x03-\x11\x03&\x11\x033\x11 \x03(/\x036(28'\x0f\x032\x11\x03$\x11 \x03&$59$/+2\x0f\x03/\x11\x035\x11\x03)\x11\x03>\x11\x11\x11@ \x03 XPD\x03DERUGDJHP\x03DPELHQWDO\x03H\x03DQDOtWLFD\x11\x03 Química Nova \x0f\x03Q\x11\x03\x18\x0f\x03\x15\x13\x13\x19\x03 DGDSWDGR \x11 Qual a fórmula estrutural do tensoativo persistente no ambiente mencionado no texto? "", '15 20OOH D ClN+ BSO3\x03\x03Na+ ECl N+ ', 'SO3\x03\x03Na+*DO0525AM13*&1\x03\x10\x03\x15\x9e\x03GLD\x03_\x03&DGHUQR\x03\x18\x03\x10\x03$0$5(/2\x03\x10\x033iJLQD\x03\x14\x17']"
130,E,,"[""&RQVLGHUH\x0f\x03HP\x03XP\x03IUDJPHQWR\x03DPELHQWDO\x0f\x03XPD\x03iUYRUH\x03PDWUL]\x03FRP\x03IUX WRV\x03 0 \x03H\x03RXWUDV\x03FLQFR\x03TXH\x03SURGX]LUDP\x03ÀRUHV\x03 H\x03VmR\x03DSHQDV\x03GRDGRUDV\x03GH\x03SyOHQ\x03 '3\x14\x0f\x03'3\x15\x0f\x03'3\x16\x0f\x03'3\x17\x03H\x03'3\x18 \x11\x03)RL\x03 H[FOXtGD\x03D\x03FDSDFLGDGH\x03GH\x03DXWRSROLQL]DomR\x03GDV\x03 árvores. Os genótipos da matriz, da semente (S1) e das prováveis fontes de pólen foram obtidos pela análise de dois ORFRV\x03 ORFR\x03$\x03H\x03ORFR\x03% \x03GH\x03PDUFDGRUHV\x03GH\x03'1$\x0f\x03FRQIRUPH\x03D\x03¿JXUD\x11 Esquema do Gel 1MS 1 D P 1 '3\x15 DP3 '3\x17 DP5 alelo 1 loco A DOHOR\x03\x15 alelo 3 DOHOR\x03\x17 Esquema GR\x03*HO\x03\x15MS 1 D P 1 '3\x15 DP3 '3\x17 DP5 alelo 1 loco B DOHOR\x03\x15 alelo 3DOHOR\x03\x17alelo 5 &2//(9$77,\x0f\x035\x11\x03*\x11 \x037(//(6\x0f\x030\x11\x033\x11 \x0362$5(6\x0f\x037\x11\x031\x11\x03'LVSHUVmR\x03GR\x03Sy OHQ\x03HQWUH\x03SHTXL]HLURV \x03XPD\x03DWLYLGDGH\x03SDUD\x03D\x03JHQpWLFD\x03GR\x03HQVLQR\x03 VXSHULRU\x11\x03 Genética na Escola \x0f\x03Q\x11\x03\x14\x0f\x03\x15\x13\x14\x16\x03 DGDSWDGR \x11 "", ""progênie S1 recebeu o pólen de qual doadora? ADP1 B'3\x15 CDP3 D'3\x17 EDP5""]"
131,B,,"['Em desenhos animados é comum vermos a personagem tentando impulsionar um barco soprando ar contra a vela para compensar a falta de vento. Algumas vezes usam o próprio fôlego, foles ou ventiladores. Estudantes de um laboratório didático resolveram investigar essa possibilidade. Para isso, usaram dois pequenos carros de plástico, A e B\x0f\x03LQVWDODUDP\x03VREUH\x03HVWHV\x03SHTXHQDV\x03YHQWRLQKDV\x03H\x03¿[DUDP\x03YHUWLFDOP HQWH\x03XPD\x03FDUWROLQD\x03GH\x03FXUYDWXUD\x03 SDUDEyOLFD\x03SDUD\x03GHVHPSHQKDU\x03XPD\x03IXQomR\x03DQiORJD\x03j\x03YHOD\x03GH\x03XP\x03EDU FR\x11\x031R\x03FDUUR\x03 B\x03LQYHUWHX\x10VH\x03R\x03VHQWLGR\x03GD\x03 YHQWRLQKD\x03H\x03PDQWHYH\x10VH\x03D\x03YHOD\x0f\x03D\x03¿P\x03GH\x03PDQWHU\x03DV\x03FDUDFWHUtVWLFD V\x03ItVLFDV\x03GR\x03EDUFR\x0f\x03PDVVD\x03H\x03IRUPDWR\x03GD\x03FDUWROLQD\x11\x03 $V\x03¿JXUDV\x03UHSUHVHQWDP\x03RV\x03FDUURV\x03SURGX]LGRV\x11\x03$\x03PRQWDJHP\x03GR\x03FDUUR \x03A\x03EXVFD\x03VLPXODU\x03D\x03VLWXDomR\x03GRV\x03GHVHQKRV\x03 animados, pois a ventoinha está direcionada para a vela. Carro A Carro B &RP\x03RV\x03FDUURV\x03RULHQWDGRV\x03GH\x03DFRUGR\x03FRP\x03DV\x03¿JXUDV\x0f\x03RV\x03HVWXGDQWHV \x03OLJDUDP\x03DV\x03YHQWRLQKDV\x0f\x03DJXDUGDUDP\x03R\x03ÀX[R\x03GH\x03 DU\x03¿FDU\x03SHUPDQHQWH\x03H\x03GHWHUPLQDUDP\x03RV\x03PyGXORV\x03GDV\x03YHORFLGDGHV\x03Pp GLDV\x03GRV\x03FDUURV\x03 A (V A) e B (VB) para o mesmo intervalo de tempo. ', 'respeito das intensidades das velocidades médias e do sentido de movimento do carro A, os estudantes observaram que: AVA 0; VB! 0; o carro A\x03QmR\x03V e move. B0 VA VB; o carro A se move para a direita. C0 VA VB; o carro A se move para a esquerda. D0 VB VA; o carro A se move para a direita. E0 VB VA; o carro A se move para a esquerda.*DO0525AM14*&1\x03\x10\x03\x15\x9e\x03GLD\x03_\x03&DGHUQR\x03\x18\x03\x10\x03$0$5(/2\x03\x10\x033iJLQD\x03\x14\x18']"
132,E,,"[""2\x03PDQHMR\x03DGHTXDGR\x03GR\x03VROR\x03SRVVLELOLWD\x03D\x03PDQXWHQomR\x03 de sua fertilidade à medida que as trocas de nutrientes HQWUH\x03PDWpULD\x03RUJkQLFD\x0f\x03iJXD\x0f\x03VROR\x03H\x03R\x03DU\x03VmR\x03PDQWLGDV\x03 SDUD\x03JDUDQWLU\x03D\x03SURGXomR\x11\x03$OJXPDV\x03HVSpFLHV\x03L{QLFDV\x03GH\x03DOXPtQLR\x03VmR\x03Wy[LFDV\x0f\x03QmR\x03Vy\x03SDUD\x03D\x03SODQWD\x0f\x03PDV\x03SDUD\x03muitos organismos como as bactérias responsáveis pelas transformações no ciclo do nitrogênio. O alumínio GDQL¿FD\x03DV\x03PHPEUDQDV\x03GDV\x03FpOXODV\x03GDV\x03UDt]HV\x03H\x03UHVWULQJH\x03 D\x03H[SDQVmR\x03GH\x03VXDV\x03SDUHGHV\x0f\x03FRP\x03LVVR\x0f\x03D\x03SODQWD\x03QmR\x03 cresce adequadamente. Para promover benefícios para a SURGXomR\x03DJUtFROD\x0f\x03p\x03UHFRPHQGDGD\x03D\x03UHPHGLDomR\x03GR\x03VROR\x03utilizando calcário (CaCO 3). %5$'<\x0f\x031\x11\x03&\x11 \x03:(,/\x0f\x035\x11\x035\x11\x03 Elementos da natureza e propriedades dos solos . 3RUWR\x03$OHJUH \x03%RRNPDQ\x0f\x03\x15\x13\x14\x16\x03 DGDSWDGR \x11 (VVD\x03UHPHGLDomR\x03SURPRYH\x03QR\x03VROR\x03R D AGLPLQXLomR\x03GR\x03S+\x0f\x03GHL[DQGR\x10R\x03IpUWLO\x11 BVROXELOL]DomR\x03GR\x03DOXPtQLR\x0f\x03RFRUUHQGR\x03VXD\x03OL[LYLDomR\x03 pela chuva. CLQWHUDomR\x03GR\x03tRQ\x03FiOFLR\x03FRP\x03R\x03tRQ\x03DOXPtQLR\x0f\x03SURGX]LQGR\x03 uma liga metálica. DUHDomR\x03GR\x03FDUERQDWR\x03GH\x03FiOFLR\x03FRP\x03RV\x03tRQV\x03DOXPtQLR\x0f\x03 formando alumínio metálico. Eaumento da sua alcalinidade, tornando os íons alumínio menos disponíveis.""]"
133,A,,"['Visando a melhoria estética de um veículo, o vendedor de uma loja sugere ao consumidor que ele troque as rodas de seu automóvel de aro 15 polegadas SDUD\x03DUR\x03\x14\x1a\x03SROHJDGDV\x0f\x03R\x03TXH\x03FRUUHVSRQGH\x03D\x03XP\x03GLkPHWUR\x03maior do conjunto roda e pneu. Duas consequências provocadas por essa troca de DUR\x03VmR A(OHYDU\x03 D\x03 SRVLomR\x03 GR\x03 FHQWUR\x03 GH\x03 PDVVD\x03 GR\x03 YHtFXOR\x03 WRUQDQGR\x10R\x03PDLV\x03LQVWiYHO\x03H\x03DXPHQWDU\x03D\x03YHORFLGDGH\x03GR\x03 DXWRPyYHO\x03HP\x03UHODomR\x03j\x03LQGLFDGD\x03QR\x03YHORFtPHWUR\x11 B$EDL[DU\x03D\x03SRVLomR\x03GR\x03FHQWUR\x03GH\x03PDVVD\x03GR\x03YHtFXOR\x03 WRUQDQGR\x10R\x03PDLV\x03LQVWiYHO\x03H\x03GLPLQXLU\x03D\x03YHORFLGDGH\x03GR\x03DXWRPyYHO\x03HP\x03UHODomR\x03j\x03LQGLFDGD\x03QR\x03YHORFtPHWUR\x11 C(OHYDU\x03 D\x03 SRVLomR\x03 GR\x03 FHQWUR\x03 GH\x03 PDVVD\x03 GR\x03 YHtFXOR\x03 WRUQDQGR\x10R\x03PDLV\x03HVWiYHO\x03H\x03DXPHQWDU\x03D\x03YHORFLGDGH\x03GR\x03 DXWRPyYHO\x03HP\x03UHODomR\x03j\x03LQGLFDGD\x03QR\x03YHORFtPHWUR\x11 D$EDL[DU\x03D\x03SRVLomR\x03GR\x03FHQWUR\x03GH\x03PDVVD\x03GR\x03YHtFXOR\x03 WRUQDQGR\x10R\x03PDLV\x03HVWiYHO\x03H\x03GLPLQXLU\x03D\x03YHORFLGDGH\x03GR\x03 DXWRPyYHO\x03HP\x03UHODomR\x03j\x03LQGLFDGD\x03QR\x03YHORFtPHWUR\x11 E(OHYDU\x03 D\x03 SRVLomR\x03 GR\x03 FHQWUR\x03 GH\x03 PDVVD\x03 GR\x03 YHtFXOR\x03 WRUQDQGR\x10R\x03PDLV\x03HVWiYHO\x03H\x03GLPLQXLU\x03D\x03YHORFLGDGH\x03GR\x03DXWRPyYHO\x03HP\x03UHODomR\x03j\x03LQGLFDG a no velocímetro.']"
134,E,,"[""As células e os organismos precisam realizar trabalho para permanecerem vivos e se reproduzirem. A energia PHWDEyOLFD\x03QHFHVViULD\x03SDUD\x03D\x03UHDOL]DomR\x03GHVVH\x03WUDEDOKR\x03p\x03RULXQGD\x03GD\x03R[LGDomR\x03GH\x03FRPEXVWtYHLV\x0f\x03JHUDGRV\x03QR\x03FLFOR\x03GR\x03carbono, por meio de processos capazes de interconverter diferentes formas da energia. 1(/621\x0f\x03'\x11\x03/\x11 \x03&2;\x0f\x030\x11\x030\x11\x03 Lehninger : princípios de bioquímica. 6mR\x033DXOR \x036DUYLHU\x0f\x03\x15\x13\x13\x15\x03 DGDSWDGR \x11 1HVVH\x03FLFOR\x0f\x03D\x03IRUPDomR\x03GH\x03FRPEXVWtYHLV\x03HVWi\x03YLQFXODGD\x03j\x03 FRQYHUVmR\x03GH\x03HQHUJLD Atérmica em cinética. Bquímica em térmica. Celetroquímica em calor. Dcinética em eletromagnética. Eeletromagnética em química.""]"
135,A,,"[""O petróleo é uma fonte de energia de baixo custo H\x03 GH\x03 ODUJD\x03 XWLOL]DomR\x03 FRPR\x03 PDWpULD\x10SULPD\x03 SDUD\x03 XPD\x03 grande variedade de produtos. É um óleo formado de várias substâncias de origem orgânica, em sua maioria hidrocarbonetos de diferentes massas molares. 6mR\x03XWLOL]DGDV\x03WpFQLFDV\x03GH\x03VHSDUDomR\x03SDUD\x03REWHQomR\x03dos componentes comercializáveis do petróleo. Além disso, para aumentar a quantidade de frações comercializáveis, otimizando o produto de origem fóssil, XWLOL]D\x10VH\x03R\x03SURFHVVR\x03GH\x03FUDTXHDPHQWR\x11 O que ocorre nesse processo? A7UDQVIRUPDomR\x03GDV\x03IUDo}HV\x03GR\x03SHWUyOHR\x03HP\x03RXWUDV\x03 moléculas menores. B5HDomR\x03 GH\x03 y[LGR\x10UHGXomR\x03 FRP\x03 WUDQVIHUrQFLD\x03 GH\x03 elétrons entre as moléculas. C6ROXELOL]DomR\x03GDV\x03IUDo}HV\x03GR\x03SHWUyOHR\x03FRP\x03D\x03XWLOL]DomR\x03 de diferentes solventes. D'HFDQWDomR\x03GDV\x03PROpFXODV\x03FRP\x03GLIHUHQWHV\x03PDVVDV\x03 molares pelo uso de centrífugas. E6HSDUDomR\x03GRV\x03GLIHUHQWHV\x03FRPSRQHQWHV\x03GR\x03SHWUyOHR\x03 em funomR\x03GH\x03VXDV\x03 tempHUDWXUDV\x03GH\x03HEXOLomR\x11*DO0525AM15*07\x03\x10\x03\x15\x9e\x03GLD\x03_\x03&DGHUQR\x03\x18\x03\x10\x03$0$5(/2\x03\x10\x033iJLQD\x03\x14\x19MATEMÁTICA E SUAS TECNOLOGIAS Questões de 136 a 180""]"
136,A,"Numa atividade de treinamento realizada no Exército de um determinado país, três equipes – Alpha, Beta e Gama – foram designadas a percorrer diferentes caminhos, todos com os mesmos pontos de partida e de chegada. A equipe Alpha realizou seu percurso em 90 minutos com uma velocidade média de 6,0 km/h. A equipe Beta também percorreu sua trajetória em 90 minutos, mas sua velocidade média foi de 5,0 km/h. Com uma velocidade média de 6,5 km/h, a equipe Gama concluiu seu caminho em 60 minutos. Com base nesses dados, foram comparadas as distâncias d Beta;dAlphaedGama percorridas pelas três equipes. ","['ordem das distâncias percorridas pelas equipes Alpha, Beta e Gama é ', '', '', '', 'E']"
137,D,,"[""O colesterol total de uma pessoa é obtido pela soma da taxa do seu “colesterol bom” com a taxa do seu “colesterol ruim”. Os exames periódicos, realizados em um paciente adulto, apresentaram taxa normal de “colesterol bom”, porém, taxa do “colesterol ruim” WDPEpP\x03FKDPDGR\x03/'/ \x03GH\x03\x15\x1b\x13\x03PJ\x12G/\x11 2\x03TXDGUR\x03DSUHVHQWD\x03XPD\x03FODVVL¿FDomR\x03GH\x03DFRUGR\x03FRP\x03 DV\x03WD[DV\x03GH\x03/'/\x03HP\x03DGXOWRV\x11 Taxa de LDL (mg/dL) Ótima Menor do que 100 Próxima de ótima 'H\x03\x14\x13\x13\x03D\x03\x14\x15 /LPLWH De 130 a 159 Alta De 160 a 189 Muito alta 190 ou mais 'LVSRQtYHO\x03HP \x03ZZZ\x11PLQKDYLGD\x11FRP\x11EU\x11\x03$FHVVR\x03HP \x03\x14\x18\x03RXW\x11\x03\x15\x13\x14\x18\x03 D GDSWDGR \x11 O paciente, seguindo as recomendações médicas VREUH\x03HVWLOR\x03GH\x03YLGD\x03H\x03DOLPHQWDomR\x0f\x03UHDOL]RX\x03R\x03H[DPH\x03ORJR\x03DSyV\x03R\x03SULPHLUR\x03PrV\x0f\x03H\x03D\x03WD[D\x03GH\x03/'/\x03UHGX]LX\x03\x15\x18\x08\x11\x03No mês seguinte, realizou novo exame e constatou uma UHGXomR\x03GH\x03PDLV\x03\x15\x13\x08\x03QD\x03WD[D\x03GH\x03/'/\x11De acordo com o resultado do segundo exame, a FODVVL¿FDomR\x03GD\x03WD[D\x03GH\x03/'/\x03GR\x03SDFLHQWH\x03p Aótima. Bpróxima de ótima. Climite. Dalta. Emuito alta.""]"
138,A,,"['Uma empresa deseja iniciar uma campanha SXEOLFLWiULD\x03 GLYXOJDQGR\x03 XPD\x03 SURPRomR\x03 SDUD\x03 VHXV\x03possíveis consumidores. Para esse tipo de campanha, RV\x03PHLRV\x03PDLV\x03YLiYHLV\x03VmR\x03D\x03GLVWULEXLomR\x03GH\x03SDQÀHWRV\x03QD\x03UXD\x03H\x03DQ~QFLRV\x03QD\x03UiGLR\x03ORFDO\x11\x03&RQVLGHUD\x10VH\x03TXH\x03D\x03SRSXODomR\x03DOFDQoDGD\x03SHOD\x03GLVWULEXLomR\x03GH\x03SDQÀHWRV\x03VHMD\x03LJXDO\x03j\x03TXDQWLGDGH\x03GH\x03SDQÀHWRV\x03GLVWULEXtGRV\x0f\x03HQTXDQWR\x03que a alcançada por um anúncio na rádio seja igual à quantidade de ouvintes desse anúncio. O custo de cada DQ~QFLR\x03QD\x03UiGLR\x03p\x03GH\x035\x07\x03\x14\x15\x13\x0f\x13\x13\x0f\x03H\x03D\x03HVWLPDWLYD\x03p\x03GH\x03 TXH\x03VHMD\x03RXYLGR\x03SRU\x03\x14\x03\x18\x13\x13\x03SHVVRDV\x11\x03-i\x03D\x03SURGXomR\x03H\x03D\x03GLVWULEXLomR\x03GRV\x03SDQÀHWRV\x03FXVWDP\x035\x07\x03\x14\x1b\x13\x0f\x13\x13\x03FDGD\x031 000 unidades. Considerando que cada pessoa será DOFDQoDGD\x03SRU\x03XP\x03~QLFR\x03GHVVHV\x03PHLRV\x03GH\x03GLYXOJDomR\x0f\x03D\x03 empresa pretende investir em ambas as mídias. Considere X e Yos valores (em real) gastos em DQ~QFLRV\x03QD\x03UiGLR\x03H\x03FRP\x03SDQÀHWRV\x0f\x03UHVSHFWLYDPHQWH\x11 O número de pessoas alcançadas pela campanha será GDGR\x03SHOD\x03H[SUHVVmR ', '50 450 9XY\x0e B50 950 4XY\x0e C4 504 50XY\x0e D50 450 9XY\x0e E50 950Y 4XY+dd dGama Beta Alpha dd dAlpha Beta Gama=< dd dGama Beta Alpha<= dd dBeta Alpha Gama dddGama Alpha Beta *DO0525AM16*07\x03\x10\x03\x15\x9e\x03GLD\x03_\x03&DGHUQR\x03\x18\x03\x10\x03$0$5(/2\x03\x10\x033iJLQD\x03\x14\x1a']"
139,E,,"[""O remo de assento deslizante é um esporte que faz uso de um barco e dois remos do mesmo tamanho. $\x03¿JXUD\x03PRVWUD\x03XPD\x03GDV\x03SRVLo}HV\x03GH\x03XPD\x03WpFQLFD\x03 chamada afastamento. 'LVSRQtYHO\x03HP \x03ZZZ\x11UHPREUDVLO\x11FRP\x11\x03$FHVVR\x03HP \x03\x19\x03GH]\x11\x03\x15\x13\x14\x1a\x03 DGDS WDGR \x11 1HVVD\x03SRVLomR\x0f\x03RV\x03GRLV\x03UHPRV\x03VH\x03HQFRQWUDP\x03QR\x03SRQWR\x03 A\x03 H\x03 VXDV\x03 RXWUDV\x03 H[WUHPLGDGHV\x03 HVWmR\x03 LQGLFDGDV\x03 SHORV\x03 pontos BeC. Esses três pontos formam um triângulo ABC cujo ângulo BÂC\x03WHP\x03PHGLGD\x03GH\x03\x14\x1a\x13\x83\x11 O tipo de triângulo com vértices nos pontos A,B e C, no PRPHQWR\x03HP\x03TXH\x03R\x03UHPDGRU\x03HVWi\x03QHVVD\x03SRVLomR\x0f\x03p Aretângulo escaleno. Bacutângulo escaleno. Cacutângulo isósceles. Dobtusângulo escaleno. Eobtusângulo isósceles.""]"
140,D,,"['8P\x03UDSD]\x03HVWXGD\x03HP\x03XPD\x03HVFROD\x03TXH\x03¿FD\x03ORQJH\x03GH\x03 sua casa, e por isso precisa utilizar o transporte público. Como é muito observador, todos os dias ele anota a hora exata (sem considerar os segundos) em que o ônibus passa pelo ponto de espera. Também notou que nunca consegue chegar ao ponto de ônibus antes de 6 h 15 min GD\x03PDQKm\x11\x03$QDOLVDQGR\x03RV\x03GDGRV\x03FROHWDGRV\x03GXUDQWH\x03R\x03PrV\x03 GH\x03IHYHUHLUR\x0f\x03R\x03TXDO\x03WHYH\x03\x15\x14\x03GLDV\x03OHWLYRV\x0f\x03HOH\x03FRQFOXLX\x03TXH\x03 \x19\x03K\x03\x15\x14\x03PLQ\x03IRL\x03R\x03TXH\x03PDLV\x03VH\x03UHSHWLX\x0f\x03H\x03TXH\x03D\x03PHGLDQD\x03GR\x03FRQMXQWR\x03GH\x03GDGRV\x03p\x03\x19\x03K\x03\x15\x15\x03PLQ\x11 ', 'probabilidade de que, em algum dos dias letivos de fevereiro, esse rapaz tenha apanhado o ônibus antes de \x19\x03K\x03\x15\x14\x03PLQ\x03GD\x03PDQKm\x03p\x0f\x03QR\x03Pi[LPR\x0f ', '4 21 B5 21 C6 21 D7 21 E8 21']"
141,A,,"[""8P\x03PDSD\x03p\x03D\x03UHSUHVHQWDomR\x03UHGX]LGD\x03H\x03VLPSOL¿FDGD\x03 GH\x03XPD\x03ORFDOLGDGH\x11\x03(VVD\x03UHGXomR\x0f\x03TXH\x03p\x03IHLWD\x03FRP\x03R\x03XVR\x03 GH\x03 XPD\x03 HVFDOD\x0f\x03 PDQWpP\x03 D\x03 SURSRUomR\x03 GR\x03 HVSDoR\x03UHSUHVHQWDGR\x03HP\x03UHODomR\x03DR\x03HVSDoR\x03UHDO\x11 Certo mapa tem escala 1 : 58 000 000. 'LVSRQtYHO\x03HP \x03KWWS \x12\x12REORJGHGD\\QDEULJWK\x11EORJVSRW\x11FRP\x11EU\x11\x03$FHVV R\x03HP \x03 \x03DJR\x11\x03\x15\x13\x14\x15\x11 Considere que, nesse mapa, o segmento de reta que OLJD\x03R\x03QDYLR\x03j\x03PDUFD\x03GR\x03WHVRXUR\x03PHoD\x03\x1a\x0f\x19\x03FP\x11 "", 'medida real, em quilômetro, desse segmento de reta é A\x17\x03\x17\x13\x1b\x11 B\x1a\x03\x19\x16\x15\x11 C\x17\x17\x03\x13\x1b\x13\x11 D\x1a\x19\x03\x16\x14\x19\x11 E\x17\x17\x13\x03\x1b\x13\x13\x11']"
142,B,,"['Um produtor de milho utiliza uma área de 160 hectares para as suas atividades agrícolas. Essa área é dividida em GXDV\x03SDUWHV \x03XPD\x03GH\x03\x17\x13\x03KHFWDUHV\x0f\x03FRP\x03PDLRU\x03SURGXWLYLGDGH\x0f\x03H\x03 RXWUD\x0f\x03 GH\x03 \x14\x15\x13\x03 KHFWDUHV\x0f\x03 FRP\x03 PHQRU\x03 SURGXWLYLGDGH\x11\x03$\x03SURGXWLYLGDGH\x03p\x03GDGD\x03SHOD\x03UD]mR\x03HQWUH\x03D\x03SURGXomR\x0f\x03HP\x03WRQHODGD\x0f\x03H\x03D\x03iUHD\x03FXOWLYDGD\x11\x036DEH\x10VH\x03TXH\x03D\x03iUHD\x03GH\x03\x17\x13\x03 KHFWDUHV\x03 WHP\x03 SURGXWLYLGDGH\x03 LJXDO\x03 D\x03 \x15\x0f\x18\x03 YH]HV\x03 j\x03da outra. Esse fazendeiro pretende aumentar sua SURGXomR\x03WRWDO\x03HP\x03\x14\x18\x08\x0f\x03DXPHQWDQGR\x03R\x03WDPDQKR\x03GD\x03sua propriedade. Para tanto, pretende comprar uma parte de uma fazenda vizinha, que possui a mesma SURGXWLYLGDGH\x03GD\x03SDUWH\x03GH\x03\x14\x15\x13\x03KHFWDUHV\x03GH\x03VXDV\x03WHUUDV\x11 Qual é a área mínima, em hectare, que o produtor precisará comprar? A36 B33 C\x15\x1a D\x15\x17 E\x15\x14 *DO0525AM17*07\x03\x10\x03\x15\x9e\x03GLD\x03_\x03&DGHUQR\x03\x18\x03\x10\x03$0$5(/2\x03\x10\x033iJLQD\x03\x14\x1b']"
143,B,,"['', 'raiva é uma doença viral e infecciosa, transmitida SRU\x03PDPtIHURV\x11\x03$\x03FDPSDQKD\x03QDFLRQDO\x03GH\x03YDFLQDomR\x03DQWLUUiELFD\x03WHP\x03R\x03REMHWLYR\x03GH\x03FRQWURODU\x03D\x03FLUFXODomR\x03do vírus da raiva canina e felina, prevenindo a raiva humana. O gráfico mostra a cobertura (porcentagem GH\x03YDFLQDGRV \x03GD\x03FDPSDQKD\x0f\x03HP\x03FmHV\x0f\x03QRV\x03DQRV\x03GH\x03\x15\x13\x14\x16\x0f\x03\x15\x13\x14\x18\x03H\x03\x15\x13\x14\x1a\x0f\x03QR\x03PXQLFtSLR\x03GH\x03%HOR\x03+RUL]RQWH\x0f\x03em Minas Gerais. Os valores das coberturas dos DQRV\x03 GH\x03 \x15\x13\x14\x17\x03 H\x03 \x15\x13\x14\x19\x03 QmR\x03 HVWmR\x03 LQIRUPDGRV\x03 QR\x03JUiILFR\x03 H\x03 GHVHMD\x10VH\x03 HVWLPi\x10ORV\x11\x03 3DUD\x03 WDO\x0f\x03 OHYRX\x10VH\x03HP\x03 FRQVLGHUDomR\x03 TXH\x03 D\x03 YDULDomR\x03 QD\x03 FREHUWXUD\x03 GH\x03 YDFLQDomR\x03GD\x03FDPSDQKD\x03DQWLUUiELFD\x0f\x03QRV\x03SHUtRGRV\x03GH\x03 \x15\x13\x14\x16\x03D\x03\x15\x13\x14\x18\x03H\x03GH\x03\x15\x13\x14\x18\x03D\x03\x15\x13\x14\x1a\x0f\x03GHX\x10VH\x03GH\x03IRUPD\x03OLQHDU\x11 201367% 59%61% 2014 2015 2016 2017 \'LVSRQtYHO\x03HP \x03KWWS \x12\x12SQL\x11GDWDVXV\x11JRY\x11EU\x11\x03$FHVVR\x03HP \x03\x18\x03QRY\x11\x03\x15\x13\x14 \x1a\x11 4XDO\x03WHULD\x03VLGR\x03D\x03FREHUWXUD\x03GHVVD\x03FDPSDQKD\x03QR\x03DQR\x03GH\x03\x15\x13\x14\x17"" A\x19\x15\x0f\x16\x08 B\x19\x16\x0f\x13\x08 C\x19\x16\x0f\x18\x08 D\x19\x17\x0f\x13\x08 E\x19\x18\x0f\x18\x08']"
144,C,,"['8PD\x03 HPSUHVD\x03 GH\x03 FRPXQLFDomR\x03 WHP\x03 D\x03 WDUHID\x03 GH\x03 elaborar um material publicitário de um estaleiro para divulgar um novo navio, equipado com um guindaste de 15 m de altura e uma esteira de 90 m de comprimento. 1R\x03GHVHQKR\x03GHVVH\x03QDYLR\x0f\x03D\x03UHSUHVHQWDomR\x03GR\x03JXLQGDVWH\x03deve ter sua altura entre 0,5 cm e 1 cm, enquanto a HVWHLUD\x03GHYH\x03DSUHVHQWDU\x03FRPSULPHQWR\x03VXSHULRU\x03D\x03\x17\x03FP\x11\x037RGR\x03R\x03GHVHQKR\x03GHYHUi\x03VHU\x03IHLWR\x03HP\x03XPD\x03HVFDOD\x03\x14\x03 \x03;\x11 2V\x03YDORUHV\x03SRVVtYHLV\x03SDUD\x03;\x03VmR\x0f\x03DSHQDV\x0f A;\x03! 1 500. B;\x03 3 000. C1 500 \x03;\x03 \x03\x15\x03\x15\x18\x13\x11 D1 500 \x03;\x03 3 000. E\x15\x03\x15\x18\x13\x03 \x03;\x03 3 000.']"
145,A,,"[""(P\x03 \x15\x13\x14\x17\x03 IRL\x03 LQDXJXUDGD\x03 D\x03 PDLRU\x03 URGD\x10JLJDQWH\x03 GR\x03 mundo, a High Roller \x0f\x03VLWXDGD\x03HP\x03/DV\x039HJDV\x11\x03$\x03¿JXUD\x03 UHSUHVHQWD\x03XP\x03HVERoR\x03GHVVD\x03URGD\x10JLJDQWH\x0f\x03QR\x03TXDO\x03R\x03ponto A representa uma de suas cadeiras: Solo SoloA O 'LVSRQtYHO\x03HP \x03KWWS \x12\x12HQ\x11ZLNLSHGLD\x11RUJ\x11\x03$FHVVR\x03HP \x03\x15\x15\x03DEU\x11\x03\x15\x13\x14\x17 \x03 DGDSWDGR \x11 $\x03SDUWLU\x03GD\x03SRVLomR\x03LQGLFDGD\x0f\x03HP\x03TXH\x03R\x03VHJPHQWR\x03 OA VH\x03HQFRQWUD\x03SDUDOHOR\x03DR\x03SODQR\x03GR\x03VROR\x0f\x03URWDFLRQD\x10VH\x03D\x03 High Roller \x03QR\x03VHQWLGR\x03DQWL\x10KRUiULR\x0f\x03HP\x03WRUQR\x03GR\x03SRQWR\x03 O. Sejam t o ângulo determinado pelo segmento OA em UHODomR\x03j\x03VXD\x03SRVLomR\x03LQLFLDO\x0f\x03H\x03 f\x03D\x03IXQomR\x03TXH\x03GHVFUHYH\x03 a altura do ponto A\x0f\x03HP\x03UHODomR\x03DR\x03VROR\x0f\x03HP\x03IXQomR\x03GH\x03 t. Após duas voltas completas, f\x03WHP\x03R\x03VHJXLQWH\x03JUi¿FR $\x03H[SUHVVmR\x03GD\x03IXQomR\x03DOWXUD\x03p\x03GDGD\x03SRU Aft s e nt() ()=+80 88 Bft c o st() ()=+80 88 Cft c o st() ()=+88 168 Df t sen t cos t() () ()=+168 88 Ef t sen t cos t() () ()=+88 168168 88 0 /2 2 t(radiano) 4(metro)f S S S*DO0525AM18*07\x03\x10\x03\x15\x9e\x03GLD\x03_\x03&DGHUQR\x03\x18\x03\x10\x03$0$5(/2\x03\x10\x033iJLQD\x03\x14""]"
146,A,,"['Minecraft é um jogo virtual que pode auxiliar no desenvolvimento de conhecimentos relacionados a espaço e forma. É possível criar casas, edifícios, monumentos e até naves espaciais, tudo em escala real, através do empilhamento de cubinhos. 8P\x03MRJDGRU\x03GHVHMD\x03FRQVWUXLU\x03XP\x03FXER\x03FRP\x03GLPHQV}HV\x03\x17\x03 u\x03\x17\x03u\x03\x17\x11\x03(OH\x03Mi\x03HPSLOKRX\x03DOJXQV\x03GRV\x03FXELQKRV\x03QHFHVViULRV\x0f\x03 FRQIRUPH\x03D\x03¿JXUD\x11 + + + 2V\x03FXELQKRV\x03TXH\x03DLQGD\x03IDOWDP\x03HPSLOKDU\x03SDUD\x03¿QDOL]DU\x03D\x03FRQVWUXom R\x03GR\x03FXER\x0f\x03MXQWRV\x0f\x03IRUPDP\x03XPD\x03SHoD\x03~QLFD\x0f\x03FDSD]\x03 de completar a tarefa. 2\x03IRUPDWR\x03GD\x03SHoD\x03FDSD]\x03GH\x03FRPSOHWDU\x03R\x03FXER\x03\x17\x03 u\x03\x17\x03u\x03\x17\x03p ', ' D B E ', '*DO0525AM19*07\x03\x10\x03\x15\x9e\x03GLD\x03_\x03&DGHUQR\x03\x18\x03\x10\x03$0$5(/2\x03\x10\x033iJLQD\x03\x15\x13']"
